Title,Runtime (minutes),Language,Overview,Release Year,Genre,Keywords,Actors,Directors,Stream,Buy,Rent,Production Companies,Website
Tribute to a Bad Man,95,English,"Jeremy Rodock is a tough horse rancher who strings up rustlers soon as look at them. Fresh out of Pennsylvania, Steve Miller finds it hard to get used to Rodock's ways, although he takes an immediate shine to his Greek girl Jocasta.",1956,Western,"based on novel or book, ranch","Don Dubbins, Stephen McNally, James Cagney, Vic Morrow, Irene Papas",Robert Wise,,,,Metro-Goldwyn-Mayer,Unknown
"Toto, Peppino, and the Hussy",101,Italian,"Antonio, Peppino and Lucia are three brothers who live in the country near Naples. Lucia's son, Gianni, goes to Naples to study medicine, but there he knows a ballet dancer. They fall in love and, when she goes to Milan, Gianni follows her. Informed of this and afraid that their nephew will stop studying, the three Caponi brothers leave for Milan to persuade Gianni to come back and continue studying and abandon the ""Malafemmina"" (bad girl).",1956,"Comedy, Romance",None,"Dorian Gray, Teddy Reno, Peppino De Filippo, Vittoria Crispo, Totò",Camillo Mastrocinque,,Amazon Video ,Amazon Video ,D.D.L.,Unknown
The Solid Gold Cadillac,99,English,"Laura Partridge is a very enthusiastic small stockholder of 10 shares in International Projects, a large corporation based in New York. She attends her first stockholder meeting ready to question the board of directors from their salaries to their operations.",1956,"Comedy, Romance","cadillac, based on play or musical, corporation, stockholder meeting, stockholder","John Williams, Hiram Sherman, Paul Douglas, Fred Clark, Judy Holliday",Richard Quine,,"Apple TV, Amazon Video, Google Play Movies, YouTube, Vudu ","Apple TV, Amazon Video, Google Play Movies, YouTube, Vudu ",Columbia Pictures,Unknown
Street of Shame,87,Japanese,The lives of five prostitutes employed at a Japanese brothel while the nation is debating the passage of an anti-prostitution law.,1956,Drama,"prostitute, based on novel or book, despair, brothel, tokyo, japan, poverty, post war japan, shame","Michiyo Kogure, Ayako Wakao, Kumeko Urabe, Aiko Mimasu, Machiko Kyō",Kenji Mizoguchi,Criterion Channel ,,,Daiei Film,Unknown
Sissi: The Young Empress,107,German,"Sissi is now the empress of Austria and attempts to learn etiquette. While she is busy being empress she also has to deal with her difficult new mother-in-law, while the arch-duchess Sophie is trying to tell the emperor how to rule and also Sissi how to be a mother.",1956,"Drama, Comedy, Romance","husband wife relationship, pregnancy, alpine hut, homeland, bavaria, germany, bad mother-in-law, mountain, hungary, coronation, harassment, alp, tyrol, hiking, biography, historical figure, empress, royalty, period drama, royal court, habsburger","Karlheinz Böhm, Gustav Knuth, Vilma Degischer, Magda Schneider, Romy Schneider",Ernst Marischka,,"Apple TV, Amazon Video, Google Play Movies, YouTube, Vudu ","Apple TV, Amazon Video, Google Play Movies, YouTube, Vudu ",Erma-Film,Unknown
Never Say Goodbye,96,English,"In present-day U.S., Dr. Michael Parker, a prominent surgeon, unexpectedly runs into his German-born wife whom he thought was dead. Victor, an artist and his ""dead"" wife's now boyfriend, berates Dr. Parker for ""killing"" her. The bulk of the story flashes back to Austria during World War II as we learn how Dr. Parker met and married his wife, and the one mistake that may have cost him his family.",1956,"Drama, Romance","new york city, love triangle, screwball comedy","George Sanders, Shelley Fabares, Cornell Borchers, Ray Collins, Rock Hudson","Douglas Sirk, Jerry Hopper",,,,Universal International Pictures,Unknown
7 Men from Now,78,English,A former sheriff relentlessly pursuing the 7 men who murdered his wife in Arizona crosses paths with a couple heading to California.,1956,Western,"sheriff, outlaw, wells fargo","Randolph Scott, Lee Marvin, Gail Russell, John Larch, Walter Reed",Budd Boetticher,,"Apple TV, Amazon Video, YouTube, Vudu ","Apple TV, Amazon Video, YouTube, Vudu ","Batjac Productions, Warner Bros. Pictures",Unknown
The Last Hunt,108,English,"A buffalo hunter has a falling-out with his partner, who kills for fun.",1956,Western,buffalo,"Debra Paget, Lloyd Nolan, Robert Taylor, Russ Tamblyn, Stewart Granger",Richard Brooks,TCM ,"Apple TV, Amazon Video, Google Play Movies, YouTube, Vudu ","Apple TV, Amazon Video, Google Play Movies, YouTube, Vudu ",Metro-Goldwyn-Mayer,Unknown
Jubal,100,English,"Jubal Troop is a cowboy who is found in a weakened condition, without a horse. He is given shelter at Shep Horgan's large ranch, where he quickly makes an enemy in foreman Pinky, a cattleman who accuses Jubal of carrying the smell of sheep.",1956,"Western, Drama","ranger, shootout, wagon train","Glenn Ford, Ernest Borgnine, Rod Steiger, Felicia Farr, Valerie French",Delmer Daves,,"Apple TV, Amazon Video, Google Play Movies, YouTube, Vudu ","Amazon Video, Google Play Movies, YouTube, Vudu ",Columbia Pictures,Unknown
The Battle of the River Plate,119,English,"In the early years of the World War II, the Royal Navy is fighting a desperate battle to keep the Atlantic convoy routes open to supply the British Isles, facing the great danger posed by the many German warships, such as the Admiral Graf Spee, which are scouring the ocean for cargo ships to sink.",1956,"Drama, History, War","atlantic ocean, world war ii, royal navy, naval warfare, german navy, montevideo, uruguay","Ian Hunter, Anthony Quayle, Jack Gwillim, John Gregson, Bernard Lee","Emeric Pressburger, Michael Powell",FlixFling ,FlixFling ,FlixFling ,The Archers,Unknown
The Man Who Knew Too Much,120,English,"A couple vacationing in Morocco with their young son accidentally stumble upon an assassination plot. When the child is kidnapped to ensure their silence, they have to take matters into their own hands to save him.",1956,"Thriller, Mystery","london, england, assassination, espionage, spy, scotland yard, bus, paranoia, morocco, remake, conspiracy, whodunit, british spy, american, physician, frenchman, assassination attempt, cymbals, assassination plot","Doris Day, Bernard Miles, Brenda De Banzie, James Stewart, Ralph Truman",Alfred Hitchcock,,"Apple TV, Amazon Video, Google Play Movies, YouTube, Vudu, Microsoft Store ","Apple TV, Amazon Video, Google Play Movies, YouTube, Vudu, Microsoft Store ",Paramount,Unknown
Earth vs. the Flying Saucers,83,English,"Test space rockets exploding at liftoff and increased reporting of UFO sightings culminate in a direct attempt by alien survivors of a dead, extra-galactic civilization to invade Earth from impervious flying saucers, using ray-weapons of mass destruction.",1956,"Action, Science Fiction","washington dc, usa, flying saucer, us army, stop motion, alien invasion, scientist hero, global threat, space program, ray harryhausen, property destruction, land-air battle, ray weapons, sonic weapon, foo lights, rocket launch site","Morris Ankrum, Donald Curtis, Joan Taylor, Thomas Browne Henry, Hugh Marlowe",Fred F. Sears,,"Apple TV, Amazon Video, Google Play Movies, YouTube, Vudu ","Apple TV, Amazon Video, Google Play Movies, YouTube, Vudu ","Clover Productions, Columbia Pictures",Unknown
...And God Created Woman,92,French,"Juliette Hardy is sexual dynamite, and has the men of a French coastal town panting. But Antoine, the only man who affects her likewise, wouldn't dream of settling down with a woman his friends consider the town tramp.",1956,"Drama, Romance","lolita, adoption, saint-tropez, france","Jean-Louis Trintignant, Brigitte Bardot, Curd Jürgens, Jean Tissier, Jane Marken",Roger Vadim,"Max, Max Amazon Channel, Criterion Channel, TCM ",,,"Iéna Productions, Cocinor, Crow Productions",Unknown
The King and I,133,English,"Widowed Welsh mother Anna Loenowens becomes a governess and English tutor to the wives and many children of the stubborn King Mongkut of Siam. Anna and the King have a clash of personalities as she works to teach the royal family about the English language, customs and etiquette, and rushes to prepare a party for a group of European diplomats who must change their opinions about the King.",1956,"Drama, Romance, Adventure, Music","temple, widow, prime minister, letter, bangkok, thailand, palace, musical, polygamy, buddha, based on play or musical, misunderstanding, single mother, twins, tutor, chopsticks, chakri dynasty, school teacher, barge, sailing ship, pagoda, consort, dowry, malaria, siam","Martin Benson, Deborah Kerr, Yul Brynner, Terry Saunders, Rita Moreno",Walter Lang,,,,20th Century Fox,Unknown
Comanche,87,English,Common efforts of the U.S. government and the Comanche nation to negotiate a peace treaty are sabotaged by renegade Indians and by the short-sighted Indian Commissioner.,1956,"Western, History, Romance","kiss, love, comanche","Stacy Harris, Nestor Paiva, Henry Brandon, Dana Andrews, Kent Smith",George Sherman,ScreenPix Apple TV Channel ,,,"United Artists, Carl Krueger Productions",Unknown
Davy Crockett and the River Pirates,81,English,"Davy Crockett and his sidekick Georgie compete against boastful Mike Fink (""King of the River"") in a boat race to New Orleans. Later, Davy and Georgie, allied with Fink, battle a group of river pirates trying to pass themselves off as Native Americans.",1956,"Adventure, Family, Western",river,"Clem Bevans, Jeff York, Buddy Ebsen, Kenneth Tobey, Fess Parker",Norman Foster,Disney Plus ,"Apple TV, Amazon Video, Google Play Movies, YouTube, Vudu, Microsoft Store ","Apple TV, Amazon Video, Google Play Movies, YouTube, Vudu, Microsoft Store ",Walt Disney Productions,Unknown
Totò Double or Nothing?,92,Italian,"The penniless Duke decides to participate in ""Lascia o raddoppia"", a TV quiz show, in order to win five million lira. Then two gangsters bet between themselves on his success and, alas, the Duke is kidnapped.",1956,Comedy,None,"Valeria Moriconi, Dorian Gray, Mike Bongiorno, Gabriele Tinti, Totò",Camillo Mastrocinque,,,,"Titanus, Athena Cinematografica",Unknown
Raw Edge,76,English,A Texan arrives in Oregon and seeks justice for his innocently-hanged brother,1956,"Romance, Western","rape, revenge, lynching","Yvonne De Carlo, Rory Calhoun, Rex Reason, Mara Corday, Neville Brand",John Sherwood,,,,Universal International Pictures,Unknown
The Rainmaker,121,English,"Lizzie Curry is on the verge of becoming a hopeless old maid. Her wit and intelligence and skills as a homemaker can't make up for the fact that she's just plain plain! Even the town sheriff, File, for whom she harbors a secrect yen, won't take a chance --- until the town suffers a drought and into the lives of Lizzie and her brothers and father comes one Bill Starbuck ... profession: Rainmaker!",1956,"Romance, Western",western,"Katharine Hepburn, Burt Lancaster, Wendell Corey, Lloyd Bridges, Earl Holliman",Joseph Anthony,,"Apple TV, Google Play Movies, YouTube, Vudu, Microsoft Store ","Apple TV, Amazon Video, Google Play Movies, YouTube, Vudu, Microsoft Store ","Hal Wallis Productions, Paramount",Unknown
"Totò, Peppino e i fuorilegge",98,Italian,"Antonio and Peppino live in a small town in central Italy: Peppino is the barber, Totò is maintained by the rich but avaricious wife Teresa.",1956,Comedy,"italian, ransom, deception","Teddy Reno, Franco Interlenghi, Titina De Filippo, Peppino De Filippo, Totò",Camillo Mastrocinque,,,,"Cineriz, D.D.L., Manenti Film",Unknown
Moby Dick,116,English,"In 1841, young Ishmael signs up for service aboard the Pequod, a whaler sailing out of New Bedford. The ship is under the command of Captain Ahab, a strict disciplinarian who exhorts his men to find Moby Dick, the great white whale. Ahab lost his his leg to that creature and is desperate for revenge. As the crew soon learns, he will stop at nothing to gain satisfaction.",1956,"Adventure, Drama","captain, stroke of fate, based on novel or book, whale, obsession, boat, shipwreck, walrus, revenge, whaling ship, 19th century","James Robertson Justice, Gregory Peck, Harry Andrews, Richard Basehart, Leo Genn",John Huston,"fuboTV, MGM Plus Amazon Channel, MGM Plus Roku Premium Channel ","Apple TV, Amazon Video, Google Play Movies, YouTube, Vudu, Microsoft Store ","Apple TV, Amazon Video, Google Play Movies, YouTube, Vudu, Microsoft Store, Spectrum On Demand ","Moulin Productions Inc., Warner Bros. Pictures",Unknown
War and Peace,208,English,Napoleon's tumultuous relations with Russia including his disastrous 1812 invasion serve as the backdrop for the tangled personal lives of two aristocratic families.,1956,"War, Romance, Drama, History","epic, winter, marriage, napoleon bonaparte, family, napoleonic wars, pistol duel, technicolor","Vittorio Gassman, Herbert Lom, Mel Ferrer, Henry Fonda, Audrey Hepburn",King Vidor,Hoopla ,"Apple TV, Amazon Video, Google Play Movies, YouTube, Vudu, Microsoft Store ","Apple TV, Amazon Video, Google Play Movies, YouTube, Vudu, Microsoft Store ","Paramount, Ponti-De Laurentiis Cinematografica",Unknown
The Mountain,105,English,"Selfish Chris Teller pressures his older brother, a retired climber, to accompany him on a treacherous Alpine climb to loot the bodies of plane crash victims.",1956,"Adventure, Drama","sibling relationship, mountain, alps mountains, mountaineering, technicolor, chamonix, plane crash, mountain accident","Barbara Darrow, Spencer Tracy, Claire Trevor, Robert Wagner, William Demarest",Edward Dmytryk,FlixFling ,"Apple TV, Amazon Video, Google Play Movies, YouTube, Microsoft Store, FlixFling ","Apple TV, Amazon Video, Google Play Movies, YouTube, Microsoft Store, FlixFling ",Paramount,Unknown
Invasion of the Body Snatchers,80,English,A small-town doctor learns that the population of his community is being replaced by emotionless alien duplicates.,1956,"Science Fiction, Horror, Thriller","small town, based on novel or book, alien, black and white, doctor, patient, alien invasion, psychiatrist, alien infection, angry mob, mystery writer, emotionless, paranoid, abandoned mine, personality change, alien plant-life","Kevin McCarthy, Carolyn Jones, King Donovan, Larry Gates, Dana Wynter",Don Siegel,"Amazon Prime Video, fuboTV, MGM Plus Amazon Channel, Paramount Plus, Paramount Plus Apple TV Channel , Paramount+ Amazon Channel, MGM Plus ","Apple TV, Google Play Movies, YouTube, Vudu, Microsoft Store, AMC on Demand ","Apple TV, Google Play Movies, YouTube, Vudu, Microsoft Store, Spectrum On Demand ","Allied Artists Pictures, Walter Wanger Productions",Unknown
Carousel,128,English,"Billy Bigelow has been dead for 15 years. Now outside the pearly gates, he long ago waived his right to go back to Earth for a day. He has heard that there is a problem with his family: namely with his wife Julie Bigelow, née Jordan, and his child he hasn't met. He would now like to head back to Earth to assist in rectifying the problem; but before he may go, he has to get permission from the gatekeeper by telling him his story. Adapted from the Rodgers and Hammerstein hit Broadway musical.",1956,"Music, Romance","carnival, carousel , musical, based on play or musical, barker, fairground","Shirley Jones, Gordon MacRae, Claramae Turner, Barbara Ruick, Cameron Mitchell",Henry King,,"Apple TV, Amazon Video, Google Play Movies, YouTube, Vudu, Microsoft Store, AMC on Demand ","Apple TV, Amazon Video, Google Play Movies, YouTube, Vudu, Microsoft Store ",20th Century Fox,Unknown
The Ten Commandments,220,English,"Escaping death, a Hebrew infant is raised in a royal household to become a prince. Upon discovery of his true heritage, Moses embarks on a personal quest to reclaim his destiny as the leader and liberator of the Hebrew people.",1956,"Drama, History","epic, egypt, israel, moses, ten commandments, christianity, slavery, miracle, bible, judaism, religion, ancient egypt, technicolor, old testament, pharaoh, passover, christian film","Yvonne De Carlo, Charlton Heston, Edward G. Robinson, Yul Brynner, Anne Baxter",Cecil B. DeMille,,"Apple TV, Amazon Video, Google Play Movies, YouTube, Vudu, Microsoft Store, AMC on Demand ","Apple TV, Amazon Video, Google Play Movies, YouTube, Vudu, Microsoft Store ","Paramount, Motion Picture Associates",Unknown
The Rack,100,English,"Army Captain Edward Hall returns to the US after two years in a prison camp in the Korean War. In the camp he was brainwashed and helped the Chinese convince the other prisoners that they were fighting an unjust war. When he comes back he is charged for collaboration with the enemy. Where does loyalty end in a prison camp, when the camp is a living hell?",1956,"Drama, War","prisoner of war, korean war, seclusion, military court, us army, treason, loneliness, solitary confinement, brainwashing, torture, code of honor, army captain, sensory deprivation, collaborator, military prisoners, father son relationship, loss of brother, pow","Anne Francis, Walter Pidgeon, Paul Newman, Edmond O'Brien, Wendell Corey",Arnold Laven,,"Apple TV, Amazon Video, Google Play Movies, YouTube, Vudu ","Apple TV, Amazon Video, Google Play Movies, YouTube, Vudu ",Metro-Goldwyn-Mayer,Unknown
Baby Doll,114,English,"Archie Lee Meighan is a failing cotton gin owner who is married to Baby Doll, a 19-year old childlike beauty whose father arranged the marriage for financial reasons. As Archie awaits the arrival of Baby Doll's 20th birthday, the day that they are supposed to consummate their marriage, he faces interference from business rival Silva Vacarro, who plots to seduce Baby Doll away from Meighan.",1956,Drama,"marriage, sicilian, cotton gin, cotton","Karl Malden, Carroll Baker, Mildred Dunnock, Lonny Chapman, Eli Wallach",Elia Kazan,TCM ,"Apple TV, Amazon Video, Google Play Movies, YouTube, Vudu ","Apple TV, Amazon Video, Google Play Movies, YouTube, Vudu ","Newtown Productions, Warner Bros. Pictures",Unknown
Anastasia,105,English,"Russian exiles in Paris plot to collect ten million pounds from the Bank of England by grooming a destitute, suicidal girl to pose as heir to the Russian throne. While Bounin is coaching her, he comes to believe that she is really Anastasia. In the end, the Empress must decide her claim.",1956,"Drama, Romance","princess, amnesia, identity, exile, biography, assumed identity, 1920s, anastasia romanowa","Martita Hunt, Helen Hayes, Akim Tamiroff, Yul Brynner, Ingrid Bergman",Anatole Litvak,Hoopla ,"Apple TV, Amazon Video, Google Play Movies, YouTube, Vudu ","Apple TV, Amazon Video, Google Play Movies, YouTube, Vudu ",20th Century Fox,Unknown
Around the World in Eighty Days,182,English,"Based on the famous book by Jules Verne the movie follows Phileas Fogg on his journey around the world. Which has to be completed within 80 days, a very short period for those days.",1956,"Adventure, Comedy, Family, Fantasy, Romance","bet, epic, saloon, bullfighting, spain, paris, france, based on novel or book, elephant, jules verne, detective, scotland yard, asia, hot air balloon, europe, wager, train, india, monkey, valet, around the world, journey, steamship, 19th century, steam ship","Finlay Currie, David Niven, Charles Boyer, Cantinflas, Robert Morley",Michael Anderson,TCM ,"Apple TV, Amazon Video, Google Play Movies, YouTube, Vudu, Microsoft Store, AMC on Demand ","Apple TV, Amazon Video, Google Play Movies, YouTube, Vudu, Microsoft Store, Spectrum On Demand ",Michael Todd Company,Unknown
The Hunchback of Notre Dame,115,French,"Paris, 1482. Today is the festival of the fools, taking place like each year in the square outside Cathedral Notre Dame. Among jugglers and other entertainers, Esmeralda, a sensuous gypsy, performs a bewitching dance in front of delighted spectators. From up in a tower of the cathedral, Frollo, an alchemist, gazes at her lustfully. Later in the night, Frollo orders Quasimodo, the deformed bell ringer and his faithful servant, to kidnap Esmeralda. But when the ugly freak comes close to her is touched by the young woman's beauty...",1956,"Drama, History, Horror","paris, france, gypsy, obsession, cathedral, false accusations, hunchback","Gina Lollobrigida, Jean Danet, Alain Cuny, Anthony Quinn, Damia",Jean Delannoy,,Amazon Video ,Amazon Video ,"Panitalia, Paris-Film Production",Unknown
Beyond a Reasonable Doubt,80,English,"A newspaper publisher, wanting to prove a point about the insufficiency of circumstantial evidence, talks his possible son-in-law Tom into a hoax in an attempt to expose ineptitude of the city's hard-line district attorney. The plan is to have Tom plant clues leading to his arrest for killing a female nightclub dancer. Once Tom is found guilty, he is to reveal the setup and humiliate the DA.",1956,"Crime, Drama","film noir, capital punishment, incriminate","Philip Bourneuf, Sidney Blackmer, Arthur Franz, Joan Fontaine, Dana Andrews",Fritz Lang,,Amazon Video ,"Apple TV, Amazon Video, Google Play Movies, YouTube, Vudu ","Bert E. Friedlob Productions, RKO Radio Pictures",Unknown
Night and Fog,32,French,Filmmaker Alain Resnais documents the atrocities behind the walls of Hitler's concentration camps.,1956,"Documentary, War","destruction of a civilization, nazi, germany, world war ii, prisoner of war, auschwitz-birkenau concentration camp, torture, short film","Michel Bouquet, Reinhard Heydrich, Heinrich Himmler, Julius Streicher, Adolf Hitler",Alain Resnais,"Max, Max Amazon Channel, Criterion Channel ","Apple TV, Amazon Video ","Apple TV, Amazon Video ","Cocinor, Cosmo Film",Unknown
Backlash,84,English,"Jim Slater's father (whom he never knew) died in the Apache ambush at Gila Valley, and Jim is searching for the one survivor, who supposedly went for help but disappeared with a lot of gold. In the process, he gets several people gunning for him, and he keeps meeting liberated woman Karyl Orton, who may be on a similar mission. Renewed Apache hostilities and an impending range war provide complications.",1956,Western,"based on novel or book, search, apache nation, native american, gunfight","Richard Widmark, John McIntire, Donna Reed, William Campbell, Barton MacLane",John Sturges,,,,Universal International Pictures,Unknown
The Harder They Fall,109,English,"Jobless sportswriter Eddie Willis is hired by corrupt fight promoter Nick Benko to promote his current protégé, an unknown Argentinian boxer named Toro Moreno. Although Moreno is a hulking giant, his chances for success are hampered by a powder-puff punch and a glass jaw. Exploiting Willis' reputation for integrity and standing in the boxing community, Benko arranges a series of fixed fights that propel the unsophisticated Moreno to #1 contender for the championship. The reigning champ, the sadistic Buddy Brannen, harbors resentment at the publicity Toro has been receiving and vows to viciously punish him in the ring. Eddie must now decide whether or not to tell the naive Toro the truth.",1956,Drama,"pride, tall man, fixed fight, corrupt system, press agent, broken jaw","Jan Sterling, Humphrey Bogart, Mike Lane, Rod Steiger, Max Baer",Mark Robson,,"Apple TV, Amazon Video, Google Play Movies, YouTube, Vudu, Microsoft Store ","Apple TV, Amazon Video, Google Play Movies, YouTube, Vudu, Microsoft Store ",Columbia Pictures,Unknown
"Godzilla, King of the Monsters!",81,English,"During an assignment, foreign correspondent Steve Martin spends a layover in Tokyo and is caught amid the rampage of an unstoppable prehistoric monster the Japanese call 'Godzilla'. The only hope for both Japan and the world lies on a secret weapon, which may prove more destructive than the monster itself.",1956,"Science Fiction, Horror","giant monster, reporter, tokyo, japan, dinosaur, kaiju, animal horror","Raymond Burr, Takashi Shimura, Akira Takarada, Akihiko Hirata, Momoko Kôchi","Terry O. Morse, Ishirō Honda","fuboTV, Max, Max Amazon Channel, Criterion Channel ",Apple TV ,Apple TV ,"TOHO, Jewell Enterprises Inc.",Unknown
High Society,107,English,"Childhood friends Tracy Lord and C.K. Dexter Haven got married and quickly divorced. Now Tracy is about to marry again, this time to a shrewd social-climbing businessman. C.K. still loves her. Spy magazine blackmails Tracy's family by threatening to reveal her playboy father's exploits if not allowed to cover the wedding. A remake of the 1940 rom com The Philadelphia Story.",1956,"Music, Comedy, Romance","jazz singer or musician, musical, rhode island, divorcee, socialite, ex-husband ex-wife relationship, ex spouses, society wedding","Frank Sinatra, Bing Crosby, John Lund, Grace Kelly, Celeste Holm",Charles Walters,TCM ,"Apple TV, Amazon Video, Google Play Movies, YouTube, Vudu, Microsoft Store ","Apple TV, Amazon Video, Google Play Movies, YouTube, Vudu, Microsoft Store ","Sol C. Siegel Productions, Bing Crosby Productions, Metro-Goldwyn-Mayer",Unknown
Away All Boats,114,English,"The story of USS 'Belinda', a U.S. naval ship, and its crew during the battle of the Pacific 1943-1945, as it prepares for action and landing troops on enemy beachheads.",1956,"War, Drama","pacific, naval battle","Julie Adams, Jeff Chandler, George Nader, Keith Andes, Lex Barker",Joseph Pevney,,,,Universal Pictures,Unknown
Elena and Her Men,95,French,"Set amid the military maneuvers and Quatorze Juillet carnivals of turn-of-the-century France, Jean Renoir’s delirious romantic comedy Elena and her Men stars a radiant Ingrid Bergman as a beautiful, but impoverished, Polish princess who drives men of all stations to fits of desperate love. When Elena elicits the fascination of a famous general, she finds herself at the center of romantic machinations and political scheming, with the hearts of several men—as well as the future of France—in her hands.",1956,"Drama, Comedy, Romance","general, arranged marriage, romance, gypsy girl, 19th century","Jean Marais, Mel Ferrer, Ingrid Bergman, Juliette Gréco, Jean Richard",Jean Renoir,Criterion Channel ,,,"Electra Compagnia Cinematografica, Franco London Films, Les Films Gibé",Unknown
