Title,Runtime (minutes),Language,Overview,Release Year,Genre,Keywords,Actors,Directors,Stream,Buy,Rent,Production Companies,Website
While the City Sleeps,100,English,"Newspaper men compete against each other to find a serial killer dubbed ""The Lipstick Killer"".",1956,"Thriller, Drama","new york city, film noir, serial killer, black and white, newspaper man","Howard Duff, George Sanders, Thomas Mitchell, Rhonda Fleming, Dana Andrews",Fritz Lang,,"Amazon Video, Google Play Movies, YouTube ","Apple TV, Amazon Video, Google Play Movies, YouTube, Vudu ","Bert E. Friedlob Productions, RKO Radio Pictures",Unknown
Trapeze,105,English,"A pair of men try to perform the dangerous ""triple"" in their trapeze act. Problems arise when the duo is made into a trio following the addition of a sexy female performer.",1956,"Drama, Romance","circus, trapeze artist","Gina Lollobrigida, Burt Lancaster, Tony Curtis, Thomas Gomez, Katy Jurado",Carol Reed,"Amazon Prime Video, ScreenPix Apple TV Channel ","Amazon Video, Vudu ","Amazon Video, Vudu ",Joanna Productions,Unknown
The Killing,85,English,"Career criminal Johnny Clay recruits a sharpshooter, a crooked police officer, a bartender and a betting teller named George, among others, for one last job before he goes straight and gets married. But when George tells his restless wife about the scheme to steal millions from the racetrack where he works, she hatches a plot of her own.",1956,"Crime, Thriller","sniper, adultery, robbery, husband wife relationship, corruption, marriage crisis, gangster, ex-detainee, horse race, way of life, heist, femme fatale, film noir, bag of money, black and white","Jay C. Flippen, Coleen Gray, Ted de Corsia, Sterling Hayden, Vince Edwards",Stanley Kubrick,"Amazon Prime Video, Hoopla ","Apple TV, Amazon Video, Google Play Movies ","Apple TV, Amazon Video, Google Play Movies ","United Artists, Harris-Kubrick Productions",Unknown
Pardners,88,English,"Rich momma's boy Wade Kingsley Jr. an Eastern dude, tries to follow in his murdered father's footsteps by returning to the West to partner up with Slim Moseley Jr.,the son of his father's former partner. Wade overcomes Slim's initial reluctance to accept him by using his fortune to buy a prize cow and new car to help Slim in his job as foreman on the Kingsley family ranch, currently under siege by a gang of outlaws called ""masked raiders."" Wade generously tries to pay off the ranch's mortgage with $15,000 of his own money, but unfortunately neither ""pardner"" realizes that respected banker Dan Hollis, the son of their fathers' murderer, is the leader of the gang.",1956,"Comedy, Western","technicolor, prize cow","Lori Nelson, Jerry Lewis, Dean Martin, Lon Chaney Jr., Jeff Morrow",Norman Taurog,,"Apple TV, Amazon Video, Vudu ","Apple TV, Amazon Video, Vudu ",Paramount,Unknown
The Bad Seed,129,English,"Air Force Colonel Kenneth Penmark and his wife, Christine, adore their daughter Rhoda, despite her secret tendency for selfishness. Christine keeps her knowledge of her daughter's darker side to herself, but when a schoolmate of Rhoda's dies mysteriously, her self-deception unravels.",1956,"Thriller, Drama, Horror","lightning, confession, child murder, murder, lightning bolt, evil child, murder confession","Evelyn Varden, Patty McCormack, Nancy Kelly, Eileen Heckart, Henry Jones",Mervyn LeRoy,,"Apple TV, Amazon Video, Google Play Movies, YouTube, Vudu ","Apple TV, Amazon Video, Google Play Movies, YouTube, Vudu ",Warner Bros. Pictures,Unknown
The Black Sleep,82,English,"In 19th century England, a noted brain surgeon rescues a former student from being hanged on a false conviction for murder, and spirits him away to an ancient, repurposed abbey far in the countryside.  There, he connives his pupil into assisting him in mapping the functions of the various parts of the human brain, using living subjects who are under a terrible animation-suspending drug called ""black sleep"".  Subsequently, the student, along with the daughter of one of the subjects, discover that most of these subjects have survived but are being kept in a dungeon-like cellar, in various stages of physical and mental derangement...",1956,"Horror, Science Fiction","experiment, england, mad doctor, brain surgeon, suspended animation","Patricia Blair, Phyllis Stanley, Akim Tamiroff, Basil Rathbone, Herbert Rudley",Reginald Le Borg,"Amazon Prime Video, fuboTV, MGM Plus Amazon Channel, MGM Plus Roku Premium Channel, Cultpix ",Amazon Video ,Amazon Video ,"Bel-Air Productions, United Artists",Unknown
Congo Crossing,85,English,"Congotanga, West Africa, has no extradition laws; the government is controlled by foreign gangsters, headed by Carl Rittner. The latest plane from Europe carries lovely Louise Whitman, fleeing a French murder charge, and Mannering, who pays resident hit man O'Connell to kill her. Through a chain of circumstances Louise, O'Connell, and heroic surveyor David Carr end up alone in the jungle on Carr's mission to determine the true border of Congotanga... in which Rittner is keenly interested.",1956,"Action, Adventure, Drama, Thriller","africa, romance, fugitive","Rex Ingram, Peter Lorre, George Nader, Michael Pate, Virginia Mayo",Joseph Pevney,,,,Universal International Pictures,Unknown
Mohawk,79,English,"An artist working in a remote army post is juggling the storekeeper's daughter, his fiancée newly arrived from the east, and the Indian Chief's daughter. But when a vengeful settler manages to get the army and the braves at each other's throats his troubles really begin.",1956,"Action, Western","fort, artist, native american","Lori Nelson, Rita Gam, Allison Hayes, Scott Brady, Neville Brand",Kurt Neumann,"Amazon Prime Video, fuboTV, MGM Plus Amazon Channel, MGM Plus Roku Premium Channel, Pure Flix, Classix, FlixFling, FilmBox+, Popflick ","Amazon Video, FlixFling ","Amazon Video, FlixFling ",Edward L. Alperson Productions,Unknown
The Burning Hills,92,English,"When Trace Jordan's brother is murdered by members of the land-grabbing Sutton family, he vows to report this injustice to the nearest Army fort.",1956,Western,"grave, half breed","Eduard Franz, Natalie Wood, Tab Hunter, Earl Holliman, Skip Homeier",Stuart Heisler,,"Apple TV, Amazon Video ","Apple TV, Amazon Video ",Warner Bros. Pictures,Unknown
The Conqueror,111,English,Mongol chief Temujin battles against Tartar armies and for the love of the Tartar princess Bortai. Temujin becomes the emperor Genghis Khan.,1956,Adventure,"genghis khan, raid, tartar, mongolian, technicolor, 12th century","Susan Hayward, Pedro Armendáriz, Agnes Moorehead, Thomas Gomez, John Wayne",Dick Powell,,,,RKO Radio Pictures,Unknown
Crime of Passion,83,English,"Kathy leaves the newspaper business to marry homicide detective Bill, but is frustrated by his lack of ambition and the banality of life in the suburbs. Her drive to advance Bill's career soon takes her down a dangerous path.",1956,"Drama, Crime, Thriller","infidelity, police, ambition, police operation, press, film noir, columnist","Raymond Burr, Barbara Stanwyck, Fay Wray, Sterling Hayden, Virginia Grey",Gerd Oswald,Amazon Prime Video ,Amazon Video ,Amazon Video ,"Robert Goldstein Productions, United Artists",Unknown
The Wrong Man,105,English,"In 1953, an innocent man named Christopher Emmanuel ""Manny"" Balestrero is arrested after being mistaken for an armed robber.",1956,"Crime, Drama","new york city, robbery, based on novel or book, musician, falsely accused, innocence, insurance","Henry Fonda, Vera Miles, Anthony Quayle, Charles Cooper, Harold J. Stone",Alfred Hitchcock,,"Apple TV, Amazon Video, Google Play Movies, YouTube, Vudu ","Apple TV, Amazon Video, Google Play Movies, YouTube, Vudu ",Warner Bros. Pictures,Unknown
The Girl Can't Help It,98,English,A down-and-out gangster hires a down-on-his-luck agent to make his girlfriend a recording star within 6 weeks.,1956,"Comedy, Music","gangster, blonde, blonde bombshell","Julie London, Tom Ewell, Edmond O'Brien, Jayne Mansfield, Henry Jones",Frank Tashlin,,,,20th Century Fox,Unknown
