Title,Runtime (minutes),Language,Overview,Release Year,Genre,Keywords,Actors,Directors,Stream,Buy,Rent,Production Companies,Website
"Gamera, the Giant Monster",79,Japanese,"A nuclear explosion in the far north unleashes Gamera, the legendary flying turtle, from his sleep under the ice. In his search for energy, Gamera wreaks havoc over the entire world, and it's up to the scientists, assisted by a young boy with a strange sympathic link to the monster, to put a stop to Gamera's rampage.",1965,"Action, Horror, Science Fiction","japan, monster, giant monster, turtle, arctic polar circle region, nuclear explosion, prehistoric creature, explosion, kaiju, fire breathing, gamera (giant turtle)","Yoshirô Kitahara, Michiko Sugata, Harumi Kiritachi, Eiji Funakoshi, Bokuzen Hidari",Noriaki Yuasa,"Amazon Prime Video, Screambox Amazon Channel, ARROW ","Apple TV, Amazon Video, Google Play Movies, YouTube, Vudu, Microsoft Store ","Apple TV, Amazon Video, Google Play Movies, YouTube, Microsoft Store ",Daiei Film,Unknown
For a Few Dollars More,132,Italian,"Two bounty hunters are in pursuit of ""El Indio,"" one of the most wanted fugitives in the western territories, and his gang.",1965,Western,"bounty hunter, pot smoking, rural area, spaghetti western, right hand man, piano, dollars trilogy","Gian Maria Volonté, Lee Van Cleef, Klaus Kinski, Clint Eastwood, Luigi Pistilli",Sergio Leone,"Max, Max Amazon Channel ","Apple TV, Amazon Video, Google Play Movies, YouTube, Vudu, Microsoft Store ","Apple TV, Amazon Video, Google Play Movies, YouTube, Vudu, Microsoft Store ","PEA, Constantin Film, Arturo González Producciones Cinematográficas, United Artists",Unknown
That Darn Cat!,112,English,"A young woman suspects foul play when her cat comes home wearing a wristwatch. Convincing the FBI, though, and catching the bad guys is tougher than she imagined.",1965,"Family, Comedy, Crime","cat, kidnapping, hostage, map, sister, suburbia, bank robbery, wristwatch, landlady","Roddy McDowall, Dean Jones, Frank Gorshin, Hayley Mills, Dorothy Provine",Robert Stevenson,Disney Plus ,,,Walt Disney Productions,Unknown
Sword of the Beast,85,Japanese,"Legendary swordplay filmmaker Hideo Gosha's Sword of the Beast chronicles the flight of the low-level swordsman Gennosuke, who kills one of his ministers as part of a reform plot. His former comrades then turn on him, and this betrayal so shakes his sense of honor that he decides to live in the wild, like an animal. There he joins up with a motley group who are illegally mining the shogun’s gold, and, with the aid of another swordsman, gets a chance not just at survival but to recover his name and honor.",1965,"Action, Drama","gambling, ronin, shogun, feudal japan, 19th century","Gō Katō, Mikijiro Hira, Eijirō Tōno, Kunie Tanaka, Shima Iwashita",Hideo Gosha,Criterion Channel ,,,Haiyuza Theater Company,Unknown
The Glory Guys,112,English,"Though a fictionalized Western based on George Armstrong Custer's 7th Cavalry Regiment at the Battle of the Little Big Horn, the film is almost a generic war story covering the enlistment, training, and operational deployment of a group of recruits that could take place in any time period.",1965,"Drama, Action, Western, Romance","cavalry, little big horn, barroom brawl, frontier scout","Michael Anderson Jr., Tom Tryon, James Caan, Harve Presnell, Senta Berger",Arnold Laven,ScreenPix Apple TV Channel ,,,Levy-Gardner-Laven,Unknown
Up to His Ears,104,French,A millionaire realizes he really wants to live after he has hired an assassin to kill him.,1965,"Comedy, Adventure",None,"Jean Rochefort, Jean-Paul Belmondo, Maria Pacôme, Valérie Lagrange, Ursula Andress",Philippe de Broca,,"Apple TV, Amazon Video, Google Play Movies, YouTube, Vudu ","Apple TV, Amazon Video, Google Play Movies, YouTube, Vudu ","Les Films Ariane, Les Productions Artistes Associés, Vides Cinematografica",Unknown
Sandra,100,Italian,"Sandra returns to her childhood village to take care of family business, but childhood memories and secrets soon overcome her.",1965,"Drama, Mystery","deportation, auschwitz-birkenau concentration camp, family relationships, deceit, post world war ii","Claudia Cardinale, Fred Williams, Jean Sorel, Michael Craig, Renzo Ricci",Luchino Visconti,,,,"Vides Cinematografica, Compagnia Edizioni Internazionali Artistiche Distribuzione (CEIAD)",Unknown
Mirage,109,English,"In New York City, David Stillwell struggles to recover his memory before the people who are trying to kill him succeed. Who is he, who are they, and why is he surrounded by murder?",1965,"Mystery, Thriller","new york city, amnesia, identity crisis, world peace, nuclear scientist, chemist, philanthropist, radiation sickness, suppressed memory, corporate conspiracy, research scientist, falling out window, temporary amnesia","Kevin McCarthy, Gregory Peck, Jack Weston, Walter Matthau, Diane Baker",Edward Dmytryk,,,,Universal Pictures,Unknown
