Title,Runtime (minutes),Language,Overview,Release Year,Genre,Keywords,Actors,Directors,Stream,Buy,Rent,Production Companies,Website
Girl Happy,96,English,"A Chicago mobster hires a rock and roll singer and his band to keep an eye on his daughter during Spring Break in Fort Lauderdale, Florida.",1965,"Comedy, Music, Romance","spring break, rock singer","Shelley Fabares, Gary Crosby, Joby Baker, Harold J. Stone, Elvis Presley",Boris Sagal,,"Apple TV, Amazon Video, Google Play Movies, YouTube, Vudu ","Apple TV, Amazon Video, Google Play Movies, YouTube, Vudu ",Euterpe Productions,Unknown
Ski Party,90,English,"Remember the beach movies of the sixties? They're back! Well, not quite, but since Avalon, Hickman, and even Funicello appear in this one, it sure feels right. This time, though, read snow instead of sand and you got it. Ski lodge, to be precise, and though the plot is somewhat inane, with the boys cross-dressing to discover the secret of a friend's success with the girls, it's still a somewhat fun outing.",1965,"Comedy, Music",snow skiing,"Deborah Walley, Yvonne Craig, Frankie Avalon, Dwayne Hickman, Robert Q. Lewis",Alan Rafkin,Hoopla ,"Apple TV, Amazon Video, Vudu ","Apple TV, Amazon Video, Vudu ","Alta Vista Productions, American International Pictures",Unknown
The Brigand of Kandahar,84,English,"1880. British India. Robert Case, a half-caste lieutenant, is unjustly discharged from the British Army. He joins the rebel Bengali tribesmen offensive against the colonial enemy. They capture a foreign journalist and Case recounts his story of false accusation on trumped-up charges, instigated by the bigotry and racism of his commanding officers. Following a successful attack by the British against the rebels Case is brutally shot by Colonel Drewe, his accuser. The journalist returns home determined to report the true story of The Brigand of Kandahar.",1965,Adventure,india,"Katherine Woodville, Duncan Lamont, Oliver Reed, Glyn Houston, Yvonne Romain",John Gilling,,"Apple TV, Amazon Video, Google Play Movies, YouTube, Vudu ","Apple TV, Amazon Video, Google Play Movies, YouTube, Vudu ",Hammer Film Productions,Unknown
The Gospel According to Matthew,137,Italian,"This biblical drama from the Catholic Marxist director focuses on the teachings of Jesus, including the parables that reflect their revolutionary nature. As Jesus travels along the coast of the Sea of Galilee, he gradually gathers more followers, leading him into direct conflict with the authorities.",1965,Drama,"faith, christianity, biography, jesus christ","Marcello Morante, Margherita Caruso, Susanna Pasolini, Mario Socrate, Enrique Irazoqui",Pier Paolo Pasolini,"Criterion Channel, Fandor Amazon Channel ","Apple TV, Amazon Video, Google Play Movies, YouTube, Vudu ","Apple TV, Amazon Video, Google Play Movies, YouTube, Vudu ","Arco Film, Lux Compagnie Cinématographique de France",Unknown
The Greatest Story Ever Told,199,English,"From his birth in Bethlehem to his death and eventual resurrection, the life of Jesus Christ is given the all-star treatment in this epic retelling. Major aspects of Christ's life are touched upon, including the execution of all the newborn males in Egypt by King Herod; Christ's baptism by John the Baptist; and the betrayal by Judas after the Last Supper that eventually leads to Christ's crucifixion and miraculous return.",1965,"Drama, History","epic, christianity, religion and supernatural, crucifixion, bible, biography, resurrection, religion, religious film, jesus christ, christian film","Michael Anderson Jr., Max von Sydow, Carroll Baker, Victor Buono, Ina Balin",George Stevens,"Amazon Prime Video, fuboTV, MGM Plus Amazon Channel, MGM Plus Roku Premium Channel, MGM Plus ","Apple TV, Amazon Video, Google Play Movies, YouTube, Vudu ","Apple TV, Amazon Video, Google Play Movies, YouTube, Vudu, Spectrum On Demand ",George Stevens Jr. Productions,Unknown
Cinderella,78,English,"After the success of the  live 1957 Cinderella on CBS (with Julie Andrews), the network decided to produce another television version. The new script hewed closer to the traditional tale, although nearly all of the original songs were retained and performed in their original settings. Added to the Rodgers and Hammerstein score was ""Loneliness of Evening"", which had been composed for South Pacific but not used.",1965,"Fantasy, Romance, TV Movie, Music","musical, remake, based on fairy tale, tv special","Lesley Ann Warren, Walter Pidgeon, Ginger Rogers, Stuart Damon, Celeste Holm",Charles S. Dubin,"Amazon Prime Video, fuboTV ","Amazon Video, Vudu, Microsoft Store ","Amazon Video, Vudu, Microsoft Store ",CBS Studios,Unknown
Blood for a Silver Dollar,99,Italian,Two brothers part company only to be reunited when one is hired to stop a thief who turns out to be his sibling.,1965,"Western, Action, Romance",spaghetti western,"Pierre Cressoy, Giuliano Gemma, Giuseppe Addobbati, Franco Fantasia, Ida Galli",Giorgio Ferroni,,,,"Les Films Corona, Adriatica Film, Dorica Film, Explorer Film '58, Fono Roma, Franco Roma",Unknown
Ten Little Indians,92,English,"Ten strangers are invited as weekend guests to a remote mountain mansion. When the host doesn't show up, the guests start dying, one by one, in uniquely macabre Agatha Christie-style. It is based on Christie's best-selling novel with 100 million sales to date, making it the world's best-selling mystery ever, and one of the most-printed books of all time.",1965,"Crime, Mystery, Thriller","isolation, mountain, house, austria, murder, isolated house, murder mystery","Stanley Holloway, Shirley Eaton, Fabian, Hugh O'Brian, Leo Genn",George Pollock,"MGM Plus, FlixFling ","Apple TV, Amazon Video, Google Play Movies, YouTube, Vudu, FlixFling ","Apple TV, Amazon Video, Google Play Movies, YouTube, Vudu, FlixFling ","Tenlit Films, Towers of London Productions",Unknown
What's New Pussycat?,108,English,A playboy who refuses to give up his hedonistic lifestyle to settle down and marry his true love seeks help from a demented psychoanalyst who is having romantic problems of his own.,1965,"Comedy, Romance","journalist, fashion journal, ladykiller, gigolo, sex therapy","Peter Sellers, Capucine, Paula Prentiss, Peter O'Toole, Romy Schneider",Clive Donner,,"Apple TV, Amazon Video, Google Play Movies, YouTube, Vudu, Microsoft Store ","Apple TV, Amazon Video, Google Play Movies, YouTube, Vudu ",Famous Artists Productions,Unknown
Chimes at Midnight,115,English,"Henry IV usurps the English throne, sets in motion the factious War of the Roses and now faces a rebellion led by Northumberland scion Hotspur. Henry's heir, Prince Hal, is a ne'er-do-well carouser who drinks and causes mischief with his low-class friends, especially his rotund father figure, John Falstaff. To redeem his title, Hal may have to choose between allegiance to his real father and loyalty to his friend.",1965,"Comedy, Drama, History, War","double life, england, generations conflict, virtue, king henry iv, vice, 15th century","Margaret Rutherford, Orson Welles, Jeanne Moreau, John Gielgud, Keith Baxter",Orson Welles,"Max, Max Amazon Channel, Criterion Channel ","Apple TV, Amazon Video, Google Play Movies, YouTube, Vudu ","Apple TV, Amazon Video, Google Play Movies, YouTube, Vudu ","Internacional Films Espagnol, Alpine Productions, Peppercorn-Wormser Inc",http://www.janusfilms.com/chimes/
Harum Scarum,85,English,"Johnny Tyronne, action movie star and ladies man, is traveling through the Middle East on a goodwill tour to promote his latest movie, ""Sands of the Desert"". Once he arrives, however, he is kidnapped by a gang of assassins who were so impressed with his on-screen adventures that they want to hire him to carry out an assassination for them.",1965,"Comedy, Crime, Music, Romance","blackmail, sheik","Fran Jeffries, Michael Ansara, Mary Ann Mobley, Elvis Presley, Jay Novello",Gene Nelson,,"Apple TV, Amazon Video, Google Play Movies, YouTube, Vudu ","Apple TV, Amazon Video, Google Play Movies, YouTube, Vudu ",Four-Leaf Productions,Unknown
Flaming Frontier,90,German,"Old Surehand and his faithful old friend Old Wabble are on the trail of a cold-blooded killer with the nickname 'The General'. The brother of Old Surehand was murdered by him. On the way Old Surehand and Old Wabble are involved in the running conflict between settlers and Comanches who are likely to go on the war path. Old Surehand can count on the support of his friend and blood brother Winnetou, the amiable chief of the Apaches. Written by Robert",1965,"Adventure, Western","horse, apache nation, native american, death of son, railroad track, barroom brawl","Terence Hill, Larry Pennell, Pierre Brice, Letícia Román, Stewart Granger",Alfred Vohrer,,,,"Jadran Film, Rialto Film",Unknown
Ship of Fools,149,English,"Passengers on a ship traveling from Mexico to Europe in the 1930s represent society at large in that era. The crew is German, including the ship's Dr. Schumann, who falls in love with one of the passengers, La Condesa. A young American woman, Jenny, is traveling with the man she loves, David. Jenny is fascinated and puzzled by just who some of the other passengers are.",1965,"Drama, Romance","ocean liner, 1930s","Simone Signoret, Lee Marvin, José Ferrer, Oskar Werner, Vivien Leigh",Stanley Kramer,,"Apple TV, Amazon Video, Google Play Movies, YouTube, Vudu ","Apple TV, Amazon Video, Google Play Movies, YouTube, Vudu ","Stanley Kramer Productions, Columbia Pictures",Unknown
In Harm's Way,165,English,A naval officer reprimanded after Pearl Harbor is later promoted to rear admiral and gets a second chance to prove himself against the Japanese.,1965,"War, Drama","navy, military officer, pearl harbor, military service, naval officer, black and white, admiral, second chance, military life, military uniform, military, fought","Tom Tryon, Kirk Douglas, Patricia Neal, Paula Prentiss, John Wayne",Otto Preminger,,"Apple TV, Amazon Video, Google Play Movies, YouTube, Vudu, Microsoft Store, AMC on Demand ","Apple TV, Amazon Video, Google Play Movies, YouTube, Vudu, Microsoft Store, Spectrum On Demand ","Paramount, Otto Preminger Films",Unknown
Frankenstein Conquers the World,90,Japanese,"During WWII, Germans obtain the immortal heart of Frankenstein's monster and transport it to Japan to prevent it being seized by the Allies. Kept in a Hiroshima laboratory, it is seeming lost when the United States destroys the city with the atomic bomb. Years later a wild boy is discovered wandering the streets of the city alone, born of the immortal heart.",1965,"Horror, Science Fiction","japan, monster, submarine, germany, atomic bomb, radiation, world war ii, giant monster, hiroshima, japan, scientist, kaiju, giant octopus, baragon, frankenstein","Tadao Takashima, Kumi Mizuno, Nick Adams, Yoshio Tsuchiya, Koji Furuhata",Ishirō Honda,Criterion Channel ,,,"TOHO, Henry G. Saperstein Enterprises Inc.",Unknown
Help!,92,English,"An obscure Eastern cult that practices human sacrifice pursues Ringo after he unknowingly puts on a ceremonial ring (that, of course, won't come off). On top of that, a pair of mad scientists, members of Scotland Yard, and a beautiful but dead-eyed assassin all have their own plans for the Fab Four.",1965,"Comedy, Music, Adventure","surreal, musical, cult, satire, mad scientist","Ringo Starr, Leo McKern, John Lennon, George Harrison, Paul McCartney",Richard Lester,,Apple TV ,Apple TV ,Subafilms,Unknown
The Last Tomahawk,92,German,"As Alice and Cora Munro attempt to find their father, a British officer in the French and Indian War, they are set upon by French soldiers and their cohorts, Huron tribesmen led by the evil Magua. Fighting to rescue the women are Chingachgook and his son Unkas, the last of the Mohican tribe, and their white ally, the frontiersman Natty Bumppo, known as Falkenauge.",1965,Western,"spaghetti western, tomahawk","Daniel Martín, Anthony Steffen, Carl Lange, Karin Dor, Joachim Fuchsberger",Harald Reinl,,,,"Balcázar, International Germania Film, Procusa, Cinematografica Associati (CI.AS.)",Unknown
Dr. Goldfoot and the Bikini Machine,88,English,In this campy spy movie spoof Dr. Goldfoot (Vincent Price) has invented an army of bikini-clad robots who are programmed to seek out wealthy men and charm them into signing over their assets. Secret agent Craig Gamble (Frankie Avalon) and millionaire Todd Armstrong set out to foil his fiendish plot.,1965,"Comedy, Science Fiction","secret agent, mad scientist, bikini, robot, world domination","Jack Mullaney, Susan Hart, Frankie Avalon, Dwayne Hickman, Vincent Price",Norman Taurog,,"Apple TV, Amazon Video, Vudu ","Apple TV, Amazon Video, Vudu ",American International Pictures,Unknown
Life at the Top,117,English,"Successful businessman Joe Lampton is married to the wealthy Susan, has two children, and lives in the mill town of Warley in northern England. But his career seems to have plateaued, leaving him disillusioned. This feeling is only exacerbated when he discovers his wife's infidelity with local man Mark. So he takes up with attractive TV host Norah and moves with her to London, aiming to reignite the fire that drove him to the top.",1965,Drama,"adultery, based on novel or book, textile industry, bad father-in-law, sequel, yorkshire, british high society, kitchen sink realism","Jean Simmons, Honor Blackman, Michael Craig, Laurence Harvey, Donald Wolfit",Ted Kotcheff,,,,Romulus Films,Unknown
The Sound of Music,174,English,"In the years before the Second World War, a tomboyish postulant at an Austrian abbey is hired as a governess in the home of a widowed naval captain with seven children, and brings a new love of life and music into the home.",1965,"Drama, Family, Music, Romance","resistance, world war ii, musical, austria, music competition, based on play or musical, alps mountains, governess, convent (nunnery), novice, puppet show, nun in love, nazi occupation, 1930s","Eleanor Parker, Christopher Plummer, Richard Haydn, Julie Andrews, Peggy Wood",Robert Wise,"Disney Plus, Hulu ","Apple TV, Amazon Video, Google Play Movies, YouTube, Vudu, Microsoft Store ","Apple TV, Amazon Video, Google Play Movies, YouTube, Vudu, Microsoft Store, Spectrum On Demand ","Robert Wise Productions, Argyle Enterprises, 20th Century Fox",Unknown
Operation Y and Other Shurik's Adventures,95,Russian,"The film consists of three independent parts: ""Workmate"", ""Déjà vu"" and ""Operation Y"". The plot follows the adventures of Shurik (alternative spelling — Shourick), the naive and nerdy Soviet student who often gets into ludicrous situations but always finds a way out very neatly.  ""Operation Y and Shurik's Other Adventures"" was a hit movie and became the leader of Soviet film distribution in 1965.",1965,"Comedy, Romance, Crime","fight, exam, thief, 1950s","Mikhail Pugovkin, Aleksandr Demyanenko, Georgiy Vitsin, Yuriy Nikulin, Aleksei Smirnov",Leonid Gaidai,,,,Mosfilm,Unknown
A Pistol for Ringo,98,Italian,"Giuliano Gemma stars as a cool, cocky mercenary enlisted by a sheriff to infiltrate a ruthless gang of outlaws. Ennio Morricone provided the score to this early spaghetti western hit.",1965,Western,"hostage, ranch, mexican border, hopscotch","Fernando Sancho, Giuliano Gemma, Antonio Casas, Nieves Navarro, Lorella De Luca",Duccio Tessari,"ARROW, Midnight Pulp ","Apple TV, Google Play Movies, YouTube ","Apple TV, Google Play Movies, YouTube ","Balcázar, PCM",Unknown
Doctor Zhivago,200,English,"The life of a Russian physician and poet who, although married to another, falls in love with a political activist's wife and experiences hardship during World War I and then the October Revolution.",1965,"Drama, Romance, War","epic, daughter, based on novel or book, love triangle, nurse, world war i, suicide attempt, loss of loved one, forbidden love, stepparents, russian revolution (1917), 1910s","Geraldine Chaplin, Omar Sharif, Alec Guinness, Julie Christie, Rod Steiger",David Lean,"fuboTV, MGM Plus Amazon Channel, MGM Plus Roku Premium Channel, MGM Plus ","Apple TV, Amazon Video, Google Play Movies, YouTube, Vudu, Microsoft Store, AMC on Demand ","Apple TV, Amazon Video, Google Play Movies, YouTube, Vudu, Microsoft Store, Spectrum On Demand ","Metro-Goldwyn-Mayer, Carlo Ponti Production, MGM",Unknown
Those Magnificent Men in Their Flying Machines or How I Flew from London to Paris in 25 Hours 11 Minutes,138,English,"In order to boost circulation of his newspaper, Lord Rawnsley announces an air race and offers £10,000 to the first person who can fly across the English Channel. But one of the participants, Percy, plots to sabotage his competitor's planes. Will Percy triumph?",1965,Comedy,"aviation, eiffel tower, paris, air race, prize, reproduction, vintage aircraft, stereotype, multinational, 1910s, benny hill","Stuart Whitman, James Fox, Robert Morley, Sarah Miles, Alberto Sordi",Ken Annakin,Hoopla ,"Apple TV, Amazon Video, Google Play Movies, YouTube, Vudu, Microsoft Store, AMC on Demand ","Apple TV, Amazon Video, Google Play Movies, YouTube, Vudu, Microsoft Store ",20th Century Fox,Unknown
The Skull,83,English,"An occult investigator buys the 150-year-old skull of the Marquis de Sade, which turns out to be possessed by evil spirits.",1965,Horror,"london, england, auction, possession, evil spirit, murder, statuette, grave robber, based on short story, demonic possession, skull","Christopher Lee, Jill Bennett, Peter Cushing, Peter Woodthorpe, Patrick Wymark",Freddie Francis,,"Apple TV, Amazon Video, Google Play Movies, YouTube ","Apple TV, Amazon Video, Google Play Movies, YouTube ",Amicus Productions,Unknown
Dr. Terror's House of Horrors,98,English,Five strangers board a train and are joined by a mysterious fortune teller who offers to read their Tarot cards. Five separate stories unfold: An architect returns to his ancestoral home to find a werewolf out for revenge; a doctor discovers his new wife is a vampire; a huge plant takes over a house; a musician gets involved with voodoo; an art critic is pursued by a disembodied hand.,1965,Horror,"anthology, crawling hand","Christopher Lee, Donald Sutherland, Peter Cushing, Alan Freeman, Roy Castle",Freddie Francis,fuboTV ,"Apple TV, Amazon Video, Google Play Movies, YouTube, Vudu ","Apple TV, Amazon Video, Google Play Movies, YouTube, Vudu ","Paramount, Amicus Productions",Unknown
The Art of Love,99,English,Struggling artist fakes his own death so his works will increase in value.,1965,Comedy,romantic triangle,"Ethel Merman, Elke Sommer, Angie Dickinson, James Garner, Dick Van Dyke",Norman Jewison,,,,"Cherokee Productions, Ross Hunter Productions, Universal Pictures",Unknown
Alphaville,99,French,"An American private-eye arrives in Alphaville, a futuristic city on another planet which is ruled by an evil scientist named Von Braun, who has outlawed love and self-expression.",1965,"Drama, Science Fiction, Mystery","photography, dystopia, surrealism, film noir, lemmy caution, private detective, french noir, distant  planet","Akim Tamiroff, Anna Karina, Jean-Louis Comolli, Valérie Boisgel, Eddie Constantine",Jean-Luc Godard,Hoopla ,,,"Filmstudio, Athos Films, Chaumiane, André Michelin Productions",Unknown
The Sucker,111,French,"In this Frenco-Italian gangster parody, a shop keeper on his way to an Italian holiday suffers a crash which totals his car. The culprit can only compensate his ruined trip by driving an American friends car from Napels to Bordeaux, but as it happens to be filled with such contraband as stolen money, jewelry and drugs, the involuntary and unwitting companions in crime soon attract all but recreational attention from the ""milieu"".",1965,"Comedy, Crime","france, paris, france, drug smuggling, diamond, italy, gangster, border, cadillac, naples, italy, vacation, car crash, bordeaux, france, road trip, fool, horn, hitchhiker, manicurist, jewel smuggling, carcassonne","Henri Génès, Bourvil, Venantino Venantini, Beba Lončar, Louis de Funès",Gérard Oury,,,,"Les Films Corona, Explorer Film '58",Unknown
Battle of the Bulge,167,English,"In the winter of 1944, the Allied Armies stand ready to invade Germany at the coming of a New Year. To prevent it, Hitler orders an all-out offensive to re-take French territory and capture the major port city of Antwerp.",1965,"Drama, History, War","world war ii, tank, battle of the bulge, fuel depot","Robert Shaw, Henry Fonda, Dana Andrews, George Montgomery, Robert Ryan",Ken Annakin,,"Apple TV, Amazon Video, Vudu, Microsoft Store ","Apple TV, Amazon Video, Vudu, Microsoft Store ","Cinerama Productions, United States Pictures, Warner Bros. Pictures",Unknown
The Sleeping Car Murder,95,French,"Six people travel by train overnight from Marseilles to Paris. When the train arrives at its destination, one of the passengers, a girl, is found dead in a sleeping berth. The police led by Inspector Grazzi investigate the other five passengers, suspecting that one of them was responsible. However, as the investigation is stepped up, the other passengers start turning up dead. It is then up to the last remaining two to solve the case, before they become the next victims.",1965,"Crime, Thriller, Mystery","investigation, strangle, murder, train, killer, witness to murder","Jean-Louis Trintignant, Catherine Allégret, Jacques Perrin, Pierre Mondy, Yves Montand",Costa-Gavras,,,,Productions et Éditions Cinématographiques Françaises,Unknown
The Heroes of Telemark,131,English,"Set in German-occupied Norway, resistance fighter Knut Straud enlists the reluctant physicist Rolf Pedersen in an effort to destroy the German heavy water production plant in rural Telemark.",1965,"Action, Drama, War","world war ii, saboteur, norway, physicist, sabotage, resistance fighter, 1940s","David Weston, Michael Redgrave, Richard Harris, Kirk Douglas, Ulla Jacobsson",Anthony Mann,,"Apple TV, Amazon Video, Google Play Movies, YouTube, Vudu ","Apple TV, Amazon Video, Google Play Movies, YouTube, Vudu ","Benton Film Productions, The Rank Organisation",Unknown
Shenandoah,105,English,"Charlie Anderson, a farmer in Shenandoah, Virginia, finds himself and his family in the middle of the Civil War he wants nothing to do with. When his youngest boy is taken prisoner by the North, the Civil War is forced upon him.",1965,"Western, War","widower, virginia","Rosemary Forsyth, James Stewart, Patrick Wayne, Doug McClure, Glenn Corbett",Andrew V. McLaglen,,"Apple TV, Amazon Video, Google Play Movies, YouTube, Vudu ","Apple TV, Amazon Video, Google Play Movies, YouTube, Vudu ",Universal Pictures,Unknown
"Boeing, Boeing",102,English,"Living in Paris, journalist Bernard has devised a scheme to keep three fiancées: Lufthansa, Air France and British United. Everything works fine as long as they only come home every third day. But when there's a change in their working schedule, they will be able to be home every second day instead. Bernard's carefully structured life is breaking apart",1965,Comedy,"stewardess, pilot, based on play or musical, womanizer, american abroad, newspaper man, airline","Jerry Lewis, Tony Curtis, Dany Saval, Christiane Schmidtmer, Thelma Ritter",John Rich,,"Apple TV, Amazon Video, Google Play Movies, YouTube, Vudu ","Apple TV, Amazon Video, Google Play Movies, YouTube, Vudu ","Paramount, Hal Wallis Productions",Unknown
The Bedford Incident,102,English,"During a routine patrol, a reporter is given permission to interview a hardened cold-war warrior and captain of the American destroyer USS Bedford. The reporter gets more than he bargained for when the Bedford discovers a Soviet sub and the captain begins a relentless pursuit, pushing his crew to breaking point.",1965,"Action, Drama, Thriller, War","submarine, cold war, atlantic ocean, soviet military, nuclear missile, battlefield, boat chase, confrontation, destroyer","Richard Widmark, Wally Cox, Sidney Poitier, James MacArthur, Martin Balsam",James B. Harris,,"Apple TV, Amazon Video, Google Play Movies, YouTube, Vudu ","Apple TV, Amazon Video, Google Play Movies, YouTube, Vudu ","Bedford Productions, Columbia Pictures",Unknown
Fantomas Unleashed,105,French,"In the second episode of the trilogy Fantômas kidnaps distinguished scientist professor Marchand with the aim to develop a super weapon that will enable him to menace the world. Fantômas is also planning to abduct a second scientist, professor Lefebvre.",1965,"Comedy, Crime, Adventure, Fantasy","mask, flying car, asylum, gadget, masked ball, volcano, hypnosis, police operation, press, sequel, fugitive, scientist, criminal, parachute jumping","Robert Dalban, Jean Marais, Jacques Dynam, Mylène Demongeot, Louis de Funès",André Hunebelle,,,Kino Now ,"Gaumont, P.A.C., Da Ma Produzione, Victory Film, Story Film",Unknown
The War Lord,123,English,A knight in the service of a duke goes to a coastal village where an earlier attempt to build a defensive castle has failed. He begins to rebuild the duke's authority in the face of the barbarians at the border and is making progress until he falls in love with one of the local women.,1965,"History, Drama, War","warlord, normandy, france, druid, knight, 11th century","Rosemary Forsyth, Maurice Evans, Charlton Heston, Richard Boone, Guy Stockwell",Franklin J. Schaffner,,,,Universal Pictures,Unknown
