Title,Runtime (minutes),Language,Overview,Release Year,Genre,Keywords,Actors,Directors,Stream,Buy,Rent,Production Companies,Website
The Remains of the Day,134,English,A rule bound head butler's world of manners and decorum in the household he maintains is tested by the arrival of a housekeeper who falls in love with him in post-WWI Britain. The possibility of romance and his master's cultivation of ties with the Nazi cause challenge his carefully maintained veneer of servitude.,1993,"Drama, Romance","newspaper, london, england, nazi, england, butler, country house, loyalty, britain, housekeeper, employer, told in flashback, 1950s, 1930s","Emma Thompson, James Fox, Anthony Hopkins, Christopher Reeve, Hugh Grant",James Ivory,"History Vault, Showtime Apple TV Channel ","Apple TV, Amazon Video, Google Play Movies, YouTube, Vudu, AMC on Demand ","Apple TV, Amazon Video, Google Play Movies, YouTube, Vudu ","Columbia Pictures, Mike Nichols Productions, John Calley Productions, Merchant Ivory Productions",Unknown
The Three Musketeers,105,English,"D'Artagnan travels to Paris hoping to become a musketeer, one of the French king's elite bodyguards, only to discover that the corps has been disbanded by conniving Cardinal Richelieu, who secretly hopes to usurp the throne. Fortunately, Athos, Porthos and Aramis have refused to lay down their weapons and continue to protect their king. D'Artagnan joins with the rogues to expose Richelieu's plot against the crown.",1993,"Action, Adventure, Comedy","paris, france, musketeer","Kiefer Sutherland, Tim Curry, Charlie Sheen, Oliver Platt, Chris O'Donnell",Stephen Herek,"Disney Plus, AMC+ Amazon Channel, AMC+ Roku Premium Channel, BBC America ","Apple TV, Amazon Video, Google Play Movies, YouTube, Vudu, Microsoft Store, AMC on Demand ","Apple TV, Amazon Video, Google Play Movies, YouTube, Vudu, Microsoft Store ","Walt Disney Pictures, Caravan Pictures",http://movies.disney.com/the-three-musketeers
Philadelphia,126,English,Two competing lawyers join forces to sue a prestigious law firm for AIDS discrimination. As their unlikely friendship develops their courage overcomes the prejudice and corruption of their powerful adversaries.,1993,Drama,"philadelphia, pennsylvania, court, jurors, aids, pennsylvania, usa, homophobia, lawsuit, partner, hiv, lawyer, dying, lgbt, discrimination, judiciary, 1980s, courtroom drama, gay theme","Jason Robards, Antonio Banderas, Tom Hanks, Denzel Washington, Mary Steenburgen",Jonathan Demme,Starz Apple TV Channel ,"Apple TV, Amazon Video, Google Play Movies, YouTube, Vudu, Microsoft Store, AMC on Demand ","Apple TV, Amazon Video, Google Play Movies, YouTube, Vudu, Microsoft Store ",TriStar Pictures,Unknown
Rudy,114,English,"Rudy grew up in a steel mill town where most people ended up working, but wanted to play football at Notre Dame instead. There were only a couple of problems. His grades were a little low, his athletic skills were poor, and he was only half the size of the other players. But he had the drive and the spirit of 5 people and has set his sights upon joining the team.",1993,"Drama, History","underdog, sports, american football, biography, family relationships, aspiration","Ned Beatty, Jon Favreau, Lili Taylor, Charles S. Dutton, Sean Astin",David Anspaugh,"fuboTV, MGM Plus Amazon Channel, MGM Plus ","Apple TV, Amazon Video, Google Play Movies, YouTube, Vudu, Microsoft Store, AMC on Demand ","Apple TV, Amazon Video, Google Play Movies, YouTube, Vudu, Microsoft Store ",TriStar Pictures,Unknown
Iron Monkey,90,Unknown,"Iron Monkey is a Hong Kong variation of Robin Hood. Corrupt officials of a Chinese village are robbed by a masked bandit known as ""Iron Monkey"", named after a benevolent deity. When all else fails, the Governor forces a traveling physician into finding the bandit.",1993,"Action, Crime, Drama","martial arts, kung fu, secret identity, robin hood, iron monkey","Donnie Yen, Yu Rongguang, Yen Shi-Kwan, Angie Tsang Sze-Man, Jean Wang",Yuen Woo-Ping,,"Apple TV, Amazon Video, Google Play Movies, YouTube, Vudu ","Apple TV, Amazon Video, Google Play Movies, YouTube, Vudu ","Orange Sky Golden Harvest, Film Workshop, Long Shong Pictures, Media Asia Films",Unknown
Guilty as Sin,107,English,"Before a criminal lawyer knows what has happened, she is forced to defend a wife killer she knows is guilty.",1993,"Thriller, Drama",odvjetnik,"Jack Warden, Dana Ivey, Don Johnson, Stephen Lang, Rebecca De Mornay",Sidney Lumet,,"Apple TV, Amazon Video, Google Play Movies, YouTube, Vudu, Microsoft Store, AMC on Demand ","Apple TV, Amazon Video, Google Play Movies, YouTube, Vudu, Microsoft Store ",Hollywood Pictures,Unknown
This Boy's Life,115,English,"When a son and mother move to Seattle in hopes for a better life, the mother meets a seemingly polite man. Things go south when the man turns out to be abusive, endangering their lives. As the mother struggles to maintain hope in an impossible situation, the son has plans to escape.",1993,Drama,"jealousy, single parent, seattle, washington, car mechanic, stepfather, coming of age, alcoholic, oppression, 1950s","Leonardo DiCaprio, Eliza Dushku, Chris Cooper, Ellen Barkin, Robert De Niro",Michael Caton-Jones,,"Apple TV, Amazon Video, Google Play Movies, YouTube, Vudu, Microsoft Store ","Apple TV, Amazon Video, Google Play Movies, YouTube, Vudu, Microsoft Store ","Knickerbocker Films, Warner Bros. Pictures",Unknown
Posse,111,English,A group of mostly black infantrymen return from the Spanish-American War with a cache of gold. They travel to the West where their leader searches for the men who lynched his father.,1993,"Action, Adventure, Western","shootout, racial tension, gun fight","Big Daddy Kane, Tommy Lister Jr., Stephen Baldwin, Billy Zane, Mario Van Peebles",Mario Van Peebles,"Cinemax Amazon Channel, Cinemax Apple TV Channel ","Apple TV, Amazon Video, Vudu, AMC on Demand ","Apple TV, Amazon Video, Vudu ","Working Title Films, PolyGram Filmed Entertainment",Unknown
Sister Act 2: Back in the Habit,107,English,"Deloris Van Cartier is again asked to don the nun's habit to help a run-down Catholic school, presided over by Mother Superior. And if trying to reach out to a class full of uninterested students wasn't bad enough, the sisters discover that the school is due to be closed by the unscrupulous chief of a local authority.",1993,"Music, Comedy","nun, education, music competition, singing nun, singing, mother superior, catholic school, monastery, domineering mother, teenage rebellion, board of education, school choir, urban youth","Whoopi Goldberg, Kathy Najimy, Maggie Smith, Sheryl Lee Ralph, Lauryn Hill",Bill Duke,Disney Plus ,"Apple TV, Amazon Video, Google Play Movies, YouTube, Vudu, Microsoft Store, AMC on Demand ","Apple TV, Amazon Video, Google Play Movies, YouTube, Vudu, Microsoft Store ",Touchstone Pictures,Unknown
The Piano,117,English,"A mute Scottish woman arrives in colonial New Zealand for an arranged marriage. Her husband refuses to move her beloved piano, giving it to neighbor George Baines, who agrees to return the piano in exchange for lessons. As desire swirls around the duo, the wilderness consumes the European enclave.",1993,"Drama, Romance","adultery, secret love, beach, jealousy, love triangle, isolation, culture clash, sexuality, arranged marriage, strangeness, violent husband, new zealand, maori, settler, wilderness, mute, pianist, playing piano, woman director, sign languages, piano, 19th century, severed finger, mother daughter relationship","Holly Hunter, Sam Neill, Cliff Curtis, Harvey Keitel, Anna Paquin",Jane Campion,,"Apple TV, Vudu, AMC on Demand ",Apple TV ,"New South Wales Film & Television Office, Jan Chapman Productions, Australian Film Commission, CiBy 2000",Unknown
Arizona Dream,142,English,"An Innuit hunter races his sled home with a fresh-caught halibut. This fish pervades the entire film, in real and imaginary form. Meanwhile, Axel tags fish in New York as a naturalist's gofer. He's happy there, but a messenger arrives to bring him to Arizona for his uncle's wedding. It's a ruse to get Axel into the family business. In Arizona, Axel meets two odd women: vivacious, needy, and plagued by neuroses and familial discord. He gets romantically involved with one, while the other, rich but depressed, plays accordion tunes to a gaggle of pet turtles",1993,"Fantasy, Comedy, Drama, Romance","flying, self-discovery, arizona, car dealer, american dream","Johnny Depp, Faye Dunaway, Jerry Lewis, Lili Taylor, Vincent Gallo",Emir Kusturica,,"Apple TV, Amazon Video, Google Play Movies, YouTube, Vudu ","Apple TV, Amazon Video, Google Play Movies, YouTube, Vudu ","Hachette Première, Constellation, Canal+, UGC Films",Unknown
Demolition Man,115,English,"Simon Phoenix, a violent criminal cryogenically frozen in 1996, escapes during a parole hearing in 2032 in the utopia of San Angeles. Police are incapable of dealing with his violent ways and turn to his captor, who had also been cryogenically frozen after being wrongfully accused of killing 30 innocent people while apprehending Phoenix.",1993,"Crime, Action, Science Fiction","future, martial arts, helicopter, police, psychopath, crime fighter, dystopia, museum, social control, cryogenics, utopia, fistfight, prison escape, product placement, betrayal, shootout, cyberpunk, explosion, foot chase, warden, subterranean, totalitarianism, censorship, culture shock, knitting, 2030s","Wesley Snipes, Benjamin Bratt, Sylvester Stallone, Nigel Hawthorne, Sandra Bullock",Marco Brambilla,,"Apple TV, Amazon Video, Google Play Movies, YouTube, Vudu, Microsoft Store, AMC on Demand ","Apple TV, Amazon Video, Google Play Movies, YouTube, Vudu, Microsoft Store ","Silver Pictures, Warner Bros. Pictures",http://www.warnerbros.com/demolition-man
Fire in the Sky,109,English,"A group of men who were clearing brush for the government arrive back in town, claiming that their friend was abducted by aliens. Nobody believes them, and despite a lack of motive and no evidence of foul play, their friends' disappearance is treated as murder.",1993,"Science Fiction, Drama, Mystery","small town, based on novel or book, police, arizona, biography, based on true story, woods, alien, ufo, extraterrestrial, alien abduction, search party, media coverage, logger, kidnapped","Peter Berg, Robert Patrick, D.B. Sweeney, Craig Sheffer, Henry Thomas",Rob Lieberman,,"Apple TV, Amazon Video, Google Play Movies, YouTube, Vudu, Microsoft Store, AMC on Demand ","Apple TV, Amazon Video, Google Play Movies, YouTube, Vudu, Microsoft Store ",Paramount,Unknown
The Visitors,107,French,"This outrageous time-travel comedy follows the misadventures of a wacky medieval knight (Jean Reno) and his faithful servant when they are accidentally transported to contemporary times by a senile sorcerer. Mayhem rules as these 12th-century visitors try adapting to the wildly confusing modern world. To avoid being stuck here for good, however, they soon begin an all-out cosmic assault on their former castle -- now a luxury hotel -- in their quest to return to the past.",1993,"Fantasy, Comedy","servant, time travel, clumsy fellow, middle ages (476-1453), nobility","Marie-Anne Chazel, Christian Bujeau, Jean Reno, Valérie Lemercier, Christian Clavier",Jean-Marie Poiré,,"Apple TV, Amazon Video, Vudu ","Apple TV, Amazon Video, Vudu ","Canal+, Gaumont International, France 3 Cinéma, Gaumont",Unknown
Last Action Hero,131,English,"Following the death of his father, young Danny Madigan takes comfort in watching action movies featuring the indestructible Los Angeles cop Jack Slater. After being given a magic ticket by theater manager Nick, Danny is sucked into the screen and bonds with Slater. When evil fictional villain Benedict gets his hands on the ticket and enters the real world, Danny and Jack must follow and stop him.",1993,"Adventure, Fantasy, Action, Comedy, Family","hero, magic, villain, child in peril, film in film, breaking the fourth wall, spoof, magical object, cartoon cat, ticket, self-referential, projectionist, child's point of view, action hero, good versus evil","Austin O'Brien, Bridgette Wilson-Sampras, Art Carney, F. Murray Abraham, Arnold Schwarzenegger",John McTiernan,,"Apple TV, Amazon Video, Google Play Movies, YouTube, Vudu, Microsoft Store, AMC on Demand ","Apple TV, Amazon Video, Google Play Movies, YouTube, Vudu, Microsoft Store ","Oak Productions, Columbia Pictures",Unknown
Three Colors: Blue,98,French,"The wife of a famous composer survives a car accident that kills her husband and daughter. Now alone, she shakes off her old identity and explores her newfound freedom but finds that she is unbreakably bound to other humans, including her husband’s mistress, whose existence she never suspected.",1993,Drama,"paris, france, composer, pain, to compose, loss of loved one","Charlotte Véry, Benoît Régent, Juliette Binoche, Hélène Vincent, Florence Pernel",Krzysztof Kieślowski,"Max Amazon Channel, Criterion Channel ","Apple TV, Amazon Video ","Apple TV, Amazon Video ","France 3 Cinéma, CED Productions, MK2 Films, CAB Productions, Zespół Filmowy ""Tor"", Canal+, CNC, Eurimages",Unknown
Jurassic Park,127,English,"A wealthy entrepreneur secretly creates a theme park featuring living dinosaurs drawn from prehistoric DNA. Before opening day, he invites a team of experts and his two eager grandchildren to experience the park and help calm anxious investors. However, the park is anything but amusing as the security systems go off-line and the dinosaurs escape.",1993,"Adventure, Science Fiction","exotic island, island, triceratops, brontosaurus, electric fence, dna, tyrannosaurus rex, paleontology, dinosaur, amusement park, theme park","Sam Neill, Richard Attenborough, Laura Dern, Jeff Goldblum, Bob Peck",Steven Spielberg,"Netflix, Netflix basic with Ads ","Apple TV, Amazon Video, Google Play Movies, YouTube, Vudu, Microsoft Store, AMC on Demand ","Apple TV, Amazon Video, Google Play Movies, YouTube, Vudu, Microsoft Store, FlixFling ","Universal Pictures, Amblin Entertainment",http://www.jurassicpark.com/
Dragon Ball Z: Broly – The Legendary Super Saiyan,70,Japanese,"While the Saiyan Paragus persuades Vegeta to rule a new planet, King Kai alerts Goku of the South Galaxy's destruction by an unknown Super Saiyan.",1993,"Animation, Science Fiction, Action","mind control, martial arts, legend, superhero, transformation, space travel, based on manga, martial artist, super power, super villain, anime, father son relationship","Ryou Horikawa, Takeshi Kusao, Iemasa Kayumi, Masako Nozawa, Bin Shimada",Shigeyasu Yamauchi,Crunchyroll ,Apple TV ,Apple TV ,"Toei Company, Bird Studios, Toei Animation",Unknown
The Nightmare Before Christmas,76,English,"Tired of scaring humans every October 31 with the same old bag of tricks, Jack Skellington, the spindly king of Halloween Town, kidnaps Santa Claus and plans to deliver shrunken heads and other ghoulish gifts to children on Christmas morning. But as Christmas approaches, Jack's rag-doll girlfriend, Sally, tries to foil his misguided plans.",1993,"Fantasy, Animation, Family","skeleton, fire, magic, holiday, santa claus, halloween, musical, christmas tree, saving christmas, pumpkin, woods, stop motion, christmas","Glenn Shadix, William Hickey, Danny Elfman, Catherine O'Hara, Chris Sarandon",Henry Selick,Disney Plus ,"Apple TV, Amazon Video, Google Play Movies, YouTube, Vudu, Microsoft Store, AMC on Demand ","Apple TV, Amazon Video, Google Play Movies, YouTube, Vudu, Microsoft Store, Spectrum On Demand ","Touchstone Pictures, Skellington Productions, Buena Vista Pictures",https://movies.disney.com/the-nightmare-before-christmas
The Vanishing,109,English,The boyfriend of an abducted woman never gives up the search as the abductor looks on.,1993,"Thriller, Drama, Mystery, Horror","buried alive, remake","Nancy Travis, Kiefer Sutherland, Jeff Bridges, Park Overall, Sandra Bullock",George Sluizer,,,,20th Century Fox,Unknown
What's Eating Gilbert Grape,118,English,"Gilbert Grape is a small-town young man with a lot of responsibility. Chief among his concerns are his mother, who is so overweight that she can't leave the house, and his mentally impaired younger brother, Arnie, who has a knack for finding trouble. Settled into a job at a grocery store and an ongoing affair with local woman Betty Carver, Gilbert finally has his life shaken up by the free-spirited Becky.",1993,"Romance, Drama","mentally disabled, sibling relationship, based on novel or book, widow, iowa, dysfunctional family, obesity, single mother, grocery store, mentally handicapped child","Leonardo DiCaprio, Johnny Depp, Juliette Lewis, Darlene Cates, Mary Steenburgen",Lasse Hallström,"Hoopla, Showtime Apple TV Channel ","Apple TV, Amazon Video, Google Play Movies, YouTube, Vudu, Microsoft Store, AMC on Demand ","Apple TV, Amazon Video, Google Play Movies, YouTube, Vudu, Microsoft Store ",Paramount,Unknown
The Beverly Hillbillies,93,English,"Jed Clampett and kin move from Arkansas to Beverly Hills when he becomes a billionaire, after an oil strike. The country folk are very naive with regard to life in the big city, so when Jed starts a search for a new wife there are inevitably plenty of takers and con artists ready to make a fast buck",1993,"Comedy, Family","arkansas, oil, billionaire, hillbilly, beverly hills, woman director","Diedrich Bader, Jim Varney, Erika Eleniak, Cloris Leachman, Lily Tomlin",Penelope Spheeris,,,,20th Century Fox,Unknown
Hot Shots! Part Deux,86,English,"Topper Harley is found to be working as an odd-job-man in a monastery. The CIA want him to lead a rescue mission into Iraq, to rescue the last rescue team, who went in to rescue the last rescue team—who went in to rescue hostages left behind after Desert Storm.",1993,"Action, Comedy, War","rescue, swordplay, liberation of hostage, secret agent, parody, iraq war, near east","Rowan Atkinson, Richard Crenna, Valeria Golino, Lloyd Bridges, Charlie Sheen",Jim Abrahams,Hulu ,"Apple TV, Amazon Video, Google Play Movies, YouTube, Vudu, Microsoft Store, AMC on Demand ","Apple TV, Amazon Video, Google Play Movies, YouTube, Vudu, Microsoft Store ","Sidley Wright & Associates, 20th Century Fox",Unknown
The Good Son,87,English,"A young boy stays with his aunt and uncle, and befriends his cousin who's the same age. But his cousin begins showing increasing signs of psychotic behavior.",1993,"Thriller, Drama, Horror","parent child relationship, sadism, psychopath, sadistic, manipulation, deception, sociopath, murder, problem child, deceit, disbelief, lying, disbelieving adult, psycho, nobody believes, uncover truth, psychopathic","Wendy Crewson, Elijah Wood, Macaulay Culkin, David Morse, Daniel Hugh Kelly",Joseph Ruben,Starz Apple TV Channel ,"Apple TV, Amazon Video, Google Play Movies, YouTube, Vudu, Microsoft Store, AMC on Demand ","Apple TV, Amazon Video, Google Play Movies, YouTube, Vudu, Microsoft Store ","20th Century Fox, Tura-Film",Unknown
Body of Evidence,101,English,"When an elderly millionaire is found dead with cocaine in his system, his will leaves $8 million to Rebecca Carlson, who was having an affair with him. District attorney Robert Garrett decides to prosecute Rebecca, arguing that she deliberately engaged in wild sex with the old man to overexcite him and lead to his premature death. Defense attorney Frank Dulaney defends Rebecca in court while getting sucked into a dangerous affair with her.",1993,"Drama, Thriller, Romance","infidelity, eroticism, seduction, murder, drugs, neo-noir","Jürgen Prochnow, Madonna, Anne Archer, Julianne Moore, Willem Dafoe",Uli Edel,"fuboTV, MGM Plus Roku Premium Channel, MGM Plus ","Apple TV, Google Play Movies, YouTube, Vudu, AMC on Demand ","Apple TV, Google Play Movies, YouTube, Vudu ","Metro-Goldwyn-Mayer, Constantin Film",http://www.mgm.com/#/our-titles/226/Body-Of-Evidence
Crazy Love,77,Unknown,"What was supposed to be summer school in England becomes an adventurous exotic and romantic journey for a beautiful teenage girl. [from the Tai Seng Catalog] A nice story of a free-sprited (or, depending on your viewpoint, prick-teasing) young woman on a short journey of discovery.",1993,"Comedy, Romance, Drama",None,"Kai-Chung Mak, San Tak-Kan, Tom Poon Chun-Wai, Loletta Lee, Terrence Fok Shui-Wa",Roman Cheung,,,,Ko Chi Sum Films Company Limited,Unknown
Dennis the Menace,94,English,Mr. Wilson's ever-present annoyance comes in the form of one mischievous kid named Dennis. But he'll need Dennis's tricks to uncover a collection of gold coins that go missing when a shady drifter named Switchblade Sam comes to town.,1993,"Family, Comedy","babysitter, based on comic, slingshot","Mason Gamble, Walter Matthau, Christopher Lloyd, Lea Thompson, Joan Plowright",Nick Castle,Hoopla ,"Apple TV, Amazon Video, Google Play Movies, YouTube, Vudu, Microsoft Store, AMC on Demand ","Apple TV, Amazon Video, Google Play Movies, YouTube, Vudu, Microsoft Store ","Hughes Entertainment, Warner Bros. Family Entertainment, Warner Bros. Pictures",Unknown
Point of No Return,108,English,"Hardened criminal Maggie Hayward's consistent violence, even in police custody, ends in the execution chamber. However, top-secret US government agent 'Bob' arranges a staged death, so Maggie can be elaborately trained as a phantom killer and subdued into obedience.",1993,"Action, Crime, Thriller","death penalty, assassin, washington dc, usa, new orleans, louisiana, doomed man, lethal injection, secret agent, remake","Bridget Fonda, Miguel Ferrer, Dermot Mulroney, Anne Bancroft, Gabriel Byrne",John Badham,,"Apple TV, Amazon Video, Google Play Movies, YouTube, Vudu ","Apple TV, Amazon Video, Google Play Movies, YouTube, Vudu, Spectrum On Demand ","Warner Bros. Pictures, The Linson Company",Unknown
Dangerous Game,108,English,"A New York film director, working on his latest movie in Los Angeles, begins to reflect the actions in his movie and real life, especially when he begins an affair with the lead actress.",1993,Drama,"drugs, divorce, filmmaking","Madonna, Reilly Murphy, Harvey Keitel, James Russo, Nancy Ferrara",Abel Ferrara,,Vudu ,Vudu ,"Maverick Picture Company, Cecchi Gori Europa N.V., Eye Productions, Pentamerica, Metro-Goldwyn-Mayer",Unknown
Geronimo: An American Legend,115,English,"The Apache Indians have reluctantly agreed to settle on a US Government approved reservation. Not all the Apaches are able to adapt to the life of corn farmers. One in particular, Geronimo, is restless. Pushed over the edge by broken promises and necessary actions by the government, Geronimo and thirty or so other warriors form an attack team which humiliates the government by evading capture, while reclaiming what is rightfully theirs.",1993,"Western, History, Action","apache nation, native american, historical figure, historical, cavalry, geronimo","Wes Studi, Robert Duvall, Gene Hackman, Jason Patric, Matt Damon",Walter Hill,,"Apple TV, Amazon Video, Google Play Movies, YouTube, Vudu, Microsoft Store, AMC on Demand ","Apple TV, Amazon Video, Google Play Movies, YouTube, Vudu, Microsoft Store ",Columbia Pictures,Unknown
Schindler's List,195,English,The true story of how businessman Oskar Schindler saved over a thousand Jewish lives from the Nazis while they worked as slaves in his factory during World War II.,1993,"Drama, History, War","factory, hero, based on novel or book, nazi, concentration camp, ss (nazi schutzstaffel), holocaust (shoah), world war ii, ghetto, jew persecution, defense industry, auschwitz-birkenau concentration camp, biography, based on true story, industrialist, historical fiction, black and white, train, poland, weapons manufacturer, absurd","Jonathan Sagall, Ben Kingsley, Liam Neeson, Ralph Fiennes, Caroline Goodall",Steven Spielberg,Showtime Apple TV Channel ,"Apple TV, Amazon Video, Google Play Movies, YouTube, Vudu, Microsoft Store, AMC on Demand ","Apple TV, Amazon Video, Google Play Movies, YouTube, Vudu, Microsoft Store, Spectrum On Demand ",Amblin Entertainment,http://www.schindlerslist.com/
The Pelican Brief,141,English,"A law student's theory about the recent deaths of two Supreme Court justices embroils her in a far-reaching web of murder, corruption, and greed.",1993,Thriller,"judge, professor, mission of murder, supreme court, legal thriller","Sam Shepard, John Heard, Denzel Washington, Tony Goldwyn, Julia Roberts",Alan J. Pakula,,"Apple TV, Amazon Video, Google Play Movies, YouTube, Vudu, Microsoft Store, AMC on Demand ","Apple TV, Amazon Video, Google Play Movies, YouTube, Vudu, Microsoft Store, Spectrum On Demand ",Warner Bros. Pictures,Unknown
A Bronx Tale,121,English,"Set in the Bronx during the tumultuous 1960s, an adolescent boy is torn between his honest, working-class father and a violent yet charismatic crime boss. Complicating matters is the youngster's growing attraction - forbidden in his neighborhood - for a beautiful black girl.",1993,"Drama, Crime","italian american, gambling, funeral, italian, parent child relationship, gangster, black people, loyalty, molotow cocktail, gang leader, nostalgia, game of dice, bus driver, mafia, best friend, witness to murder, hoodlum, xenophobia, bronx, new york city, father figure, 1960s, confession booth","Chazz Palminteri, Taral Hicks, Lillo Brancato, Robert De Niro, Francis Capra",Robert De Niro,"AMC Plus Apple TV Channel , AMC+ Amazon Channel, AMC+ Roku Premium Channel ","Apple TV, Amazon Video, Google Play Movies, YouTube, Vudu, Microsoft Store ","Apple TV, Amazon Video, Google Play Movies, YouTube, Vudu, Microsoft Store, Spectrum On Demand ","Price Entertainment, Penta Entertainment, Tribeca Productions",Unknown
