Title,Runtime (minutes),Language,Overview,Release Year,Genre,Keywords,Actors,Directors,Stream,Buy,Rent,Production Companies,Website
Hocus Pocus,96,English,"After 300 years of slumber, three sister witches are accidentally resurrected in Salem on Halloween night, and it is up to three kids and their newfound feline friend to put an end to the witches' reign of terror once and for all.",1993,"Fantasy, Comedy, Family","witch, virgin, sibling relationship, magic, halloween, undead, resurrection, potion, salem, massachusetts, trick or treating, spellcasting, talking cat, time skip, grimoire","Kathy Najimy, Thora Birch, Bette Midler, Omri Katz, Sarah Jessica Parker",Kenny Ortega,Disney Plus ,"Apple TV, Amazon Video, Google Play Movies, YouTube, Vudu, Microsoft Store, AMC on Demand ","Apple TV, Amazon Video, Google Play Movies, YouTube, Vudu, Microsoft Store ","Walt Disney Pictures, Touchwood Pacific Partners 1",https://movies.disney.com/hocus-pocus
Groundhog Day,101,English,"A narcissistic TV weatherman, along with his attractive-but-distant producer, and his mawkish cameraman, is sent to report on Groundhog Day in the small town of Punxsutawney, where he finds himself repeating the same day over and over.",1993,"Romance, Fantasy, Drama, Comedy","deja vu, groundhog, weather forecast, telecaster, pennsylvania, usa, alarm clock, winter, time warp, holiday, time loop, magic realism, existentialism, groundhog day","Stephen Tobolowsky, Chris Elliott, Bill Murray, Andie MacDowell, Brian Doyle-Murray",Harold Ramis,fuboTV ,"Apple TV, Amazon Video, Google Play Movies, YouTube, Vudu, Microsoft Store, AMC on Demand ","Apple TV, Amazon Video, Google Play Movies, YouTube, Vudu, Microsoft Store, Spectrum On Demand ",Columbia Pictures,Unknown
El Mariachi,81,Spanish,"El Mariachi just wants to play his guitar and carry on the family tradition. Unfortunately, the town he tries to find work in has another visitor, a killer who carries his guns in a guitar case. The drug lord and his henchmen mistake el Mariachi for the killer, Azul, and chase him around town trying to kill him and get his guitar case.",1993,"Action, Crime, Thriller, Western","mistaken identity, mariachi, concealed weapon","Jaime de Hoyos, Reinol Martinez, Carlos Gallardo, Consuelo Gómez, Peter Marquardt",Robert Rodriguez,,"Apple TV, Amazon Video, Google Play Movies, YouTube, Vudu, Microsoft Store, AMC on Demand ","Apple TV, Amazon Video, Google Play Movies, YouTube, Vudu, Microsoft Store ","Columbia Pictures, Los Hooligans Productions",Unknown
Stalingrad,134,German,"A German Platoon is explored through the brutal fighting of the Battle of Stalingrad. After half of their number is wiped out and they're placed under the command of a sadistic captain, the platoon lieutenant leads his men to desert. The platoon members attempt escape from the city, now surrounded by the Soviet Army.",1993,"Drama, History, War","winter, world war ii, stalingrad, machine gun, horrors of war, german soldier, comradeship, soviet tank","Dana Vávrová, Thomas Kretschmann, Dominique Horwitz, Sebastian Rudolph, Jochen Nickel",Joseph Vilsmaier,,,,"B.A. Produktion, Bavaria Film, Perathon Film-und Fernsehproduktions, Royal Film (I)",Unknown
Carlito's Way,144,English,"A Puerto-Rican ex-con, just released from prison, pledges to stay away from drugs and violence despite the pressure around him, and lead a better life outside NYC.",1993,"Crime, Drama, Romance, Thriller","new york city, based on novel or book, gangster, go-go dancer, release from prison, 1970s, puerto rico, cocaine, nightclub, criminal past, love, lawyer, drugs, disco, neo-noir","Ingrid Rogers, Al Pacino, John Leguizamo, Penelope Ann Miller, Sean Penn",Brian De Palma,"fuboTV, MGM Plus Amazon Channel, Starz Apple TV Channel, MGM Plus Roku Premium Channel, MGM Plus ","Apple TV, Amazon Video, Google Play Movies, YouTube, Vudu, Microsoft Store, AMC on Demand ","Apple TV, Amazon Video, Google Play Movies, YouTube, Vudu, Microsoft Store, Spectrum On Demand ","Universal Pictures, Epic Productions, Bregman/Baer Productions",Unknown
Sommersby,109,English,"Set in the South just after the US Civil War, Laurel Sommersby is just managing to work the farm without her husband, believed killed in battle. By all accounts, Jack Sommersby was not a pleasant man, thus when he suddenly returns, Laurel has mixed emotions. It appears that Jack has changed a great deal, leading some people to believe that this is not actually Jack but an imposter. Laurel herself is unsure, but willing to take the man into her home, and perhaps later into her heart.",1993,"Drama, Thriller, Mystery, Romance","husband wife relationship, court case, war veteran, ku klux klan, southern usa, village life, return, peasant, suspicion of murder, gallows, violent husband, death sentence, agriculture, racial segregation, based on true story, look-alike, hanging, post civil war, soldier's wife, reconstruction era, imposter","Jodie Foster, Bill Pullman, Lanny Flaherty, Richard Gere, James Earl Jones",Jon Amiel,Starz Apple TV Channel ,"Apple TV, Google Play Movies, YouTube, Vudu, Microsoft Store ","Apple TV, Google Play Movies, YouTube, Vudu, Microsoft Store ","Canal+, Regency Enterprises, Alcor Films",Unknown
Sailor Moon R: The Movie,61,Japanese,"While enjoying the flower gardens, Sailor Moon and friends encounter an old childhood friend of Mamoru's: an alien! He's come back to give Mamoru a special flower but doesn't like Usagi and the rest of the planet's inhabitants. Sailor Moon must defend the earth from the evil Kisenian Flower he's brought back... before the evil vines and blossoms overrun the planet!",1993,"Animation, Romance, Action, Fantasy","asteroid, superhero, transformation, rose, tokyo, japan, anime, supernatural power, based on tv series, vine, magical girl","Kotono Mitsuishi, Michie Tomizawa, Toru Furuya, Emi Shinohara, Aya Hisakawa",Kunihiko Ikuhara,"Funimation Now, Hoopla ","Apple TV, Amazon Video, Google Play Movies, YouTube, Vudu, Microsoft Store ","Apple TV, Amazon Video, Vudu ","Toei Animation, TV Asahi",Unknown
Another Stakeout,105,English,Chris and Bill are called upon for their excellent surveillance record to stakeout a lakeside home where a Mafia trial witness is believed to be heading or already hiding.,1993,"Comedy, Crime, Action","gangster, cop, stakeout, police stakeout","Miguel Ferrer, Emilio Estevez, Rosie O'Donnell, Dennis Farina, Richard Dreyfuss",John Badham,,"Apple TV, Amazon Video, Google Play Movies, YouTube, Vudu, Microsoft Store, AMC on Demand ","Apple TV, Amazon Video, Google Play Movies, YouTube, Vudu, Microsoft Store ",Touchstone Pictures,Unknown
Homeward Bound: The Incredible Journey,84,English,"Before the Seavers leave for a family vacation to San Francisco, they drop off their pets -- Chance, an adventurous American bulldog; Shadow, a wise golden retriever; and Sassy, a cautious cat -- at a friend's ranch. But when the animals start to worry that they've been left for good, the three embark together on a treacherous and thrilling journey to find their way back home through the California wilderness.",1993,"Adventure, Comedy, Family","friendship, based on novel or book, cat, remake, dog, journey, pets","Sally Field, Michael J. Fox, Kim Greist, Don Ameche, Kevin Chevalia",Duwayne Dunham,Disney Plus ,"Apple TV, Amazon Video, Google Play Movies, YouTube, Vudu, Microsoft Store, AMC on Demand ","Apple TV, Amazon Video, Google Play Movies, YouTube, Vudu, Microsoft Store ","Touchwood Pacific Partners 1, Walt Disney Pictures",Unknown
The Firm,154,English,"Mitch McDeere is a young man with a promising future in Law. About to sit his Bar exam, he is approached by 'The Firm' and made an offer he doesn't refuse. Seduced by the money and gifts showered on him, he is totally oblivious to the more sinister side of his company. Then, two Associates are murdered. The FBI contact him, asking him for information and suddenly his life is ruined. He has a choice - work with the FBI, or stay with the Firm. Either way he will lose his life as he knows it. Mitch figures the only way out is to follow his own plan...",1993,"Drama, Mystery, Thriller","fbi, tennessee, lawyer, law firm, bar exam, legal thriller","Gene Hackman, Tom Cruise, Hal Holbrook, Jeanne Tripplehorn, Terry Kinney",Sydney Pollack,"Paramount Plus, Paramount Plus Apple TV Channel , Paramount+ Amazon Channel, Hoopla ","Apple TV, Amazon Video, Google Play Movies, YouTube, Vudu, Microsoft Store, AMC on Demand ","Apple TV, Amazon Video, Google Play Movies, YouTube, Vudu, Microsoft Store, Spectrum On Demand ","Mirage Enterprises, Paramount, Davis Entertainment, Scott Rudin Productions",Unknown
Mrs. Doubtfire,125,English,"Loving but irresponsible dad Daniel Hillard, estranged from his exasperated spouse, is crushed by a court order allowing only weekly visits with his kids. When Daniel learns his ex needs a housekeeper, he gets the job -- disguised as a British nanny. Soon he becomes not only his children's best pal but the kind of parent he should have been from the start.",1993,"Comedy, Drama, Family","mask, parent child relationship, san francisco, california, social worker, transvestite, nanny, restaurant, fake identity, custody battle, responsibility, voice acting, divorced couple","Sally Field, Robin Williams, Mara Wilson, Lisa Jakub, Matthew Lawrence",Chris Columbus,Disney Plus ,"Apple TV, Amazon Video, Google Play Movies, YouTube, Vudu, Microsoft Store, AMC on Demand ","Apple TV, Amazon Video, Google Play Movies, YouTube, Vudu, Microsoft Store ","20th Century Fox, Blue Wolf Productions",Unknown
In the Line of Fire,128,English,"Veteran Secret Service agent Frank Horrigan is a man haunted by his failure to save President Kennedy while serving protection detail in Dallas. Thirty years later, a man calling himself ""Booth"" threatens the life of the current President, forcing Horrigan to come back to protection detail to confront the ghosts from his past.",1993,"Action, Drama, Thriller, Crime, Mystery","assassin, cia, usa president, the white house, bodyguard, stalking, election, secret service, u.s. secret service agent","Dylan McDermott, Rene Russo, Gary Cole, Clint Eastwood, John Malkovich",Wolfgang Petersen,,"Apple TV, Amazon Video, Google Play Movies, YouTube, Vudu, Microsoft Store, AMC on Demand ","Apple TV, Amazon Video, Google Play Movies, YouTube, Vudu, Microsoft Store, Spectrum On Demand ","Castle Rock Entertainment, Apple / Rose, Columbia Pictures",Unknown
Wayne's World 2,95,English,"A message from Jim Morrison in a dream prompts cable access TV stars Wayne and Garth to put on a rock concert, ""Waynestock,"" with Aerosmith as headliners. But amid the preparations, Wayne frets that a record producer is putting the moves on his girlfriend, Cassandra, while Garth handles the advances of mega-babe Honey Hornee.",1993,"Comedy, Music","concert, rock 'n' roll, dream, love of one's life, talk show, kiss, buddy, duringcreditsstinger","Chris Farley, Dana Carvey, Tia Carrere, Christopher Walken, Mike Myers",Stephen Surjik,,"Apple TV, Google Play Movies, YouTube, Vudu, Microsoft Store ","Apple TV, Amazon Video, Google Play Movies, YouTube, Vudu, Microsoft Store, Spectrum On Demand ",Paramount,Unknown
RoboCop 3,104,English,"The mega corporation Omni Consumer Products is still bent on creating their pet project, Delta City, to replace the rotting city of Detroit. Unfortunately, the inhabitants of the area have no intention of abandoning their homes simply for desires of the company. To this end, OCP have decided to force them to leave by employing a ruthless mercenary army to attack and harass them. An underground resistance begins and in this fight, RoboCop must decide where his loyalties lie.",1993,"Action, Adventure, Crime, Science Fiction, Thriller","police, cyborg, dystopia, sequel, cyberpunk, policeman","Jill Hennessy, John Castle, Nancy Allen, Rip Torn, Robert John Burke",Fred Dekker,"Max, Max Amazon Channel ","Apple TV, Amazon Video, Google Play Movies, YouTube, Vudu, Microsoft Store, AMC on Demand ","Apple TV, Amazon Video, Google Play Movies, YouTube, Vudu, Microsoft Store, Spectrum On Demand ","Orion Pictures, Metro-Goldwyn-Mayer",Unknown
In the Name of the Father,133,English,"A small time thief from Belfast, Gerry Conlon, is falsely implicated in the IRA bombing of a pub that kills several people while he is in London. He and his four friends are coerced by British police into confessing their guilt. Gerry's father and other relatives in London are also implicated in the crime. He spends fifteen years in prison with his father trying to prove his innocence.",1993,Drama,"prison, rebellion, based on novel or book, bomb, parent child relationship, faith, 1970s, biography, northern ireland, trial, torture, terrorism, courtroom","Emma Thompson, John Lynch, Daniel Day-Lewis, Pete Postlethwaite, Corin Redgrave",Jim Sheridan,,"Apple TV, Amazon Video, Google Play Movies, YouTube, Vudu, Microsoft Store ","Apple TV, Amazon Video, Google Play Movies, YouTube, Vudu, Microsoft Store ","Hell's Kitchen, Universal Pictures",Unknown
Dazed and Confused,102,English,"The adventures of a group of Texas teens on their last day of school in 1976, centering on student Randall Floyd, who moves easily among stoners, jocks and geeks. Floyd is a star athlete, but he also likes smoking weed, which presents a conundrum when his football coach demands he sign a ""no drugs"" pledge.",1993,"Comedy, Drama","high school, 1970s, texas, coming of age, marijuana, summer, period drama, teenager","Joey Lauren Adams, Rory Cochrane, Jason London, Matthew McConaughey, Milla Jovovich",Richard Linklater,Showtime Apple TV Channel ,"Apple TV, Amazon Video, Google Play Movies, YouTube, Vudu, Microsoft Store, AMC on Demand ","Apple TV, Amazon Video, Google Play Movies, YouTube, Vudu, Microsoft Store ","Gramercy Pictures, Detour Film Production, Alphaville",Unknown
Ninja Scroll,94,Japanese,"Jubei is a masterless ninja who travels the land alone, lending his services to those with gold—or a worthy cause. His fearsome abilities have served him well, but a plot to overthrow the government threatens to end his wandering ways—and possibly his life.",1993,"Fantasy, Adventure, Animation, Action","rescue, japan, bondage, sexual abuse, ninja, tragedy, cruelty, demon, female ninja, scroll, kunoichi, anime","Emi Shinohara, Takeshi Aono, Ryuuzaburou Ootomo, Koichi Yamadera, Daisuke Gori",Yoshiaki Kawajiri,,,,"Madhouse, Animate Film, JVC, movic",Unknown
The Fugitive,131,English,"Wrongfully convicted of murdering his wife and sentenced to death, Richard Kimble escapes from the law in an attempt to find the real killer and clear his name.",1993,"Action, Thriller, Drama","chicago, illinois, escape, chase, doomed man, surgeon, death sentence, u.s. marshal, flashback, remake, betrayal, fugitive, on the run, conspiracy, police corruption, doctor, home invasion, disguise, one armed man, framed for murder, action hero, manhunt","Jeroen Krabbé, Tommy Lee Jones, Daniel Roebuck, Harrison Ford, Joe Pantoliano",Andrew Davis,fuboTV ,"Apple TV, Amazon Video, Google Play Movies, YouTube, Vudu, Microsoft Store, AMC on Demand ","Apple TV, Amazon Video, Google Play Movies, YouTube, Vudu, Microsoft Store, Spectrum On Demand ",Warner Bros. Pictures,Unknown
Bound by Honor,190,English,"Based on the true life experiences of poet Jimmy Santiago Baca, the film focuses on half-brothers Paco and Cruz, and their bi-racial cousin Miklo. It opens in 1972, as the three are members of an East L.A. gang known as the ""Vatos Locos"", and the story focuses on how a violent crime and the influence of narcotics alter their lives. Miklo is incarcerated and sent to San Quentin, where he makes a ""home"" for himself. Cruz becomes an exceptional artist, but a heroin addiction overcomes him with tragic results. Paco becomes a cop and an enemy to his ""carnal"", Miklo.",1993,"Crime, Action, Drama, Thriller","street gang, ghetto, juvenile prison, artist, jail, east los angeles, youth gang, hood, gang, racism, drugs, mexican american, barrio, police shootout, cholo, lowrider","Benjamin Bratt, Jesse Borrego, Enrique Castillo, Damian Chapa, Victor Rivers",Taylor Hackford,,,,Hollywood Pictures,Unknown
Emmanuelle 7,90,French,"Through the wonders of virtual reality, Emmanuelle tries to help a former schoolmate to overcome a traumatic sexual past.",1993,"Drama, Science Fiction","virtual reality, sexual attraction, kissing, softcore, erotic fantasy, gangbang","Annie Bellac, Sylvia Kristel, Laura Dean, Caroline Laurence, Joel Bui",Francis Leroi,,,,"21st Century Film France, M6 Films",Unknown
Dragon Ball Z: Bojack Unbound,51,Japanese,"Mr. Money is holding another World Martial Arts Tournament and Mr. Satan invites everyone in the world to join in. Little does he know that Bojack, an ancient villain who has escaped his prison, is competing. Since Goku is currently dead, it is up to Gohan, Vegeta, and Trunks to defeat Bojack and his henchman.",1993,"Action, Animation, Science Fiction","martial arts, transformation, super power, martial arts tournament, space pirate, anime, humanoid alien","Mayumi Tanaka, Toshio Furukawa, Masako Nozawa, Tessyo Genda, Daisuke Gori",Yoshihiro Ueda,Crunchyroll ,Apple TV ,Apple TV ,Toei Animation,Unknown
Menace II Society,97,English,A young street hustler attempts to escape the rigors and temptations of the ghetto in a quest for a better life.,1993,"Drama, Crime","drug dealer, street gang, gangster, black people, ghetto, delinquency, los angeles, california","Tyrin Turner, Larenz Tate, Samuel L. Jackson, Glenn Plummer, Jada Pinkett Smith","Albert Hughes, Allen Hughes","Paramount Plus Apple TV Channel , Showtime Apple TV Channel ","Apple TV, Amazon Video, Google Play Movies, YouTube, Vudu, Microsoft Store, AMC on Demand ","Apple TV, Amazon Video, Google Play Movies, YouTube, Vudu, Microsoft Store ",New Line Cinema,Unknown
Mad Dog and Glory,96,English,"Wayne Dobie is a shy cop whose low-key demeanor has earned him the affectionate nickname ""Mad Dog."" After Mad Dog saves the life of Frank Milo, a crime boss and aspiring stand-up comedian, he's offered the company of an attractive young waitress named Glory for a week. At first both are uneasy about the arrangement, but they eventually fall in love. However, the situation becomes complicated when Milo demands Glory back.",1993,"Comedy, Crime, Romance, Drama","police, fistfight, cop, life-saver, singing","Mike Starr, Uma Thurman, Bill Murray, David Caruso, Robert De Niro",John McNaughton,,"Apple TV, Amazon Video, Google Play Movies, YouTube, Vudu ","Apple TV, Amazon Video, Google Play Movies, YouTube, Vudu ","Universal Pictures, Mad Dog Productions",Unknown
Sniper,98,English,Tough guy Thomas Beckett is an US soldier working in the Panamanian jungle. His job is to seek out rebels and remove them using his sniper skills. Beckett is notorious for losing his partners on such missions. This time he's accompanied by crack marksman Richard Miller.,1993,"Action, Drama, Thriller","sniper, panama, fistfight, waterfall, marine, jungle, sniper rifle, dog tag, marksman, surrounded, military uniform, surrender","Aden Young, Tom Berenger, J.T. Walsh, Billy Zane, Kenneth Radley",Luis Llosa,fuboTV ,"Apple TV, Amazon Video, Google Play Movies, YouTube, Vudu, Microsoft Store, AMC on Demand ","Apple TV, Amazon Video, Google Play Movies, YouTube, Vudu, Microsoft Store ","TriStar Pictures, Iguana Producciones, Baltimore Pictures, Sniper Productions",Unknown
Flesh and Bone,126,English,"Haunted by memories of his father murdering a family, Arlis Sweeney prefers to keep to himself, focusing his energy on his work. One day, the traumatic past that eats away at him returns when he meets Kay Davies, a woman connected to the bloody event. Against all odds, Arlis and Kay fall in love; however, when his father, Roy, reappears in his life -- with the coldhearted Ginnie in tow -- Arlis must deal with his past demons.",1993,"Drama, Romance, Thriller","small town, gambling, texas, roadhouse, romance, murder, burglary, home invasion, confrontation, married woman, grifter, haunted by the past, vending machine, solitary, abusive father, country folk, murder of family, unlikely romance, chance encounter, criminal father","James Caan, Meg Ryan, Dennis Quaid, Julia McNeal, Gwyneth Paltrow",Steve Kloves,"Paramount Plus Apple TV Channel , Hoopla, Showtime Apple TV Channel ","Apple TV, Amazon Video, Google Play Movies, YouTube, Vudu, Microsoft Store ","Apple TV, Amazon Video, Google Play Movies, YouTube, Vudu, Microsoft Store ","Paramount, Spring Creek Pictures, Mirage",Unknown
Grumpy Old Men,103,English,"For decades, next-door neighbors and former friends John and Max have feuded, trading insults and wicked pranks. When an attractive widow moves in nearby, their bad blood erupts into a high-stakes rivalry full of naughty jokes and adolescent hijinks.",1993,Comedy,"thanksgiving, retiree, old friends, elderly, aftercreditsstinger, duringcreditsstinger, neighborhood, ice fishing, christmas","Burgess Meredith, Ann-Margret, Walter Matthau, Daryl Hannah, Jack Lemmon",Donald Petrie,,"Apple TV, Amazon Video, Google Play Movies, YouTube, Vudu, Microsoft Store, AMC on Demand ","Apple TV, Amazon Video, Google Play Movies, YouTube, Vudu, Microsoft Store ","John Davis, Lancaster Gate, Warner Bros. Pictures",Unknown
Needful Things,120,English,"A mysterious new shop opens in a small town which always seems to stock the deepest desires of each shopper, with a price far heavier than expected.",1993,"Drama, Horror","small town, sheriff, based on novel or book, pain, strangeness, manipulation, malice, prank, devil, desire, occult","Max von Sydow, Bonnie Bedelia, J.T. Walsh, Ed Harris, Amanda Plummer",Fraser Clarke Heston,,"Apple TV, Amazon Video, Google Play Movies, YouTube, Vudu, Microsoft Store ",Amazon Video ,"New Line Cinema, Castle Rock Entertainment, Columbia Pictures",Unknown
Heart and Souls,104,English,"A fateful night in 1959, four people die when the bus they are riding crashes. They continue as ghosts; their souls become eternally entwined to the life of a child born at the moment of their deaths as his guardians. Baby Thomas grows up to be a businessman who has memories of his playmates, but assumes they are products of his youthful imagination. When the ghosts realize they need Thomas' help to move on to the afterlife, they decide to make an appearance once more.",1993,"Fantasy, Comedy, Romance","businessman, afterlife, san francisco, california, supernatural, redemption, imaginary friend, invisible, ghost, guardian angel, unfulfillment, 1950s, 1990s","Alfre Woodard, Kyra Sedgwick, Tom Sizemore, Charles Grodin, Robert Downey Jr.",Ron Underwood,Starz Apple TV Channel ,,,"Alphaville, Stampede Entertainment, Universal Pictures",Unknown
Teenage Mutant Ninja Turtles III,96,English,"The four turtles travel back in time to the days of the legendary and deadly samurai in ancient Japan, where they train to perfect the art of becoming one. The turtles also assist a small village in an uprising.",1993,"Action, Adventure, Comedy, Family, Fantasy, Science Fiction","martial arts, japan, teleportation, superhero, cartoon, time travel, based on comic, ninja, feudal japan, vigilante justice, anthropomorphic animal","Brian Tochi, Elias Koteas, Corey Feldman, Robbie Rist, Paige Turco",Stuart Gillard,,"Apple TV, Amazon Video, Google Play Movies, YouTube, Vudu, Microsoft Store ","Apple TV, Amazon Video, Google Play Movies, YouTube, Vudu, Microsoft Store, Spectrum On Demand ","Clearwater Holdings Limited, New Line Cinema, Mirage Studios, Orange Sky Golden Harvest",Unknown
The Dark Half,122,English,"Thad Beaumont is the author of a highly successful series of violent pulp thrillers written under the pseudonym of ‘George Stark’, but when he decides to ‘kill-off’ his alter-ego in a mock ceremony, it precipitates a string of sadistic murders matching those in his pulp novels, which are soon discovered to be the work of Stark himself. Looking like a maniacal version of his counterpart, Stark is not so willing to quit the writing game – even if it means coming after Thad's wife and their baby.",1993,"Mystery, Horror","new york city, sheriff, based on novel or book, brain tumor, blackmail, razor, pseudonym, alter ego, murder, maine, author, sparrow, family, super power, graveyard, high toned","Amy Madigan, Robert Joy, Timothy Hutton, Michael Rooker, Julie Harris",George A. Romero,"Amazon Prime Video, MGM Plus Roku Premium Channel, Hoopla ","Apple TV, Google Play Movies, YouTube, Vudu, Microsoft Store ","Apple TV, Vudu, Microsoft Store ","George A. Romero Productions, Orion Pictures",Unknown
Judgment Night,109,English,"Four young friends, while taking a shortcut en route to a local boxing match, witness a brutal murder which leaves them running for their lives.",1993,"Action, Crime, Thriller","drug dealer, chicago, illinois, escape, one night, boxing","Emilio Estevez, Denis Leary, Cuba Gooding Jr., Stephen Dorff, Jeremy Piven",Stephen Hopkins,fuboTV ,"Apple TV, Amazon Video, Google Play Movies, YouTube, Vudu, Microsoft Store ","Apple TV, Amazon Video, Google Play Movies, YouTube, Vudu, Microsoft Store ","Largo Entertainment, JVC, Universal Pictures",Unknown
Falling Down,113,English,An ordinary man frustrated with the various flaws he sees in society begins to psychotically and violently lash out against them.,1993,"Crime, Drama, Thriller","detective, rocket launcher, retirement, traffic jam, gang, los angeles, california, divorce, anger, inequality, road rage, urban decay, laid off, price gouging","Michael Douglas, Tuesday Weld, Rachel Ticotin, Robert Duvall, Barbara Hershey",Joel Schumacher,,"Apple TV, Amazon Video, Google Play Movies, YouTube, Vudu, Microsoft Store, AMC on Demand ","Apple TV, Amazon Video, Google Play Movies, YouTube, Vudu, Microsoft Store ","Regency Enterprises, Alcor Films, Warner Bros. Pictures, Canal+",Unknown
