Title,Runtime (minutes),Language,Overview,Release Year,Genre,Keywords,Actors,Directors,Stream,Buy,Rent,Production Companies,Website
Sliver,108,English,A woman moves into an apartment in Manhattan and learns that the previous tenant's life ended mysteriously after they fell from the balcony.,1993,"Drama, Thriller","new york city, telescope, based on novel or book, psychopath, eroticism, video surveillance, pornographic video, hidden camera, drug use, murder, stalking, invasion of privacy, neighbor, look-alike, landlord, female protagonist, sex talk, voyeur, landlord tenant relationship, mind game, erotic movie, erotic thriller, sex video, similar crime, sexual curiosity","Sharon Stone, Tom Berenger, Colleen Camp, Polly Walker, William Baldwin",Phillip Noyce,"fuboTV, Paramount+ with Showtime, Paramount Plus Apple TV Channel , Paramount+ Amazon Channel, Showtime Roku Premium Channel, Showtime, Showtime Apple TV Channel ","Apple TV, Google Play Movies, YouTube, Vudu, Microsoft Store, AMC on Demand ","Apple TV, Google Play Movies, YouTube, Vudu, Microsoft Store ","Robert Evans Company, Paramount",Unknown
A Perfect World,138,English,"A kidnapped boy strikes up a friendship with his captor: an escaped convict on the run from the law, headed by an honorable U.S. Marshal.",1993,"Drama, Crime","hostage, texas, prison escape, escaped convict, child kidnapping, child driving car, criminologist, 1960s","Kevin Costner, Bradley Whitford, T.J. Lowther, Clint Eastwood, Laura Dern",Clint Eastwood,,"Apple TV, Amazon Video, Google Play Movies, YouTube, Vudu, Microsoft Store ","Apple TV, Amazon Video, Google Play Movies, YouTube, Vudu, Microsoft Store ","Malpaso Productions, Warner Bros. Pictures, Warner Bros.",Unknown
Rape In Public Sea,91,Unknown,"An alternative cut of the movie ""The Sad Story of Saigon"".  A boatload of smugglers are slaughtered by machinegun fire by a bunch of baddies, led by the villain Yuen Wan Tai. A group of Vietnamese refugees living in HK vow revenge on Yuen, who caused each of them harm.",1993,"Action, Crime",None,"Jeffrey Falcon, Sophia M. Crawford, Choi Jeong-Il, Shum Wai, Lam Ching-Ying",Rocky Law,,,,,Unknown
Dragon: The Bruce Lee Story,120,English,"This film is a glimpse into the life, love and the unconquerable spirit of the legendary Bruce Lee. From a childhood of rigorous martial arts training, Lee realizes his dream of opening his own kung-fu school in America. Before long, he is discovered by a Hollywood producer and begins a meteoric rise to fame and an all too short reign as one the most charismatic action heroes in cinema history.",1993,"Drama, History, Action","martial arts, kung fu, life and death, training, biography, hong kong, hollywood","Nancy Kwan, Michael Learned, Lauren Holly, Robert Wagner, Jason Scott Lee",Rob Cohen,,"Apple TV, Amazon Video, Google Play Movies, YouTube, Vudu, Microsoft Store ","Apple TV, Amazon Video, Google Play Movies, YouTube, Vudu, Microsoft Store ","Raffaella De Laurentiis Productions, Universal Pictures",Unknown
Much Ado About Nothing,111,English,"In this Shakespearean farce, Hero and her groom-to-be, Claudio, team up with Claudio's commanding officer, Don Pedro, the week before their wedding to hatch a matchmaking scheme. Their targets are sharp-witted duo Benedick and Beatrice -- a tough task indeed, considering their corresponding distaste for love and each other. Meanwhile, meddling Don John plots to ruin the wedding.",1993,"Drama, Comedy, Romance","new love, rage and hate, bachelor, masked ball, lover, villain, based on play or musical, wedding, intrigue, non-traditional casting","Emma Thompson, Robert Sean Leonard, Kate Beckinsale, Denzel Washington, Kenneth Branagh",Kenneth Branagh,"fuboTV, MGM Plus Amazon Channel, MGM Plus Roku Premium Channel, Hoopla, MGM Plus ","Apple TV, Amazon Video, Google Play Movies, YouTube, Vudu, Microsoft Store, AMC on Demand ","Apple TV, Amazon Video, Google Play Movies, YouTube, Vudu, Microsoft Store ","Renaissance Films, BBC Film, American Playhouse, Samuel Goldwyn Company",Unknown
Return of the Living Dead III,97,English,"Having recently witnessed the horrific results of a top secret project to bring the dead back to life, a distraught teenager performs the operation on his girlfriend after she's killed in a motorcycle accident.",1993,"Science Fiction, Romance, Horror","military base, undead, addiction, motorcycle crash, sequel, gang, zombie, cannibal, body mutilation, self mutilation, carnage, cannibalism","Melinda Clarke, Sarah Douglas, James T. Callahan, J. Trevor Edmond, Kent McCord",Brian Yuzna,,"Apple TV, Amazon Video, Google Play Movies, YouTube, Vudu, Microsoft Store ","Apple TV, Amazon Video, Google Play Movies, YouTube, Vudu, Microsoft Store ","Ozla Productions, Bandai Visual",Unknown
Shadowlands,131,English,"C.S. Lewis, a world-renowned writer and professor, leads a passionless life until he meets spirited poet Joy Gresham.",1993,"Drama, Romance","stroke of fate, england, brother, christianity, literature, bachelor, marriage, based on play or musical, oxford, author, writer, falling in love, 1950s, children's author","Edward Hardwicke, Anthony Hopkins, Michael Denison, Debra Winger, John Wood",Richard Attenborough,,,,"Savoy Pictures, Shadowlands Productions, Price Entertainment, Spelling Films International",Unknown
Addams Family Values,94,English,"Siblings Wednesday and Pugsley Addams will stop at nothing to get rid of Pubert, the new baby boy adored by parents Gomez and Morticia. Things go from bad to worse when the new ""black widow"" nanny, Debbie Jellinsky, launches her plan to add Fester to her collection of dead husbands.",1993,"Comedy, Family, Fantasy","dancing, jealousy, baby, sibling relationship, summer camp, yuppie, butler, nanny, thanksgiving, guillotine, uncle, mansion, wedding, macabre, disembodied hand","Anjelica Huston, Christina Ricci, Joan Cusack, Christopher Lloyd, Raúl Juliá",Barry Sonnenfeld,"fuboTV, Paramount Plus, Paramount Plus Apple TV Channel , Paramount+ Amazon Channel, Paramount+ Roku Premium Channel, Showtime, Showtime Apple TV Channel ","Apple TV, Amazon Video, Google Play Movies, YouTube, Vudu, Microsoft Store, AMC on Demand ","Apple TV, Amazon Video, Google Play Movies, YouTube, Vudu, Microsoft Store ","Scott Rudin Productions, Paramount",Unknown
Dragon Ball Z: The History of Trunks,48,Japanese,It has been thirteen years since the Androids began their killing rampage and Son Gohan is the only person fighting back. He takes Bulma's son Trunks as a student and even gives his own life to save Trunks's. Now Trunks must figure out a way to change this apocalyptic future,1993,"Animation, Action, Science Fiction","android, dystopia, time travel, based on manga, genocide, teacher student relationship, alternate timeline, shounen, anime, mother son relationship, synthetic android","Mayumi Tanaka, Hiromi Tsuru, Ryou Horikawa, Takeshi Kusao, Masako Nozawa",Yoshihiro Ueda,,Apple TV ,Apple TV ,"Fuji Television Network, Toei Company",Unknown
Tombstone,130,English,"Legendary marshal Wyatt Earp, now a weary gunfighter, joins his brothers Morgan and Virgil to pursue their collective fortune in the thriving mining town of Tombstone. But Earp is forced to don a badge again and get help from his notorious pal Doc Holliday when a gang of renegade brigands and rustlers begins terrorizing the town.",1993,"Western, Action","right and justice, saloon, arizona, retirement, historical figure, wyatt earp, doc holliday, gambler, tuberculosis, gunfighter, tombstone arizona, 19th century, ok corral","Kurt Russell, Powers Boothe, Sam Elliott, Val Kilmer, Bill Paxton",George P. Cosmatos,"Hulu, fuboTV, MGM Plus Amazon Channel, MGM Plus Roku Premium Channel, MGM Plus ","Apple TV, Amazon Video, Google Play Movies, YouTube, Vudu, Microsoft Store, AMC on Demand ","Apple TV, Amazon Video, Google Play Movies, YouTube, Vudu, Microsoft Store ","Cinergi Pictures, Hollywood Pictures",Unknown
True Romance,120,English,"Clarence marries hooker Alabama, steals cocaine from her pimp, and tries to sell it in Hollywood, while the owners of the coke try to reclaim it.",1993,"Action, Crime, Romance","hotel, parent child relationship, movie business, detective, mexican standoff, pimp, cocaine, ex-cop, love, murder, on the run, mafia, comic book shop, los angeles, california, drugs, detroit, michigan, illegal prostitution, sicilian, gun violence, aspiring actor, neo-noir, graphic violence","Patricia Arquette, Michael Rapaport, Christian Slater, Bronson Pinchot, Gary Oldman",Tony Scott,,"Apple TV, Amazon Video, Google Play Movies, YouTube, Vudu, Microsoft Store ","Apple TV, Amazon Video, Google Play Movies, YouTube, Vudu, Microsoft Store ","Morgan Creek Entertainment, Davis Films, August Entertainment",Unknown
The Sandlot,101,English,"During a summer of friendship and adventure, one boy becomes a part of the gang, nine boys become a team and their leader becomes a legend by confronting the terrifying mystery beyond the right field wall.",1993,"Family, Comedy","sports, baseball, tree house, dog, fourth of july, san fernando valley, fence, story telling, 1960s, mastiff","Tom Guiry, Chauncey Leopardi, Mike Vitar, Marty York, Patrick Renna",David Mickey Evans,Disney Plus ,"Apple TV, Amazon Video, Google Play Movies, YouTube, Vudu, Microsoft Store, AMC on Demand ","Apple TV, Amazon Video, Google Play Movies, YouTube, Vudu, Microsoft Store ","Island World, 20th Century Fox",https://family.20thcenturystudios.com/movies/the-sandlot
Dave,110,English,A sweet-natured Temp Agency operator and amateur Presidential look-alike is recruited by the Secret Service to become a temporary stand-in for the President of the United States.,1993,Comedy,"coma, usa president, the white house, apoplectic stroke, corgi","Ving Rhames, Kevin Dunn, Frank Langella, Kevin Kline, Sigourney Weaver",Ivan Reitman,,"Apple TV, Amazon Video, Google Play Movies, YouTube, Vudu, Microsoft Store, AMC on Demand ","Apple TV, Amazon Video, Google Play Movies, YouTube, Vudu, Microsoft Store, Spectrum On Demand ","Donner/Shuler-Donner Productions, Northern Lights Entertainment, Warner Bros. Pictures",Unknown
Once Upon a Time in China III,112,Unknown,"Master Wong and his disciples enroll in the 'Dancing Lion Competition' to stop an assassination plot and to battle an arrogant, deceitful opponent.",1993,Action,"martial arts, kung fu, china, colonisation, martial arts master, colonialism, kung fu master, wong fei hung","Shun Lau, Xiong Xinxin, Rosamund Kwan, Max Mok Siu-Chung, Jet Li",Tsui Hark,Criterion Channel ,"Apple TV, Amazon Video, Google Play Movies, YouTube, Vudu ","Apple TV, Amazon Video, Google Play Movies, YouTube, Vudu ","Film Workshop, Orange Sky Golden Harvest",Unknown
Fatal Instinct,91,English,"Ned Ravine is a police officer and lawyer who occasionally defends the delinquents he arrests. He crosses paths with seductive Lola Cain during an assignment and promptly begins an affair with her. Meanwhile, Ned's wife, Lana, is deep in an affair of her own. Lana and her lover are planning to murder Ned in an elaborate fashion so they can collect on his triple indemnity life insurance policy.",1993,"Comedy, Crime","spoof, private detective","Christopher McDonald, Armand Assante, Sherilyn Fenn, Sean Young, Kate Nelligan",Carl Reiner,,"Apple TV, Amazon Video, Google Play Movies, YouTube, Vudu, Microsoft Store ","Apple TV, Amazon Video, Google Play Movies, YouTube, Vudu, Microsoft Store ",Metro-Goldwyn-Mayer,Unknown
The Real McCoy,100,English,"Karen McCoy is released from prison with nothing but the clothes on her back. Before being incarcerated Karen was the bank robber of her time, but now she wishes for nothing more than to settle down and start a new life. Unfortunately between a dirty parole officer, old business partners, and an idiot ex-husband she will have to do the unthinkable in order to save her son.",1993,"Action, Crime, Drama, Thriller","prison, master thief, motherly love, bank robbery","Val Kilmer, Terence Stamp, David Dwyer, Kim Basinger, Gailard Sartain",Russell Mulcahy,,,,Universal Pictures,Unknown
Sleepless in Seattle,105,English,"When Sam Baldwin's wife dies, he is left to bring up his eight-year-old son Jonah alone, and decides to move to Seattle to make a new start. On Christmas Eve, Jonah rings a radio phone-in with his Christmas wish to find a new wife for his dad. Meanwhile in Baltimore, journalist Annie Reed, who is having doubts about her own relationship, is listening in.",1993,"Comedy, Drama, Romance","journalist, friendship, lovesickness, airplane, love of one's life, unsociability, parent child relationship, loss of loved one, holiday, radio station, radio presenter, christmas party, seattle, washington, baltimore, usa, radio, radio transmission, observation deck, valentine's day, woman director","Rosie O'Donnell, Tom Hanks, Bill Pullman, Meg Ryan, Ross Malinger",Nora Ephron,"Max, Max Amazon Channel ","Apple TV, Amazon Video, Google Play Movies, YouTube, Vudu, Microsoft Store, AMC on Demand ","Apple TV, Amazon Video, Google Play Movies, YouTube, Vudu, Microsoft Store, Spectrum On Demand ",TriStar Pictures,Unknown
Cliffhanger,112,English,"A year after losing his friend in a tragic 4,000-foot fall, former ranger Gabe Walker and his partner, Hal, are called to return to the same peak to rescue a group of stranded climbers, only to learn the climbers are actually thieving hijackers who are looking for boxes full of money.",1993,"Action, Adventure, Thriller","airplane, mountain, rocky mountains, hijacking, suitcase, climbing, heist, money, snow, mountain climbing","Sylvester Stallone, Janine Turner, John Lithgow, Michael Rooker, Rex Linn",Renny Harlin,,"Apple TV, Amazon Video, Google Play Movies, YouTube, Vudu, Microsoft Store, AMC on Demand ","Apple TV, Amazon Video, Google Play Movies, YouTube, Vudu, Microsoft Store ","TriStar Pictures, Carolco Pictures, Pioneer LDCA, Inc., RCS Video, Cliffhanger B. V., Le Studio Canal+, Canal+",Unknown
