Title,Runtime (minutes),Language,Overview,Release Year,Genre,Keywords,Actors,Directors,Stream,Buy,Rent,Production Companies,Website
Children of Men,109,English,"In 2027, in a chaotic world in which humans can no longer procreate, a former activist agrees to help transport a miraculously pregnant woman to a sanctuary at sea, where her child's birth may help scientists save the future of humankind.",2006,"Drama, Action, Thriller, Science Fiction","future, government, police state, based on novel or book, hippie, england, faith, chaos, refugee camp, rebel, dystopia, miracle, childlessness, survival, birth, alcoholic, bombing, dying, terrorist group, fertility, soldiers, violence","Clive Owen, Clare-Hope Ashitey, Michael Caine, Julianne Moore, Chiwetel Ejiofor",Alfonso Cuarón,Starz Apple TV Channel ,"Apple TV, Amazon Video, Google Play Movies, YouTube, Vudu, Microsoft Store, AMC on Demand ","Apple TV, Amazon Video, Google Play Movies, YouTube, Vudu, Microsoft Store ","Universal Pictures, Strike Entertainment, Hit & Run Productions",http://www.universalstudiosentertainment.com/children-of-men/
Scoop,96,English,"An American journalism student in London scoops a big story, and begins an affair with an aristocrat as the incident unfurls.",2006,"Comedy, Mystery","daughter, newspaper, journalist, prostitute, drowning, funeral, upper class, afterlife, magic, tarot cards, suspicion of murder, investigation, music instrument, magic show, lordship, headline, swimming pool, wealth, murder, american, united kingdom","Scarlett Johansson, Woody Allen, Charles Dance, Hugh Jackman, Ian McShane",Woody Allen,,"Apple TV, Amazon Video, Google Play Movies, YouTube, Vudu ","Apple TV, Amazon Video, Google Play Movies, YouTube, Vudu ","BBC Film, Ingenious Media, Phoenix Wiley, Jelly Roll Productions, HanWay Films",http://www.scoopmovie.net/
Over the Hedge,83,English,"A scheming raccoon fools a mismatched family of forest creatures into helping him repay a debt of food, by invading the new suburban sprawl that popped up while they were hibernating – and learns a lesson about family himself.",2006,"Family, Comedy, Animation","suburbian idyll, garbage, entrapment, squirrel, garden, grizzly bear, forest, racoon, suburb, animal, cartoon turtle","William Shatner, Garry Shandling, Steve Carell, Bruce Willis, Wanda Sykes","Karey Kirkpatrick, Tim Johnson",Peacock Premium ,"Apple TV, Amazon Video, Google Play Movies, YouTube, Vudu, Microsoft Store, AMC on Demand ","Apple TV, Amazon Video, Google Play Movies, YouTube, Vudu, Microsoft Store ","DreamWorks Animation, Paramount",Unknown
Miami Vice,132,English,"A case involving drug lords and murder in South Florida takes a personal turn for undercover detectives Sonny Crockett and Ricardo Tubbs. Unorthodox Crockett gets involved romantically with the Chinese-Cuban wife of a trafficker of arms and drugs, while Tubbs deals with an assault on those he loves.",2006,"Action, Crime, Thriller","florida, miami, florida, undercover, remake, drug dealing, police detective, urban setting, police investigation, havana, cuba, action hero","Jamie Foxx, Naomie Harris, Colin Farrell, John Ortiz, Gong Li",Michael Mann,,"Apple TV, Amazon Video, Google Play Movies, YouTube, Vudu, Microsoft Store ","Apple TV, Amazon Video, Google Play Movies, YouTube, Vudu, Microsoft Store ","Universal Pictures, Forward Pass, Motion Picture ETA Produktionsgesellschaft",Unknown
Apocalypto,139,English,"Set in the Mayan civilization, when a man's idyllic presence is brutally disrupted by a violent invading force, he is taken on a perilous journey to a world ruled by fear and oppression where a harrowing end awaits him. Through a twist of fate and spurred by the power of his love for his woman and his family he will make a desperate break to return home and to ultimately save his way of life.",2006,"Action, Drama, History","loss of loved one, maya civilization, village, solar eclipse, slavery, tribe, native american, forest, human sacrifice, central america, ancient civilization, 16th century, ancient language film","Gerardo Taracena, Rudy Youngblood, Antonio Monroy, Iazua Larios, Raoul Max Trujillo",Mel Gibson,"Amazon Prime Video, Hoopla ","Apple TV, Amazon Video, Google Play Movies, YouTube, Vudu, Microsoft Store ","Apple TV, Google Play Movies, YouTube, Vudu, Microsoft Store ","Icon Entertainment International, Icon Productions, Touchstone Pictures",Unknown
Click,107,English,"A married workaholic, Michael Newman doesn't have time for his wife and children, not if he's to impress his ungrateful boss and earn a well-deserved promotion. So when he meets Morty, a loopy sales clerk, he gets the answer to his prayers: a magical remote that allows him to bypass life's little distractions with increasingly hysterical results.",2006,"Comedy, Drama, Fantasy","dying and death, regret, workaholic, heart attack, architect, liposuction, time travel, remote control, obesity, hospital, wedding, dog, second chance, alternate reality, fatherhood, time jump","Henry Winkler, Adam Sandler, Kate Beckinsale, David Hasselhoff, Christopher Walken",Frank Coraci,"Max, Max Amazon Channel ","Apple TV, Amazon Video, Google Play Movies, YouTube, Vudu, Microsoft Store, AMC on Demand ","Apple TV, Amazon Video, Google Play Movies, YouTube, Vudu, Microsoft Store ","Original Film, Revolution Studios, Columbia Pictures, Happy Madison Productions",https://www.sonypictures.com/movies/click
Barbie: Fairytopia - Mermaidia,75,English,"In this animated follow-up to Fairytopia, Elina enlists the help of a mermaid, Nori, to save her friend Nalu, a merman prince who has been captured by the wicked Laverna.",2006,"Animation, Family, Adventure, Fantasy","fairy, mermaid, based on toy","Christopher Gaze, Lee Tockar, Kelly Sheridan, Chiara Zanni, Kathleen Barr","Walter P. Martishius, William Lau",,"Apple TV, Amazon Video, Google Play Movies, YouTube, Vudu, Microsoft Store ","Apple TV, Amazon Video, Google Play Movies, YouTube, Vudu, Microsoft Store ","Mainframe Entertainment, Mattel",Unknown
Brother Bear 2,73,English,"Kenai finds his childhood human friend Nita and the two embark on a journey to burn the amulet he gave to her before he was a bear, much to Koda's dismay.",2006,"Adventure, Animation, Family","grizzly bear, human animal relationship, forest, hibernation, bear","Jeremy Suarez, Dave Thomas, Patrick Dempsey, Mandy Moore, Rick Moranis",Ben Gluck,Disney Plus ,"Apple TV, Amazon Video, Google Play Movies, YouTube, Vudu, Microsoft Store ","Apple TV, Amazon Video, Google Play Movies, YouTube, Vudu, Microsoft Store ",DisneyToon Studios,http://movies.disney.com/brother-bear-2
Shortbus,101,English,"In post-9/11 New York City, an eclectic group of citizens find their lives entangled, personally, romantically, and sexually, at Shortbus, an underground Brooklyn salon infamous for its blend of art, music, politics, and carnality.",2006,"Romance, Drama, Comedy","new york city, free love, swinger club, transsexuality, suicide attempt, eroticism, orgasm, group sex, sex therapy, dominatrix, male homosexuality, polyamory, bdsm, lgbt, gay theme","Adam Hardman, Sook-Yin Lee, Lindsay Beamish, Raphael Barker, Paul Dawson",John Cameron Mitchell,"MUBI, Night Flight Plus, OVID ","Apple TV, Google Play Movies, YouTube, Vudu, Microsoft Store ","Apple TV, Google Play Movies, YouTube, Vudu, Microsoft Store ","Fortissimo Films, Process Productions, Q Television, Oscilloscope",Unknown
V for Vendetta,132,English,"In a world in which Great Britain has become a fascist state, a masked vigilante known only as “V” conducts guerrilla warfare against the oppressive British government. When V rescues a young woman from the secret police, he finds in her an ally with whom he can continue his fight to free the people of Britain.",2006,"Action, Thriller, Science Fiction","government, detective, revolution, dystopia, fascism, fascist, chancellor, based on comic, revenge, torture, hatred, masked vigilante, vengeful spirit, activist, vengeful","John Hurt, Natalie Portman, Stephen Fry, Stephen Rea, Hugo Weaving",James McTeigue,"Max, Max Amazon Channel, Peacock Premium ","Apple TV, Amazon Video, Google Play Movies, YouTube, Vudu, Microsoft Store, AMC on Demand ","Apple TV, Amazon Video, Google Play Movies, YouTube, Vudu, Microsoft Store ","Virtual Studios, Anarchos Productions, Silver Pictures, Fünfte Babelsberg Film, Warner Bros. Productions, DC Vertigo",http://vforvendetta.warnerbros.com/
"Bah, Humduck!: A Looney Tunes Christmas",46,English,"In this adaptation of Charles Dickens' A Christmas Carol, Daffy Duck is the greedy proprietor of the Lucky Duck Mega-Mart and all he can think about is the money to be made during the holiday season.",2006,"Animation, Comedy, Family",holiday,"Bob Bergen, Maurice LaMarche, June Foray, Billy West, Joe Alaskey",Charles Visser,,"Apple TV, Amazon Video, Google Play Movies, YouTube, Vudu, Microsoft Store ","Apple TV, Amazon Video, Google Play Movies, YouTube, Vudu, Microsoft Store ",Warner Bros. Pictures,Unknown
The Departed,151,English,"To take down South Boston's Irish Mafia, the police send in one of their own to infiltrate the underworld, not realizing the syndicate has done likewise. While an undercover cop curries favor with the mob kingpin, a career criminal rises through the police ranks. But both sides soon discover there's a mole among them.",2006,"Drama, Thriller, Crime","police, undercover, boston, massachusetts, gangster, irish-american, crime boss, friends, remake, mobster, organized crime, mafia, undercover cop, mole, state police, police training, realtor","Mark Wahlberg, Leonardo DiCaprio, Vera Farmiga, Matt Damon, Jack Nicholson",Martin Scorsese,,"Apple TV, Amazon Video, Google Play Movies, YouTube, Vudu, Microsoft Store, AMC on Demand ","Apple TV, Amazon Video, Google Play Movies, YouTube, Vudu, Microsoft Store, Spectrum On Demand ","Warner Bros. Pictures, Plan B Entertainment, Initial Entertainment Group, Vertigo Entertainment, Media Asia Films",http://thedeparted.com
One Piece: Giant Mecha Soldier of Karakuri Castle,94,Japanese,"The Straw Hats visits an island, known as Mecha Island, where a fisherman sings an old folk song about a Golden Crown. Searching for that mysterious treasure, they find a hidden entrance into the island. The island's leader, Ratchet, impressed with the find and in search of the Golden Crown himself, invites the crew to join him in his search and the crew along with Ratchet and his henchmen enter the cave. As it turns out, the islands true form, is that of a giant turtle. Ratchet, who had known this all along, uses his mechanical castle to take control of the turtle, in order to use it, to take over the world. Now the Straw Hats have to stop not only Ratchet, but also the helpless turtle, from crashing into a nearby island.",2006,"Animation, Adventure, Action, Comedy, Science Fiction, Fantasy",anime,"Mayumi Tanaka, Hiroaki Hirata, Akemi Okamura, Kappei Yamaguchi, Kazuya Nakai",Konosuke Uda,,,,"Toei Animation, Toei Company, Fuji Television Network",Unknown
American Pie Presents: The Naked Mile,97,English,"When Erik Stifler realizes that he's the only Stifler family member who might graduate high school a virgin, he decides to live up to his legacy. After some well-meaning advice from Jim's dad, Erik's ready to take his chances at the annual and infamous Naked Mile race, where his devoted friends and some uninhibited sorority girls will create the most outrageous weekend ever.",2006,Comedy,"virgin, adolescence, college, road trip, masturbation, sex comedy","Jessy Schram, Christopher McDonald, John White, Steve Talley, Eugene Levy",Joe Nussbaum,,"Apple TV, Amazon Video, Google Play Movies, YouTube, Vudu, Microsoft Store ","Apple TV, Amazon Video, Google Play Movies, YouTube, Vudu, Microsoft Store ","Rogue Pictures, Neo Art & Logic",Unknown
The Ant Bully,88,English,"Fed up with being targeted by the neighborhood bully, 10-year-old Lucas Nickle vents his frustrations on the anthill in his front yard ... until the insects shrink him to the size of a bug with a magic elixir. Convicted of ""crimes against the colony,"" Lucas can only regain his freedom by living with the ants and learning their ways.",2006,"Fantasy, Adventure, Animation, Comedy, Family","ant-hill, ant, child hero, shrinking, bully","Bruce Campbell, Nicolas Cage, Paul Giamatti, Meryl Streep, Julia Roberts",John A. Davis,,"Apple TV, Amazon Video, Google Play Movies, YouTube, Vudu, Microsoft Store ","Apple TV, Amazon Video, Google Play Movies, YouTube, Vudu, Microsoft Store, Spectrum On Demand ","DNA Productions, Playtone, Legendary Pictures, Warner Bros. Pictures",http://www.theantbully.com
Casino Royale,144,English,"Le Chiffre, a banker to the world's terrorists, is scheduled to participate in a high-stakes poker game in Montenegro, where he intends to use his winnings to establish his financial grip on the terrorist market. M sends Bond—on his maiden mission as a 00 Agent—to attend this game and prevent Le Chiffre from winning. With the help of Vesper Lynd and Felix Leiter, Bond enters the most important poker game in his already dangerous career.",2006,"Adventure, Action, Thriller","banker, casino, based on novel or book, poker, italy, money, torture, terrorism, mi6, british secret service, montenegro","Jeffrey Wright, Eva Green, Mads Mikkelsen, Daniel Craig, Judi Dench",Martin Campbell,Amazon Prime Video ,"Apple TV, Amazon Video, Google Play Movies, YouTube, Vudu, Microsoft Store ","Apple TV, Amazon Video, Google Play Movies, YouTube, Vudu, Microsoft Store ","Metro-Goldwyn-Mayer, Columbia Pictures, EON Productions, Danjaq, Casino Royale Productions",https://www.mgm.com/movies/casino-royale-2006
The Pursuit of Happyness,117,English,A struggling salesman takes custody of his son as he's poised to begin a life-changing professional career.,2006,Drama,"work, worker, homeless person, single parent, san francisco, california, bus, homelessness, church service, bad luck, biography, based on true story, salesman, stockbroker, poor","Will Smith, James Karen, Thandiwe Newton, Brian Howe, Jaden Smith",Gabriele Muccino,,"Apple TV, Amazon Video, Google Play Movies, YouTube, Vudu, Microsoft Store, AMC on Demand ","Apple TV, Amazon Video, Google Play Movies, YouTube, Vudu, Microsoft Store, Spectrum On Demand ","Escape Artists, Relativity Media, Columbia Pictures, Overbrook Entertainment",https://www.sonypictures.com/movies/thepursuitofhappyness
Little Man,98,English,"After leaving the prison, the dwarf criminal Calvin Sims joins to his moron brother Percy to steal an expensive huge diamond in a jewelry for the mobster Walken. They are chased by the police, and Calvin hides the stone in the purse of the executive Vanessa Edwards, whose husband Darryl Edwards wants to have a baby. Percy convinces Calvin to dress like a baby and be left in front of the Edwards's house to get inside the house and retrieve the diamond. Darryl and Vanessa keep Calvin for the weekend and decide to adopt him, while Walken threatens Darryl to get the stone back.",2006,"Comedy, Crime","baby, small person, married couple, adoption, criminal","Kerry Washington, Shawn Wayans, Tracy Morgan, John Witherspoon, Marlon Wayans",Keenen Ivory Wayans,Hoopla ,"Apple TV, Amazon Video, Google Play Movies, YouTube, Vudu, Microsoft Store, AMC on Demand ","Apple TV, Amazon Video, Google Play Movies, YouTube, Vudu, Microsoft Store ","Wayans Bros. Entertainment, Revolution Studios",http://www.littleman-movie.com/
Facing the Giants,111,English,A losing coach with an underdog football team faces their giants of fear and failure on and off the field to surprising results.,2006,Drama,"underdog, sports, faith, american football, american football coach, coach, american football team, aftercreditsstinger, christian, high school football","Alex Kendrick, Steve Williams, Shannen Fields, Bailey Cave, Bill Butler",Alex Kendrick,,"Apple TV, Amazon Video, Google Play Movies, YouTube, Vudu, Microsoft Store, AMC on Demand ","Apple TV, Amazon Video, Google Play Movies, YouTube, Vudu, Microsoft Store ","Carmel Entertainment Group, Destination Films, Provident Films, Samuel Goldwyn Films, Sherwood Pictures, Carmel Entertainment",http://www.facingthegiants.com/
Charlotte's Web,97,English,"Wilbur the pig is scared of the end of the season, because he knows that come that time, he will end up on the dinner table. He hatches a plan with Charlotte, a spider that lives in his pen, to ensure that this will never happen.",2006,"Comedy, Family, Fantasy","rescue, friendship, hero, based on novel or book, pig, spider, barn, uncle, spring, anthropomorphism, grass, friends, survival, maine, based on children's book, family, desk, raincoat, rat, talking pig","Oprah Winfrey, Dakota Fanning, Steve Buscemi, John Cleese, Julia Roberts",Gary Winick,Showtime Apple TV Channel ,"Apple TV, Amazon Video, Google Play Movies, YouTube, Vudu, Microsoft Store, AMC on Demand ","Apple TV, Amazon Video, Google Play Movies, YouTube, Vudu, Microsoft Store ","Paramount, Kerner Entertainment Company, Nickelodeon Movies",Unknown
My Super Ex-Girlfriend,95,English,"When New York architect Matt Saunders dumps his new girlfriend Jenny Johnson - a smart, sexy and reluctant superhero known as G-Girl - she uses her powers to make his life a living hell!",2006,"Comedy, Science Fiction, Romance","new york city, flying, ex-boyfriend, ex-girlfriend, superhero, super power, understated, witty, sympathetic","Uma Thurman, Anna Faris, Eddie Izzard, Luke Wilson, Rainn Wilson",Ivan Reitman,"Hulu, Starz Apple TV Channel ","Apple TV, Google Play Movies, YouTube, Vudu, Microsoft Store ","Apple TV, Google Play Movies, YouTube, Vudu, Microsoft Store ","S E Productions Inc., Regency Enterprises, Pariah, New Regency Pictures",Unknown
Monster House,91,English,"Monsters under the bed are scary enough, but what happens when an entire house is out to get you? Three teens aim to find out when they go up against a decrepit neighboring home and unlock its frightening secrets.",2006,"Animation, Comedy, Family, Fantasy","mission, monster, haunted house, neighbor, child","Mitchel Musso, Sam Lerner, Maggie Gyllenhaal, Steve Buscemi, Spencer Locke",Gil Kenan,,"Apple TV, Amazon Video, Google Play Movies, YouTube, Vudu, Microsoft Store, AMC on Demand ","Apple TV, Amazon Video, Google Play Movies, YouTube, Vudu, Microsoft Store ","ImageMovers, Amblin Entertainment",http://www.sonypictures.com/movies/monsterhouse
Dreamgirls,134,English,"A trio of female soul singers cross over to the pop charts in the early 1960s, facing their own personal struggles along the way.",2006,"Drama, Music","music record, manager, show business, drug addiction, musical, deceived wife, recording contract, background singer, motown, record producer, single, singer, singing, detroit, michigan, alcoholic, extramarital affair","Eddie Murphy, Jamie Foxx, Beyoncé, Jennifer Hudson, Danny Glover",Bill Condon,"fuboTV, Paramount Plus, Paramount Plus Apple TV Channel , Paramount+ Amazon Channel, Showtime Roku Premium Channel, Showtime, Showtime Apple TV Channel ","Apple TV, Amazon Video, Google Play Movies, YouTube, Vudu, Microsoft Store, AMC on Demand ","Apple TV, Amazon Video, Google Play Movies, YouTube, Vudu, Microsoft Store, FlixFling, Spectrum On Demand ","DreamWorks Pictures, Paramount, Laurence Mark Productions",http://www.dreamgirlsmovie.com/
Date Movie,83,English,"Spoof of romantic comedies which focuses on a man, his crush, his parents, and her father.",2006,"Comedy, Romance","date, diary, parents-in-law, bridegroom, parody, crude humor, spoof, wedding","Alyson Hannigan, Fred Willard, Sophie Monk, Jennifer Coolidge, Eddie Griffin",Aaron Seltzer,Hulu ,"Apple TV, Amazon Video, Google Play Movies, YouTube, Microsoft Store ","Apple TV, Amazon Video, Google Play Movies, YouTube, Microsoft Store ","Regency Enterprises, New Regency Pictures, Epsilon Motion Pictures",Unknown
Road House 2: Last Call,86,English,"Shane Tanner, the son of a legendary cooler named Dalton, learns that his uncle Nate got beat up by a group of men because he doesn't want to sell his bar, The Black Pelican, to a bunch of drug dealers. To help out his uncle, Shane teams up with local school teacher Beau Hampton, who is a regular at the Black Pelican, and takes down the baddies.",2006,"Adventure, Action, Thriller, Crime","gunfight, tough guy, school teacher, dea agent, hero for hire, hospital fight, car trouble, bar brawl","Richard Norton, Ellen Hollman, Johnathon Schaech, Jake Busey, Will Patton",Scott Ziehl,,Vudu ,,"Sony Pictures Home Entertainment, Manyana Films, Metro-Goldwyn-Mayer",Unknown
The Holiday,136,English,"Two women, one from the United States and one from the United Kingdom, swap homes at Christmas time after bad breakups with their boyfriends. Each woman finds romance with a local man but realizes that the imminent return home may end the relationship.",2006,"Comedy, Romance","london, england, holiday, movie business, christmas party, country house, surrey, los angeles, california, multiple storylines, woman director, christmas, house swapping","Jude Law, Cameron Diaz, Jack Black, Kate Winslet, Eli Wallach",Nancy Meyers,"Netflix, Starz Apple TV Channel ","Apple TV, Amazon Video, Google Play Movies, YouTube, Vudu, Microsoft Store, AMC on Demand ","Apple TV, Amazon Video, Google Play Movies, YouTube, Vudu, Microsoft Store, Spectrum On Demand ","Columbia Pictures, Universal Pictures, Relativity Media, Waverly Films, GH One",http://www.sonypictures.com/movies/theholiday/
She's the Man,105,English,"Viola Hastings is in a real jam. Complications threaten her scheme to pose as her twin brother, Sebastian, and take his place at a new boarding school. She falls in love with her handsome roommate, Duke, who loves beautiful Olivia, who has fallen for Sebastian! As if that were not enough, Viola's twin returns from London ahead of schedule but has no idea that his sister has already replaced him on campus.",2006,"Comedy, Romance","high school, sports, boarding school, roommate, twin sister, fake identity, mistaken identity, twin brother, football (soccer), teen comedy, tomboy, shakespeare in modern dress, disguised voice, the big game, twelfth night, 2000s, woman disguised as man, gay theme, crossdressing","Channing Tatum, Vinnie Jones, Amanda Bynes, Laura Ramsey, David Cross",Andy Fickman,"Paramount Plus, Paramount Plus Apple TV Channel , Paramount+ Amazon Channel, Paramount+ Roku Premium Channel, Hoopla ","Apple TV, Amazon Video, Google Play Movies, YouTube, Vudu, Microsoft Store, AMC on Demand ","Apple TV, Amazon Video, Google Play Movies, YouTube, Vudu, Microsoft Store ","Lakeshore Entertainment, DreamWorks Pictures, The Donners' Company",Unknown
Basic Instinct 2,114,English,"Novelist Catherine Tramell is once again in trouble with the law, and Scotland Yard appoints psychiatrist Dr. Michael Glass to evaluate her. Though, like Detective Nick Curran before him, Glass is entranced by Tramell and lured into a seductive game.",2006,"Crime, Mystery, Thriller","soho london, jacuzzi, erotic thriller, great legs","Stan Collymore, Sharon Stone, Charlotte Rampling, David Morrissey, David Thewlis",Michael Caton-Jones,"Paramount Plus Apple TV Channel , Hoopla, Showtime Apple TV Channel ",Vudu ,Vudu ,"Metro-Goldwyn-Mayer, C2 Pictures, IMF Internationale Medien und Film GmbH & Co. 3. Produktions KG, KanZaman Productions, Grosvenor Park Media, Intermedia, Summit Entertainment",Unknown
Inland Empire,180,English,An actress’s perception of reality becomes increasingly distorted as she finds herself falling for her co-star in a remake of an unfinished Polish production that was supposedly cursed.,2006,"Mystery, Horror, Thriller","homeless person, gypsy, wife, identity, movie business, married couple, violent husband, deceived husband, surrealism, murder, curse, los angeles, california, stabbing, poland, parallel world, madness, movie star, experimental cinema, actress, violence","Jeremy Irons, Karolina Gruszka, Laura Dern, Justin Theroux, Harry Dean Stanton",David Lynch,Criterion Channel ,"Apple TV, Amazon Video, Google Play Movies, YouTube, Vudu ","Apple TV, Amazon Video, Google Play Movies, YouTube, Vudu ","Camerimage Festival, Absurda, Asymmetrical Productions, StudioCanal",https://inlandempire.official.film/
Mission: Impossible III,126,English,"Retired from active duty, and training recruits for the Impossible Mission Force, agent Ethan Hunt faces the toughest foe of his career: Owen Davian, an international broker of arms and information, who is as cunning as he is ruthless. Davian emerges to threaten Hunt and all that he holds dear -- including the woman Hunt loves.",2006,"Adventure, Action, Thriller","mask, mission, berlin, germany, cia, computer, the white house, shanghai, china, funeral, explosive, secret mission, spy, vatican, secret identity, traitor, map, honeymoon, pretended murder, letter, covered investigation, secret agent, stamp, hard drive, e-mail, decipherment, suitcase, revenge, murder, hospital, duel, disguise, celebration, research laboratory, blast","Philip Seymour Hoffman, Ving Rhames, Tom Cruise, Michelle Monaghan, Billy Crudup",J.J. Abrams,"Amazon Prime Video, Paramount Plus, Paramount Plus Apple TV Channel , Paramount+ Amazon Channel, Paramount+ Roku Premium Channel ","Apple TV, Amazon Video, Google Play Movies, YouTube, Vudu, Microsoft Store, AMC on Demand ","Apple TV, Amazon Video, Google Play Movies, YouTube, Vudu, Microsoft Store, Spectrum On Demand ","Paramount, Cruise/Wagner Productions",Unknown
