Title,Runtime (minutes),Language,Overview,Release Year,Genre,Keywords,Actors,Directors,Stream,Buy,Rent,Production Companies,Website
Perfume: The Story of a Murderer,147,English,"Jean-Baptiste Grenouille, born in the stench of 18th century Paris, develops a superior olfactory sense, which he uses to create the world's finest perfumes. However, his work takes a dark turn as he tries to preserve scents in the search for the ultimate perfume.",2006,"Crime, Fantasy, Drama","daughter, small town, bad smell, prostitute, paris, france, based on novel or book, obsession, orgy, genius, supernatural, lone wolf, nose, lavender, child prodigy, fish market, murder, death, perfume, 18th century","John Hurt, Alan Rickman, Dustin Hoffman, Rachel Hurd-Wood, Ben Whishaw",Tom Tykwer,Hoopla ,"Apple TV, Amazon Video, Google Play Movies, YouTube, Vudu, Microsoft Store ","Apple TV, Amazon Video, Google Play Movies, YouTube, Vudu, Microsoft Store ","Rising Star, VIP Medienfonds 4, Nouvelles Éditions de Films (NEF), Davis Films, Ikiru Films, Constantin Film, MEDIA Programme of the European Union, DreamWorks Pictures, Summit Entertainment, Bernd Eichinger Productions, CNC, Castelao Productions, Eurimages, Atresmedia",Unknown
Aquamarine,104,English,"Two teenage girls discover that mermaids really do exist after a violent storm washes one ashore. The mermaid, a sassy creature named Aquamarine, is determined to prove to her father that real love exists, and enlists the girls' help in winning the heart of a handsome lifeguard.",2006,"Fantasy, Romance, Family, Comedy","mermaid, female friendship, teen movie, best friend, teenage love, lifeguard, woman director","Sara Paxton, Emma Roberts, Arielle Kebbel, Jake McDorman, JoJo",Elizabeth Allen Rosenbaum,Disney Plus ,"Apple TV, Amazon Video, Google Play Movies, YouTube, Vudu, Microsoft Store, AMC on Demand ","Apple TV, Amazon Video, Google Play Movies, YouTube, Vudu, Microsoft Store ","Fox 2000 Pictures, Storefront Pictures",http://www.aquamarinemovie.com/
Teen Titans: Trouble in Tokyo,75,English,"America's coolest heroes Teen Titans head to Japan as they spring into action when a new threat, the dichromatic ninja Saico-Tek, appears in their city. A chase across the city ensues, ending at Titans Tower. Saico-Tek is interrogated by Robin with the aid of a translation program, and reveals the identity of the one who sent him. The ninja then escapes his bonds and vanishes after destroying a fire sprinkler, and the Titans' only lead is to search for his mysterious master - the shadowy figure known as Brushogun.",2006,"Animation, Action, Science Fiction, TV Movie","villain, fraud, based on comic, tokyo, japan, arrested, teen superhero, series finale","Greg Cipes, Hynden Walch, Khary Payton, Tara Strong, Scott Menville","Ben Jones, Michael Chang, Matt Youngberg","Max, Max Amazon Channel ","Apple TV, Amazon Video, Google Play Movies, YouTube, Vudu, Microsoft Store ","Apple TV, Amazon Video, Google Play Movies, YouTube, Vudu, Microsoft Store, Spectrum On Demand ","DC Comics, Warner Bros. Animation",Unknown
Tristan & Isolde,125,English,An affair between the second in line to Britain's throne and the princess of the feuding Irish spells doom for the young lovers.,2006,"Drama, Romance","in love with enemy, hostility, castle, lovers, revenge, murder, knight, battle, middle ages (476-1453), star crossed lovers, 6th century","Mark Strong, James Franco, Sophia Myles, David O'Hara, Rufus Sewell",Kevin Reynolds,,"Apple TV, Amazon Video, Google Play Movies, YouTube, Vudu, Microsoft Store, AMC on Demand ","Apple TV, Amazon Video, Google Play Movies, YouTube, Vudu, Microsoft Store ","QI Quality International GmbH Co. KG, Epsilon Motion Pictures, Franchise Pictures, Scott Free Productions, World 2000 Entertainment, Stillking Films, ApolloProMedia GmbH & Co. 1. Filmproduktion KG (I), MFF (Tristan & Isolde) Limited, 20th Century Fox, Mandate International, MFF",Unknown
Inside Man,129,English,"When an armed, masked gang enter a Manhattan bank, lock the doors and take hostages, the detective assigned to effect their release enters negotiations preoccupied with corruption charges he is facing.",2006,"Crime, Drama, Thriller","new york city, nazi, court case, kidnapping, hostage, bank, bank manager, ultimatum, heist, anti-semitism, police detective, bank robbery, hostage situation, financial transactions, bank vault, dark past, manhattan, new york city, secret past, crooked banker, secret, public figure","Christopher Plummer, Jodie Foster, Clive Owen, Denzel Washington, Willem Dafoe",Spike Lee,"Starz Apple TV Channel, Starz Roku Premium Channel, Starz, Starz Amazon Channel ","Apple TV, Amazon Video, Google Play Movies, YouTube, Vudu, Microsoft Store, AMC on Demand ","Apple TV, Amazon Video, Google Play Movies, YouTube, Vudu, Microsoft Store, Spectrum On Demand ","40 Acres and a Mule Filmworks, Imagine Entertainment, Universal Pictures",http://theinsideman.net
Scooby-Doo! Pirates Ahoy!,71,English,"It's horror on the high seas when Scooby-Doo and the gang take a creepy cruise into one of the world's most mysterious places, the Bermuda Triangle! If Scooby, Shaggy and the gang can't solve this mystery, they may have to walk the plank.",2006,"Fantasy, Animation, Comedy, Family, Mystery, Adventure","pirate, pirate ship, costume party, hypnotize, mystery","Frank Welker, Casey Kasem, Mindy Cohn, Ron Perlman, Grey DeLisle",Chuck Sheetz,"Max, Max Amazon Channel, Boomerang, Boomerang Amazon Channel ","Apple TV, Amazon Video, Google Play Movies, YouTube, Vudu, Microsoft Store ","Apple TV, Amazon Video, Google Play Movies, YouTube, Vudu, Microsoft Store, Spectrum On Demand ","Warner Bros. Animation, Hanna-Barbera Productions",Unknown
Just My Luck,103,English,"Manhattanite Ashley is known to many as the luckiest woman around. After a chance encounter with a down-and-out young man, however, she realizes that she's swapped her fortune for his.",2006,"Comedy, Drama, Family, Fantasy, Romance","kiss, bad luck, romantic comedy, jinx, alcohol abuse, celebration, envy, luck, manhattan, new york city, mysterious stranger, masquerade, music industry","Chris Pine, Faizon Love, Samaire Armstrong, Bree Turner, Lindsay Lohan",Donald Petrie,"Hulu, fuboTV, MGM Plus Roku Premium Channel ","Apple TV, Amazon Video, Google Play Movies, YouTube, Microsoft Store ","Apple TV, Amazon Video, Google Play Movies, YouTube, Microsoft Store ","New Regency Pictures, Regency Enterprises, Cheyenne Enterprises, 20th Century Fox",Unknown
Annapolis,108,English,"Jake Huard, from a shipbuilders family, promised his dying mother he'ld make it to Anapolis Naval Academy. Thanks to tenaciously bugging a Congressman, he's selected despite dubious grades. Once inside, Jake soon proves sub-standard academically. Constantly challenged to his limits, repeatedly made the 'over-cocky' reason for the entire class to suffer, Jake nearly quits, but after facing his utterly un-supportive father's gloating returns just in time. Stubborn Jake finds support withs mates as well as Senor Ali, his lover-to-be, and a discipline he may excel in: the 'brigade' boxing tournament, open to all ranks.",2006,"Drama, Action","u.s. navy, maryland, u.s. naval academy","Jordana Brewster, Vicellous Shannon, James Franco, Tyrese Gibson, Donnie Wahlberg",Justin Lin,,"Apple TV, Amazon Video, Google Play Movies, YouTube, Vudu, Microsoft Store, AMC on Demand ","Apple TV, Amazon Video, Google Play Movies, YouTube, Vudu, Microsoft Store ",Touchstone Pictures,Unknown
