Title,Runtime (minutes),Language,Overview,Release Year,Genre,Keywords,Actors,Directors,Stream,Buy,Rent,Production Companies,Website
Crank,88,English,"Chev Chelios, a hit man wanting to go straight, lets his latest target slip away. Then he awakes the next morning to a phone call that informs him he has been poisoned and has only an hour to live unless he keeps adrenaline coursing through his body while he searches for an antidote.",2006,"Action, Thriller, Crime","assassin, helicopter, hitman, poison, adrenaline, fistfight, swimming pool, revenge, shootout, motorcycle, drugs, cell phone, pharmacy, defibrillation, hospital gown, emergency room, aftercreditsstinger, sweatshop, epinephrine","Jose Pablo Cantillo, Jason Statham, Amy Smart, Efren Ramirez, Dwight Yoakam","Mark Neveldine, Brian Taylor",fuboTV ,"Apple TV, Amazon Video, Google Play Movies, YouTube, Vudu, Microsoft Store, AMC on Demand ","Apple TV, Amazon Video, Google Play Movies, YouTube, Vudu, Microsoft Store ","Lakeshore Entertainment, RadicalMedia, GreeneStreet Films, Lionsgate",Unknown
Déjà Vu,126,English,"Called in to recover evidence in the aftermath of a horrific explosion on a New Orleans ferry, Federal agent Doug Carlin gets pulled away from the scene and taken to a top-secret government lab that uses a time-shifting surveillance device to help prevent crime.",2006,"Action, Thriller, Science Fiction","deja vu, technology, fbi, patriotism, new orleans, louisiana, time travel, wormhole, terrorism, investigator, alternate timeline, ferry","Paula Patton, Adam Goldberg, Val Kilmer, Denzel Washington, Jim Caviezel",Tony Scott,"AMC Plus Apple TV Channel , AMC+ Roku Premium Channel, AMC ","Apple TV, Amazon Video, Google Play Movies, YouTube, Vudu, Microsoft Store, AMC on Demand ","Apple TV, Amazon Video, Google Play Movies, YouTube, Vudu, Microsoft Store ","Touchstone Pictures, Jerry Bruckheimer Films, Scott Free Productions",Unknown
High School Musical,98,English,"Troy, the popular captain of the basketball team, and Gabriella, the brainy and beautiful member of the academic club, break all the rules of East High society when they secretly audition for the leads in the school's musical. As they reach for the stars and follow their dreams, everyone learns about acceptance, teamwork, and being yourself.",2006,"Comedy, Drama, Family, Music, Romance, TV Movie","high school, becoming an adult, school performance, musical, high school sports, jock, clique, peer pressure, teenage romance, music movie","Vanessa Hudgens, Lucas Grabeel, Ashley Tisdale, Zac Efron, Corbin Bleu",Kenny Ortega,Disney Plus ,"Amazon Video, Google Play Movies, YouTube, Vudu ",Amazon Video ,"Salty Pictures, First Street Films",http://tv.disney.go.com/disneychannel/originalmovies/highschoolmusical/index.html
Arthur and the Invisibles,94,English,"Arthur is a spirited ten-year old whose parents are away looking for work, whose eccentric grandfather has been missing for several years, and who lives with his grandmother in a country house that, in two days, will be repossessed, torn down, and turned into a block of flats unless Arthur's grandfather returns to sign some papers and pay off the family debt. Arthur discovers that the key to success lies in his own descent into the land of the Minimoys, creatures no larger than a tooth, whom his grandfather helped relocate to their garden. Somewhere among them is hidden a pile of rubies, too. Can Arthur be of stout heart and save the day? Romance beckons as well, and a villain lurks.",2006,"Adventure, Fantasy, Animation, Family","grandparent grandchild relationship, wretch, treasure hunt, disappearance, family, fantasy world, live action and animation, minimoys","Freddie Highmore, Madonna, David Bowie, Jimmy Fallon, Mia Farrow",Luc Besson,"Peacock Premium, Hoopla ","Apple TV, Amazon Video, Google Play Movies, YouTube, Vudu, Microsoft Store, AMC on Demand ","Apple TV, Amazon Video, Google Play Movies, YouTube, Vudu, Microsoft Store ","Canal+, Sofica EuropaCorp, Avalanche Productions, EuropaCorp, Metro Voices, Digital Factory, The Weinstein Company",Unknown
The Da Vinci Code,149,English,"A murder in Paris’ Louvre Museum and cryptic clues in some of Leonardo da Vinci’s most famous paintings lead to the discovery of a religious mystery. For 2,000 years a secret society closely guards information that — should it come to light — could rock the very foundations of Christianity.",2006,"Thriller, Mystery","paris, france, based on novel or book, holy grail, christianity, monk, secret society, louvre museum, heresy, mona lisa (la gioconda), freemason, pentagram, conspiracy, tomb, catholicism, cryptologist, iconography, albino, sect","Paul Bettany, Tom Hanks, Jean Reno, Ian McKellen, Audrey Tautou",Ron Howard,,"Apple TV, Amazon Video, Google Play Movies, YouTube, Vudu, Microsoft Store, AMC on Demand ","Apple TV, Amazon Video, Google Play Movies, YouTube, Vudu, Microsoft Store, Spectrum On Demand ","Imagine Entertainment, Skylark Productions",http://www.sonypictures.com/movies/thedavincicode/
Marie Antoinette,123,English,"An Austrian teenager marries the Dauphin  of France and becomes that country's queen following the death of King Louis XV  in 1774. Years later, after a life of luxury and privilege, Marie Antoinette loses her head during the French Revolution.",2006,"Drama, History","infidelity, arranged marriage, french revolution, marie antoinette, versailles, period drama, theatre audience, louis xvi, bride and groom, death of king, applause, woman director","Kirsten Dunst, Judy Davis, Rip Torn, Jason Schwartzman, Steve Coogan",Sofia Coppola,,"Apple TV, Amazon Video, Google Play Movies, YouTube, Vudu, Microsoft Store ","Apple TV, Amazon Video, Google Play Movies, YouTube, Vudu, Microsoft Store ","Pricel, Columbia Pictures, TFC, American Zoetrope",https://www.sonypictures.com/movies/marieantoinette
Blood Diamond,143,English,"An ex-mercenary turned smuggler. A Mende fisherman. Amid the explosive civil war overtaking 1999 Sierra Leone, these men join for two desperate missions: recovering a rare pink diamond of immense value and rescuing the fisherman's son, conscripted as a child soldier into the brutal rebel forces ripping a swath of torture and bloodshed countrywide.",2006,"Drama, Thriller, Action","bootlegger, journalist, smuggling (contraband), loss of loved one, africa, rwandan genocide, rebel, journalism, slavery, fisherman, mercenary, diamond mine, sierra leone, special unit, oppression, 1990s, private military company","Leonardo DiCaprio, Djimon Hounsou, Jennifer Connelly, Kagiso Kuypers, Arnold Vosloo",Edward Zwick,,"Apple TV, Amazon Video, Google Play Movies, YouTube, Vudu, Microsoft Store ","Apple TV, Amazon Video, Google Play Movies, YouTube, Vudu, Microsoft Store, Spectrum On Demand ","Virtual Studios, Spring Creek Pictures, Bedford Falls Productions, Initial Entertainment Group, Lonely Film Productions GmbH & Co. KG., Warner Bros. Pictures, Liberty Pictures",Unknown
The Prestige,130,English,"A mysterious story of two magicians whose intense rivalry leads them on a life-long battle for supremacy -- full of obsession, deceit and jealousy with dangerous and deadly consequences.",2006,"Drama, Mystery, Science Fiction","dying and death, suicide, class society, magic, competition, obsession, hostility, class, diary, twist, tricks, illusion, rivalry, partner, steampunk, cruelty, hanging, jail cell, 19th century, nikola tesla, magician, tesla coil, bittersweet, secret, london, mind-blowing, depressing","Scarlett Johansson, Michael Caine, Christian Bale, Hugh Jackman, Rebecca Hall",Christopher Nolan,Apple TV Plus ,"Apple TV, Amazon Video, Google Play Movies, YouTube, Vudu, Microsoft Store, AMC on Demand ","Apple TV, Amazon Video, Google Play Movies, YouTube, Vudu, Microsoft Store ","Warner Bros. Pictures, Touchstone Pictures, Newmarket Films, Syncopy",http://wwws.warnerbros.de/theprestige/
The Texas Chainsaw Massacre: The Beginning,91,English,"Chrissie and her friends set out on a road trip for a final fling before one is shipped off to Vietnam. Along the way, bikers harass the foursome and cause an accident that throws Chrissie from the vehicle. The lawman who arrives on the scene kills one of the bikers and brings Chrissie's friends to the Hewitt homestead, where young Leatherface is learning the tools of terror.",2006,Horror,"war veteran, sadism, psychopath, mass murder, chain saw, gore, knife, biker, prequel, murder, serial killer, leatherface, slaughterhouse, slasher, chainsaw, torture, cruelty, series of murders, cannibal, severed foot, meat hook, severed hand, 1960s, graphic violence","Jordana Brewster, Matt Bomer, Taylor Handley, Diora Baird, R. Lee Ermey",Jonathan Liebesman,,"Apple TV, Amazon Video, Google Play Movies, YouTube, Vudu, Microsoft Store ","Apple TV, Amazon Video, Google Play Movies, YouTube, Vudu, Microsoft Store, Spectrum On Demand ","Texas Chainsaw Productions, New Line Cinema, Next Entertainment, Platinum Dunes, Vortex/Henkel/Hooper",Unknown
The Devil Wears Prada,109,English,"Andy moves to New York to work in the fashion industry. Her boss is extremely demanding, cruel and won't let her succeed if she doesn't fit into the high class elegant look of their magazine.",2006,"Drama, Comedy","new york city, journalist, paris, france, based on novel or book, journalism, fashion journal, assistant, job entrant, job interview, editor-in-chief, fashion, fashion magazine, bullied, city life, fashion industry","Simon Baker, Emily Blunt, Stanley Tucci, Meryl Streep, Anne Hathaway",David Frankel,"Max, Max Amazon Channel ","Apple TV, Amazon Video, Google Play Movies, YouTube, Vudu, Microsoft Store, AMC on Demand ","Apple TV, Amazon Video, Google Play Movies, YouTube, Vudu, Microsoft Store, Spectrum On Demand ","Fox 2000 Pictures, 20th Century Fox, Wendy Finerman Productions",http://www.devilwearspradamovie.com/
Poseidon,98,English,"A packed cruise ship traveling the Atlantic is hit and overturned by a massive wave, compelling the passengers to begin a dramatic fight for their lives.",2006,"Adventure, Action, Drama, Thriller","new year's eve, daughter, self-abandonment, ship, fire, drowning, cataclysm, escape, loss of loved one, shipwreck, atlantic ocean, ball, giant wave, blackout, single, remake, disaster, capsized ship, disaster movie","Kurt Russell, Emmy Rossum, Josh Lucas, Jacinda Barrett, Richard Dreyfuss",Wolfgang Petersen,fuboTV ,"Apple TV, Amazon Video, Google Play Movies, YouTube, Vudu, AMC on Demand ","Apple TV, Amazon Video, Google Play Movies, YouTube, Vudu ","Virtual Studios, Radiant Productions, Next Entertainment, Irwin Allen Productions, Synthesis Entertainment, Warner Bros. Pictures",https://www.warnerbros.com/movies/poseidon
Night at the Museum,108,English,"Chaos reigns at the natural history museum when night watchman Larry Daley accidentally stirs up an ancient curse, awakening Attila the Hun, an army of gladiators, a Tyrannosaurus rex and other exhibits.",2006,"Action, Adventure, Comedy, Family, Fantasy","night shift, skeleton, chaos, maya civilization, museum, genghis khan, natural history, dinosaur, based on children's book, magical object, security guard, duringcreditsstinger, pharaoh, inanimate objects come to life","Mickey Rooney, Ben Stiller, Bill Cobbs, Carla Gugino, Dick Van Dyke",Shawn Levy,Disney Plus ,"Apple TV, Amazon Video, Google Play Movies, YouTube, Vudu, Microsoft Store, AMC on Demand ","Apple TV, Amazon Video, Google Play Movies, YouTube, Vudu, Microsoft Store, Spectrum On Demand ","1492 Pictures, 21 Laps Entertainment, 20th Century Fox, Ingenious Media, Sun Canada Productions",https://family.20thcenturystudios.com/movies/night-at-the-museum-1
Happy Feet,108,English,"Into the world of the Emperor Penguins, who find their soul mates through song, a penguin is born who cannot sing. But he can tap dance something fierce!",2006,"Animation, Comedy, Family","fish, ocean, zoo, penguin, tap dancing, anthropomorphism, love, crush, snow, singing, antarctica, family, duringcreditsstinger","Robin Williams, Nicole Kidman, Brittany Murphy, Elijah Wood, Hugh Jackman",George Miller,,"Apple TV, Amazon Video, Google Play Movies, YouTube, Vudu, Microsoft Store, AMC on Demand ","Apple TV, Amazon Video, Google Play Movies, YouTube, Vudu, Microsoft Store ","Kennedy Miller Productions, Animal Logic, Village Roadshow Pictures",http://www.warnerbros.com/happy-feet
The Wicker Man,102,English,"A sheriff investigating the disappearance of a young girl from a small island discovers there's a larger mystery to solve among the island's secretive, neo-pagan community.",2006,"Horror, Mystery, Thriller","island, california, airplane, based on novel or book, limousine, car crash, remake, allergy, bee, based on movie, folk horror","Ellen Burstyn, Kate Beahan, Nicolas Cage, Frances Conroy, Molly Parker",Neil LaBute,Criterion Channel ,"Apple TV, Amazon Video, Google Play Movies, YouTube, Vudu, Microsoft Store ","Apple TV, Amazon Video, Google Play Movies, YouTube, Vudu, Spectrum On Demand ","Millennium Media, Saturn Films, EFO Films, Equity Pictures Medienfonds GmbH & Co. KG III, Nu Image, Alcon Entertainment, Emmett/Furla Films",https://www.warnerbros.com/wicker-man
Ice Age: The Meltdown,91,English,"Diego, Manny and Sid return in this sequel to the hit animated movie Ice Age. This time around, the deep freeze is over, and the ice-covered earth is starting to melt, which will destroy the trio's cherished valley. The impending disaster prompts them to reunite and warn all the other beasts about the desperate situation.",2006,"Animation, Family, Comedy, Adventure","mammoth, sloth, ice age, barrier ice, ice melting, iceberg, flooding, deluge, lovers, sequel, saber-toothed tiger","Denis Leary, Queen Latifah, Seann William Scott, John Leguizamo, Ray Romano",Carlos Saldanha,"Disney Plus, Starz Apple TV Channel, Starz Roku Premium Channel, Starz, Starz Amazon Channel ","Apple TV, Amazon Video, Google Play Movies, YouTube, Vudu, Microsoft Store, AMC on Demand ","Apple TV, Amazon Video, Google Play Movies, YouTube, Vudu, Microsoft Store, Spectrum On Demand ","20th Century Fox Animation, Blue Sky Studios, 20th Century Fox",http://www.iceagemovies.com/films/ice-age-the-meltdown
Virgin Rose,100,Spanish,"Simón transports illegal immigrants to New York, leaving them to their fate. When he is discovered by the coastguard, a young sailor, named Andrés saves his life. But when Andrés falls for Marie—a young protegée of Simón's—conflict erupts.",2006,"Drama, Crime, Romance",None,"Broselianda Hernández, Roxana Montenegro, Álex González, Ana de Armas, Jorge Perugorría",Manuel Gutiérrez Aragón,,,,"Tornasol Films, ICAIC",Unknown
The Illusionist,110,English,"With his eye on a lovely aristocrat, a gifted illusionist named Eisenheim uses his powers to win her away from her betrothed, a crown prince. But Eisenheim's scheme creates tumult within the monarchy and ignites the suspicion of a dogged inspector.",2006,"Fantasy, Drama, Thriller, Romance","princess, magic, rivalry, love, vienna, austria, super power, crown prince, duchess, childhood sweetheart","Jessica Biel, Paul Giamatti, Rufus Sewell, Edward Norton, Eddie Marsan",Neil Burger,"AMC Plus Apple TV Channel , AMC+ Amazon Channel, Hoopla, Sundance Now, FlixFling ","Apple TV, Amazon Video, Google Play Movies, YouTube, Vudu, Microsoft Store, FlixFling ","Apple TV, Amazon Video, Vudu, Microsoft Store, FlixFling ","Contagious Entertainment, Michael London Productions, Koppelman-Levien",Unknown
Silent Hill,125,English,"Rose, a desperate mother takes her adopted daughter, Sharon, to the town of Silent Hill in an attempt to cure her of her ailment. After a violent car crash, Sharon disappears and Rose begins a desperate search to get her back. She descends into the center of the twisted reality of a town's terrible secret. Pursued by grotesquely deformed creatures and townspeople stuck in permanent purgatory, Rose begins to uncover the truth behind the apocalyptic disaster that burned the town 30 years earlier.",2006,"Horror, Mystery","hotel, pedophilia, child abuse, monster, suffering, nurse, nun, darkness, sadism, orphanage, classroom, moral ambiguity, child murder, mother role, witch burning, symbolism, supernatural, fog, possession, heroism, gore, barbed wire, surrealism, revenge, survival, religion, school, hospital, another dimension, torture, creature, massacre, pedophile, brutality, demon, religious fundamentalism, child molester, gothic, conscience, molestation, based on video game, missing child, dismemberment, persecution, religious cult, child molestation, ghost town, mist, immolation, sleepwalking, nightmare becomes reality, limbo, bugs, sexual predator, mother daughter relationship, biopunk, skinning, supernatural power, supernatural horror, psychotronic film, extreme violence, child sexual abuse, religious fanaticism","Deborah Kara Unger, Jodelle Ferland, Radha Mitchell, Laurie Holden, Sean Bean",Christophe Gans,Netflix ,"Apple TV, Amazon Video, Google Play Movies, YouTube, Vudu, Microsoft Store, AMC on Demand ","Apple TV, Amazon Video, Google Play Movies, YouTube, Vudu, Microsoft Store ","Silent Hill DCP Inc., Davis Films, Konami, Metropolitan Filmexport, Alliance Atlantis",https://www.sonypictures.com/movies/silenthill
Nacho Libre,92,English,"Nacho Libre is loosely based on the story of Fray Tormenta (""Friar Storm""), aka Rev. Sergio Gutierrez Benitez, a real-life Mexican Catholic priest who had a 23-year career as a masked luchador. He competed in order to support the orphanage he directed.",2006,"Comedy, Family, Drama","mexico, nun, sports, monk, secret identity, orphanage, wrestling, wilderness, ringer, money, catholic, luchador, masked wrestler, inner conflict","Héctor Jiménez, Darius Rose, Moisés Arias, Jack Black, Ana de la Reguera",Jared Hess,"fuboTV, Paramount+ with Showtime, Paramount Plus Apple TV Channel , Paramount+ Amazon Channel, Showtime, Showtime Apple TV Channel ","Apple TV, Amazon Video, Google Play Movies, YouTube, Vudu, Microsoft Store, AMC on Demand ","Apple TV, Amazon Video, Google Play Movies, YouTube, Vudu, Microsoft Store ","Paramount, Nickelodeon Movies, Black & White Productions, MP Inka",http://www.nacholibre.com/
The Fox and the Hound 2,69,English,"Best friends Tod, a fox kit, and Copper, a hound puppy, visit a country fair when they see a band of dogs called ""The Singin' Strays"". The band has five members: Dixie, Cash, Granny Rose, and twin brothers Waylon and Floyd. It is important that they perform well because a talent scout is visiting.",2006,"Adventure, Animation, Comedy, Family","fox, dog","Harrison Fahn, Jeff Foxworthy, Reba Nell, Patrick Swayze, Jonah Bobo",Jim Kammerud,Disney Plus ,"Apple TV, Amazon Video, Google Play Movies, YouTube, Vudu, Microsoft Store ","Apple TV, Amazon Video, Google Play Movies, YouTube, Vudu, Microsoft Store ",DisneyToon Studios,Unknown
Paprika,90,Japanese,"When a machine that allows therapists to enter their patient's dreams is stolen, all hell breaks loose. Only a young female therapist can stop it and recover it before damage is done: Paprika.",2006,"Drama, Mystery, Animation, Science Fiction, Thriller","research, japan, dream, procession, psychoanalysis, mad scientist, dream girl, parallel world, adult animation, dream world, anime","Tohru Emori, Toru Furuya, Akio Otsuka, Katsunosuke Hori, Megumi Hayashibara",Satoshi Kon,,"Apple TV, Amazon Video, Google Play Movies, YouTube, Vudu, Microsoft Store, AMC on Demand ","Apple TV, Amazon Video, Google Play Movies, YouTube, Vudu, Microsoft Store ","Madhouse, Sony Pictures",https://www.sonypictures.com/movies/paprika
Naruto the Movie: Guardians of the Crescent Moon Kingdom,95,Japanese,"Naruto Uzumaki, Kakashi Hatake, Sakura Haruno, and Rock Lee are assigned to protect the prince of the Land of the Moon, Michiru, during his world trip; other escorts had been hired, but quit due to being treated poorly. The Land of the Moon is a very wealthy nation, so Michiru tends to buy whatever he wants, and has a very materialistic worldview. His Hikaru, also acts in much the same manner.",2006,"Adventure, Animation, Action",anime,"Akio Otsuka, Yōichi Masukawa, Chie Nakamura, Kazuhiko Inoue, Junko Takeuchi",Toshiyuki Tsuru,"Netflix, Netflix basic with Ads ","Apple TV, Amazon Video, Google Play Movies, YouTube, Vudu, Microsoft Store ","Apple TV, Amazon Video, Google Play Movies, YouTube, Vudu ",Pierrot,http://www.naruto-movie.com/
Barbie in The 12 Dancing Princesses,82,English,"King Randolph sends for his cousin, Duchess Rowena, to help turn his daughters, Princess Genevieve and her eleven sisters, into royal material. But the Duchess strips the sisters of their fun, including their favorite pastime: dancing. When all hope may be lost, the sisters discover a secret passageway to a magical land where they can dance the night away.",2006,"Animation, Family","princess, dance, sibling relationship, ballet, based on toy, sister sister relationship","Christopher Gaze, Nicole Oliver, Kelly Sheridan, Lalainia Lindbjerg, Catherine O'Hara",Greg Richardson,,"Apple TV, Amazon Video, Google Play Movies, YouTube, Vudu, Microsoft Store ","Apple TV, Amazon Video, Google Play Movies, YouTube, Vudu, Microsoft Store, Spectrum On Demand ","Mainframe Entertainment, Mattel, Universal Pictures Home Entertainment",Unknown
"You, Me and Dupree",108,English,"After standing in as best man for his longtime friend Carl Petersen, Randy Dupree loses his job, becomes a barfly and attaches himself to the newlywed couple almost permanently -- as their houseguest. But the longer Dupree camps out on their couch, the closer he gets to Carl's bride, Molly, leaving the frustrated groom wondering when his pal will be moving out.",2006,"Comedy, Romance","love of one's life, male friendship, just married, father-in-law, slacker, wedding, moving out, school teacher, unemployment, aftercreditsstinger, cycling, best man, freeloader, houseguest, comedy of errors, best friends, newlyweds, overstaying your welcome, working for father-in-law","Michael Douglas, Matt Dillon, Owen Wilson, Kate Hudson, Seth Rogen","Anthony Russo, Joe Russo",,"Apple TV, Amazon Video, Google Play Movies, YouTube, Vudu, Microsoft Store ","Apple TV, Amazon Video, Google Play Movies, YouTube, Vudu, Microsoft Store ","MMCB Film Produktion 2004, Universal Pictures, Kaplan/Perrone Entertainment",http://www.youmeanddupree.com/
Underworld: Evolution,106,English,"As the war between the vampires and the Lycans rages on, Selene, a former member of the Death Dealers (an elite vampire special forces unit that hunts werewolves), and Michael, the werewolf hybrid, work together in an effort to unlock the secrets of their respective bloodlines.",2006,"Fantasy, Action, Thriller","budapest, hungary, vampire, key, light, forbidden love, rivalry, werewolf, gothic, evolution, dark fantasy, lycanthrope, urban gothic","Shane Brolly, Tony Curran, Kate Beckinsale, Derek Jacobi, Scott Speedman",Len Wiseman,Netflix ,"Apple TV, Amazon Video, Google Play Movies, YouTube, Vudu, Microsoft Store, AMC on Demand ","Apple TV, Amazon Video, Google Play Movies, YouTube, Vudu, Microsoft Store, Spectrum On Demand ","Screen Gems, Lakeshore Entertainment",https://www.sonypictures.com/movies/underworldevolution
Saw III,108,English,"Jigsaw has disappeared. Along with his new apprentice Amanda, the puppet-master behind the cruel, intricate games that have terrified a community and baffled police has once again eluded capture and vanished. While city detective scrambles to locate him, Doctor Lynn Denlon and Jeff Reinhart are unaware that they are about to become the latest pawns on his vicious chessboard.",2006,"Horror, Thriller, Crime","sadism, brain tumor, suffocation, torture, survival horror, death match, mutilation, mind game, death game, harsh","Angus Macfadyen, Tobin Bell, Bahar Soomekh, Shawnee Smith, Donnie Wahlberg",Darren Lynn Bousman,Starz Apple TV Channel ,"Apple TV, Amazon Video, Google Play Movies, YouTube, Vudu, Microsoft Store, AMC on Demand ","Apple TV, Amazon Video, Google Play Movies, YouTube, Vudu, Microsoft Store ","Twisted Pictures, Evolution Entertainment, Lionsgate",Unknown
The Butterfly Effect 2,95,English,"After his girlfriend, Julie, and two best friends are killed in a tragic auto accident, Nick struggles to cope with his loss and grief. Suffering from migraine-like seizures, Nick soon discovers that he has the power to change the past via his memories. However, his time-traveling attempts to alter the past and save his one true love have unexpected and dire consequences.",2006,"Drama, Science Fiction, Thriller","suicide, brain tumor, underwear, time travel","Dustin Milligan, Susan Hogan, Eric Lively, Gina Holden, Erica Durance",John R. Leonetti,,"Apple TV, Amazon Video, Google Play Movies, YouTube, Vudu ","Apple TV, Amazon Video, Google Play Movies, YouTube, Vudu ","BenderSpink, New Line Cinema, FilmEngine",http://www.newline.com/properties/butterflyeffect2the.html
Slither,95,English,"A small town is taken over by an alien plague, turning residents into zombies and all forms of mutant monsters.",2006,"Horror, Science Fiction, Comedy","small town, mutant, transformation, meteor, meat, alien, zombie, parasite, slug, bodily dismemberment, aftercreditsstinger, duringcreditsstinger, body horror","Gregg Henry, Nathan Fillion, Elizabeth Banks, Michael Rooker, Tania Saulnier",James Gunn,,"Apple TV, Amazon Video, Google Play Movies, YouTube, Vudu, Microsoft Store ","Apple TV, Amazon Video, Google Play Movies, YouTube, Vudu, Microsoft Store, Spectrum On Demand ","Strike Entertainment, Slither Productions, Gold Circle Films, Brightlight Pictures",Unknown
