Title,Runtime (minutes),Language,Overview,Release Year,Genre,Keywords,Actors,Directors,Stream,Buy,Rent,Production Companies,Website
Tinker Bell and the Lost Treasure,81,English,"A blue harvest moon will rise, allowing the fairies to use a precious moonstone to restore the Pixie Dust Tree, the source of all their magic. But when Tinker Bell accidentally puts all of Pixie Hollow in jeopardy, she must venture out across the sea on a secret quest to set things right.",2009,"Animation, Family, Adventure, Fantasy","friendship, based on children's book, anger issues","Jesse McCartney, Raven-Symoné, Jane Horrocks, Lucy Liu, Mae Whitman",Klay Hall,Disney Plus ,"Apple TV, Amazon Video, Google Play Movies, YouTube, Vudu, Microsoft Store ","Apple TV, Amazon Video, Google Play Movies, YouTube, Vudu, Microsoft Store ","DisneyToon Studios, Prana Animation Studios",http://disneydvd.disney.go.com/tinker-bell-and-the-lost-treasure.html
Evangelion: 2.0 You Can (Not) Advance,112,Japanese,"Under constant attack by monstrous creatures called Angels that seek to eradicate humankind, U.N. Special Agency NERV introduces two new EVA pilots to help defend the city of Tokyo-3: the mysterious Makinami Mari Illustrous and the intense Asuka Langley Shikinami. Meanwhile, Gendo Ikari and SEELE proceed with a secret project that involves both Rei and Shinji.",2009,"Animation, Science Fiction, Action, Drama","post-apocalyptic future, alien, anthropomorphism, tragedy, mecha, giant robot, piloted robot, apocalypse, alien invasion, alien monster, angst, shounen, anime, father son conflict, based on tv series, human enhancement, post-apocalyptic","Kotono Mitsuishi, Megumi Ogata, Megumi Hayashibara, Maaya Sakamoto, Yuko Miyamura","Hideaki Anno, Masayuki, Kazuya Tsurumaki",Amazon Prime Video ,"Apple TV, Microsoft Store ","Apple TV, Microsoft Store ",khara,https://www.evangelion.co.jp/2_0/index.html
Jennifer's Body,107,English,"Jennifer, a gorgeous, seductive cheerleader takes evil to a whole new level after she's possessed by a sinister demon. Now it's up to her best friend to stop Jennifer's reign of terror before it's too late.",2009,"Horror, Comedy","high school, minnesota, possession, slumber party, gore, sexual murder, teenage girl, demon, rock band, succubus, satanic ritual, candlelight vigil, duringcreditsstinger, woman director, virgin sacrifice, frenemies, bloodthirsty","Megan Fox, J.K. Simmons, Adam Brody, Johnny Simmons, Amanda Seyfried",Karyn Kusama,"Max, Max Amazon Channel, Cinemax Amazon Channel, Cinemax Apple TV Channel ","Apple TV, Amazon Video, Google Play Movies, YouTube, Vudu, Microsoft Store, AMC on Demand ","Apple TV, Amazon Video, Google Play Movies, YouTube, Vudu, Microsoft Store ","Fox Atomic, Dune Entertainment, Dubiecki/Novick/Reitman Productions",https://www.20thcenturystudios.com/movies/jennifers-body
Spread,97,English,A gigolo must contend with the prospect that he has found true love.,2009,"Comedy, Romance","seduction, gigolo, callboy","Sebastian Stan, Margarita Levieva, Ashton Kutcher, Anne Heche, Ashley Johnson",David Mackenzie,"Amazon Prime Video, Starz Apple TV Channel, Starz Roku Premium Channel, Starz, Starz Amazon Channel ","Apple TV, Amazon Video, Google Play Movies, YouTube, Vudu, Microsoft Store ","Apple TV, Amazon Video, Google Play Movies, YouTube, Vudu, Microsoft Store, Spectrum On Demand ","Oceana Media Finance, Barbarian Films, Katalyst Films, Voltage Pictures",Unknown
Prison Break: The Final Break,89,English,"The movie covers the events which occurred in between the downfall of The Company and the finale of the TV series (SEASON 4). It details the arrest and incarceration of Sara Tancredi, the final escape plan which Michael devises for Sara, and reveals the ultimate fate of Gretchen Morgan.",2009,"Action, Drama, Thriller","prison, prison escape, love","Amaury Nolasco, Wentworth Miller, Dominic Purcell, Jodi Lyn O'Keefe, Sarah Wayne Callies","Brad Turner, Kevin Hooks",,"Amazon Video, Vudu ",,"Adelstein-Parouse Productions, 20th Century Fox Television, Original Film",Unknown
Public Enemies,140,English,"Depression-era bank robber John Dillinger's charm and audacity endear him to much of America's downtrodden public, but he's also a thorn in the side of J. Edgar Hoover and the fledgling FBI. Desperate to capture the elusive outlaw, Hoover makes Dillinger his first Public Enemy Number One and assigns his top agent, Melvin Purvis, the task of bringing him in dead or alive.",2009,"Crime, History","escape, gun, gangster, machinegun, horse race, biography, prison guard, prison escape, bank robbery, surveillance, tied up, handgun, pocket watch, escape from jail, 1930s, manhunt, vicious killings, 1900s, sex, fbi agent, tied to a tree, tied, semi-automatic rifle","Jason Clarke, Rory Cochrane, Johnny Depp, Marion Cotillard, Christian Bale",Michael Mann,"Starz Apple TV Channel, Starz Roku Premium Channel, Starz, Starz Amazon Channel ","Apple TV, Amazon Video, Google Play Movies, YouTube, Vudu, Microsoft Store, AMC on Demand ","Apple TV, Amazon Video, Google Play Movies, YouTube, Vudu, Microsoft Store ","Universal Pictures, Relativity Media, Forward Pass, Misher Films, Tribeca Productions, Appian Way, Blue Light",Unknown
Fired Up!,90,English,Popular high schoolers and best friends Shawn and Nick decide to ditch football camp for cheerleader camp. For the girls and for the glory.,2009,Comedy,"cheerleading, aftercreditsstinger, duringcreditsstinger","Nicholas D'Agosto, Eric Christian Olsen, Sarah Roemer, Danneel Ackles, Molly Sims",Will Gluck,History Vault ,"Apple TV, Amazon Video, Google Play Movies, YouTube, Vudu, Microsoft Store, AMC on Demand ","Apple TV, Amazon Video, Google Play Movies, YouTube, Vudu, Microsoft Store ","Weinstock Productions, Screen Gems, Moving Pictures, DPI, Gross Entertainment",https://www.sonypictures.com/movies/firedup
Scooby-Doo! The Mystery Begins,82,English,"Unjustly accused of staging a spooky practical joke complete with ghosts, Daphne, Velma, Fred and Shaggy are suspended from Coolsville High. To clear their names, they team up to solve the supernatural mystery…and head straight into nonstop laughs and adventure.",2009,"Mystery, Comedy, Fantasy","high school, friendship, spirit, dog, family, high school student","Nick Palatas, Frank Welker, Robbie Amell, Hayley Kiyoko, Kate Melton",Brian Levant,"Max, Max Amazon Channel ","Apple TV, Amazon Video, Google Play Movies, YouTube, Vudu, Microsoft Store ","Apple TV, Amazon Video, Google Play Movies, YouTube, Vudu, Microsoft Store ",Warner Premiere,Unknown
Naruto Shippuden the Movie: The Will of Fire,95,Japanese,"Ninjas with bloodline limits begin disappearing in all the countries and blame points toward the fire nation. By Tsunade's order, Kakashi is sacrificed to prevent an all out war. After inheriting charms left by Kakashi, Naruto fights through friends and foes to prevent his death while changing the minds of those who've inherited the will of fire.",2009,"Action, Adventure, Comedy, Drama, Fantasy, Animation","ninja fighter, anime","Romi Park, Satoshi Hino, Chie Nakamura, Kazuhiko Inoue, Junko Takeuchi",Masahiko Murata,"Netflix, Funimation Now, Netflix basic with Ads ","Apple TV, Amazon Video, Google Play Movies, YouTube, Vudu, Microsoft Store ","Apple TV, Amazon Video, Google Play Movies, YouTube, Vudu, Microsoft Store ",Pierrot,http://www.naruto-movie.com/
(500) Days of Summer,95,English,"Tom, greeting-card writer and hopeless romantic, is caught completely off-guard when his girlfriend, Summer, suddenly dumps him. He reflects on their 500 days together to try to figure out where their love affair went sour, and in doing so, Tom rediscovers his true passions in life.",2009,"Comedy, Drama, Romance","jealousy, gallery, fight, date, architect, interview, sister, love, friends, fate, los angeles, california, summer, year, heartache","Matthew Gray Gubler, Geoffrey Arend, Zooey Deschanel, Joseph Gordon-Levitt, Chloë Grace Moretz",Marc Webb,"Hulu, Hoopla ","Apple TV, Amazon Video, Google Play Movies, YouTube, Vudu, Microsoft Store, AMC on Demand ","Apple TV, Amazon Video, Google Play Movies, YouTube, Vudu, Microsoft Store ","Fox Searchlight Pictures, Watermark Pictures, Dune Entertainment III",https://www.foxmovies.com/movies/500-days-of-summer
