Title,Runtime (minutes),Language,Overview,Release Year,Genre,Keywords,Actors,Directors,Stream,Buy,Rent,Production Companies,Website
Dogtooth,98,Modern Greek (1453-),"Three teenagers are confined to an isolated country estate that could very well be on another planet. The trio spend their days listening to endless homemade tapes that teach them a whole new vocabulary. Any word that comes from beyond their family abode is instantly assigned a new meaning. Hence 'the sea' refers to a large armchair and 'zombies' are little yellow flowers. Having invented a brother whom they claim to have ostracized for his disobedience, the uber-controlling parents terrorize their offspring into submission.",2009,Drama,"hostage, paranoia, dysfunctional family, incest, mental illness, tooth, sexual awakening, fantasy world, isolated house, home education, nordic","Christos Stergioglou, Michele Valley, Hristos Passalis, Mary Tsoni, Angeliki Papoulia",Yorgos Lanthimos,Hoopla ,"Apple TV, Amazon Video, Google Play Movies, YouTube, Vudu ","Apple TV, Amazon Video, Google Play Movies, YouTube, Vudu, Kino Now ","Greek Film Centre, Boo Productions, Horsefly Productions",http://www.dogtooth.gr/
Avatar,162,English,"In the 22nd century, a paraplegic Marine is dispatched to the moon Pandora on a unique mission, but becomes torn between following orders and protecting an alien civilization.",2009,"Action, Adventure, Fantasy, Science Fiction","future, society, culture clash, space travel, space war, space colony, tribe, romance, alien, futuristic, space, alien planet, marine, soldier, battle, love affair, nature, anti war, power relations, joyful","Zoe Saldaña, Michelle Rodriguez, Sam Worthington, Stephen Lang, Sigourney Weaver",James Cameron,"Disney Plus, Max, Max Amazon Channel ","Apple TV, Amazon Video, Google Play Movies, YouTube, Vudu, Microsoft Store, AMC on Demand ","Apple TV, Amazon Video, Google Play Movies, YouTube, Vudu, Microsoft Store ","Dune Entertainment, Lightstorm Entertainment, 20th Century Fox, Ingenious Media",https://www.avatar.com/movies/avatar
The Ugly Truth,96,English,"A romantically challenged morning show producer is reluctantly embroiled in a series of outrageous tests by her chauvinistic correspondent to prove his theories on relationships and help her find love. His clever ploys, however, lead to an unexpected result.",2009,"Comedy, Romance","surgeon, sexism, romantic comedy, romance, television producer, morning show, relationship, sex toy, valentine's day, misogyny, opposites attract, sacramento","Eric Winter, Gerard Butler, Katherine Heigl, Bree Turner, Nick Searcy",Robert Luketic,Starz Apple TV Channel ,"Apple TV, Amazon Video, Google Play Movies, YouTube, Vudu, Microsoft Store, AMC on Demand ","Apple TV, Amazon Video, Google Play Movies, YouTube, Vudu, Microsoft Store ","Lakeshore Entertainment, Relativity Media",http://www.thetruthisntpretty.com/
G.I. Joe: The Rise of Cobra,118,English,"From the Egyptian desert to deep below the polar ice caps, the elite G.I. JOE team uses the latest in next-generation spy and military equipment to fight the corrupt arms dealer Destro and the growing threat of the mysterious Cobra organization to prevent them from plunging the world into chaos.",2009,"Adventure, Action, Thriller, Science Fiction","government, technology, hostage, laser, warhead, president, revenge, murder, attack, terrorism, explosion, scientist, evil, cobra","Sienna Miller, Adewale Akinnuoye-Agbaje, Christopher Eccleston, Lee Byung-hun, Joseph Gordon-Levitt",Stephen Sommers,"Paramount Plus, Paramount Plus Apple TV Channel , Paramount+ Amazon Channel, Paramount+ Roku Premium Channel ","Apple TV, Amazon Video, Google Play Movies, YouTube, Vudu, Microsoft Store, AMC on Demand ","Apple TV, Amazon Video, Google Play Movies, YouTube, Vudu, Microsoft Store ","Paramount, Spyglass Entertainment, di Bonaventura Pictures, Hasbro, Kontsept Film Company",http://www.gijoemovie.com/
Zombie Women of Satan,85,English,"When a group of nightclub performers – including Pervo the clown, Zeus, a flatulent dwarf, and Skye, a feisty rock chick – arrive on a remote farm for a cable TV interview, they soon discover the dark secret of the sinister family who live there – they have been kidnapping and torturing gorgeous young women as part of a perverted cult. However, the family’s experiments have now gone wrong, and the stocking-clad women have now become ravenous ZOMBIES! Now trapped, our ragtag group of visitors must unite in a desperate bid to stay alive… Sexy, gory and gut-munchingly hilarious – ZOMBIE WOMEN OF SATAN is THE most outrageous zombie comedy movie of the year!",2009,Horror,"experiment, cult, zombie, traveling circus","Marysia Kay, Victoria Hopkins, Warren Speed, Victoria Broom, Peter Bonner","Warren Speed, Steve O'Brien",,"Apple TV, Amazon Video, Microsoft Store ","Apple TV, Amazon Video, Microsoft Store ","Growling Clown Entertainment, 24:25 Films",Unknown
Brüno,83,English,Flamboyantly gay Austrian television reporter Bruno stirs up trouble with unsuspecting guests and large crowds through brutally frank interviews and painfully hilarious public displays of homosexuality.,2009,Comedy,"homophobia, drag queen, satire, dominatrix, celebrity, mockumentary, social satire, fame, hollywood, tv reporter, lgbt, austrian, duringcreditsstinger, sex tape, celebrity interview, gay theme","Sacha Baron Cohen, Clifford Bañagale, Gustaf Hammarsten, Josh Meyers, Toby Holguin",Larry Charles,Starz Apple TV Channel ,"Apple TV, Amazon Video, Google Play Movies, YouTube, Vudu, Microsoft Store, AMC on Demand ","Apple TV, Amazon Video, Google Play Movies, YouTube, Vudu, Microsoft Store, Spectrum On Demand ","Universal Pictures, MRC, Four by Two",Unknown
Cirque du Freak: The Vampire's Assistant,109,English,"Darren Shan is a regular teenage kid. He and his friend Steve find out about a Freak Show coming to town and work hard at trying to find tickets. They do, and together they go to ""Cirque du Freak"" where they see many strange acts including a wolf-man and a bearded lady",2009,"Adventure, Fantasy, Action, Thriller","based on novel or book, vampire, spider, wolfman, best friend, antidote, based on young adult novel","Salma Hayek Pinault, Chris Massoglia, Patrick Fugit, Josh Hutcherson, John C. Reilly",Paul Weitz,"fuboTV, USA Network ","Apple TV, Amazon Video, Google Play Movies, YouTube, Vudu, Microsoft Store ","Apple TV, Amazon Video, Google Play Movies, YouTube, Vudu, Microsoft Store ","Universal Pictures, Relativity Media, Depth of Field",Unknown
Crank: High Voltage,96,English,Chelios faces a Chinese mobster who has stolen his nearly indestructible heart and replaced it with a battery-powered ticker that requires regular jolts of electricity to keep working.,2009,"Action, Thriller, Crime","prostitute, heart, horse race, cigarette, electric shock, strip club, sequel, flashback, tourette syndrome, gang, shootout, mansion, foot chase, surgery, taser, duringcreditsstinger, absurdism, ultraviolence","Bai Ling, Jason Statham, Amy Smart, David Carradine, Dwight Yoakam","Mark Neveldine, Brian Taylor",,"Apple TV, Amazon Video, Google Play Movies, YouTube, Vudu, Microsoft Store ","Apple TV, Amazon Video, Google Play Movies, YouTube, Vudu, Microsoft Store ","Lionsgate, Lakeshore Entertainment, RadicalMedia",http://www.crank2.com/
Friday the 13th,97,English,A group of young adults visit a boarded up campsite named Crystal Lake where they soon encounter the mysterious Jason Voorhees and his deadly intentions.,2009,Horror,"cabin in the woods, axe murder, camp counselor","Travis Van Winkle, Amanda Righetti, Danielle Panabaker, Jared Padalecki, Aaron Yoo",Marcus Nispel,"Max, Max Amazon Channel, Cinemax Amazon Channel, Cinemax Apple TV Channel ","Apple TV, Amazon Video, Google Play Movies, YouTube, Vudu, Microsoft Store, AMC on Demand ","Apple TV, Amazon Video, Google Play Movies, YouTube, Vudu, Microsoft Store ","New Line Cinema, Paramount, Platinum Dunes, Crystal Lake Entertainment",http://www.fridaythe13thmovie.com
Final Fantasy VII: On the Way to a Smile - Episode Denzel,28,Japanese,It's been four years since Meteor fell on Midgar. Denzel meets Reeve at an outskirts coffee shop about joining the World Regenesis Organization. Upon the request Denzel tells Reeve about what his life was like prior to the Meteor incident.,2009,"Animation, Fantasy",based on video game,"Yoshimitsu Shimoyama, Takako Honda, Yasuyuki Kase, Kazumu Izawa, Banjo Ginga",Shinji Ishihira,,,,"Square Enix, A-1 Pictures",Unknown
The Lovely Bones,136,English,"After being brutally murdered, 14-year-old Susie Salmon watches from heaven over her grief-stricken family -- and her killer. As she observes their daily lives, she must balance her thirst for revenge with her desire for her family to heal.",2009,"Fantasy, Drama","rape, based on novel or book, afterlife, loss of loved one, tree, 1970s, serial killer, corpse, pedophile, teenage love, grieving, childhood sexual abuse, based on young adult novel","Mark Wahlberg, Susan Sarandon, Stanley Tucci, Rachel Weisz, Saoirse Ronan",Peter Jackson,"Max, Max Amazon Channel, Showtime Apple TV Channel ","Apple TV, Amazon Video, Google Play Movies, YouTube, Vudu, Microsoft Store, AMC on Demand ","Apple TV, Amazon Video, Google Play Movies, YouTube, Vudu, Microsoft Store, FlixFling, Spectrum On Demand ","WingNut Films, DreamWorks Pictures, Film4 Productions",http://www.lovelybones.com
The Last House on the Left,110,English,"When athletic teen Mari Collingwood opts to hang out with her friend Paige in town rather than spend an evening in with her parents vacationing at the family's remote lake house, it marks the beginning of a night no one is going to forget.",2009,"Crime, Thriller, Horror, Drama","rape, white trash, dysfunctional family, remake, revenge, murder, swimmer, family, rape and revenge","Sara Paxton, Spencer Treat Clark, Garret Dillahunt, Monica Potter, Tony Goldwyn",Dennis Iliadis,,"Apple TV, Amazon Video, Google Play Movies, YouTube, Vudu, Microsoft Store, AMC on Demand ","Apple TV, Amazon Video, Google Play Movies, YouTube, Vudu, Microsoft Store ","Rogue Pictures, Film Afrika, Sean S. Cunningham Films, The Night Co., Focus Features",http://www.thelasthouseontheleft.com/
Dragonball Evolution,85,English,"On his 18th birthday, Goku receives a mystical Dragonball as a gift from his grandfather. There are only six others like it in the whole world, and legend has it that whoever possesses all seven will be granted one perfect wish. When the arrival of a dark force triggers a tragedy, Goku and his companions are propelled into an epic quest to collect the seven Dragonballs and save the Earth from destruction.",2009,"Action, Adventure, Fantasy, Science Fiction, Thriller","superhero, karate, revenge, dragon, based on manga, duringcreditsstinger, live action remake","Justin Chatwin, Emmy Rossum, Joon Park, Chow Yun-fat, Jamie Chung",James Wong,,"Amazon Video, Google Play Movies, YouTube, Vudu, Microsoft Store, AMC on Demand ","Amazon Video, Google Play Movies, YouTube, Vudu, Microsoft Store, Spectrum On Demand ","World Film Magic, Dune Entertainment, Star Overseas, Big Screen Productions, Ingenious Media, 20th Century Fox",Unknown
Into the Blue 2: The Reef,92,English,"When they're hired to recover the lost treasure of Columbus, married scuba divers Sebastian and Dani think they've hit the jackpot. But as they get closer to the fortune, the couple begins to suspect their employers have their own agenda. Hitting upon the real plan, the two come to the chilling realization that they may be expendable and that there's much more than riches at stake.",2009,"Action, Adventure, Thriller","beach, chance, deep sea, villainess, scuba diving, adventurer, treasure hunter","Laura Vandervoort, David Anders, Mircea Monroe, Marsha Thomason, Chris Carmack",Stephen Herek,"Cinemax Amazon Channel, Cinemax Apple TV Channel ","Apple TV, Amazon Video, Google Play Movies, YouTube, Vudu ","Apple TV, Amazon Video, Google Play Movies, YouTube, Vudu, Microsoft Store ","MGM Home Entertainment, Mandalay Pictures, Brookwell-McNamara Entertainment, Metro-Goldwyn-Mayer",Unknown
Up in the Air,110,English,"Corporate downsizing expert Ryan Bingham spends his life in planes, airports, and hotels, but just as he’s about to reach a milestone of ten million frequent flyer miles, he meets a woman who causes him to rethink his transient life.",2009,"Drama, Romance","suitcase, business, omaha, las vegas, on the road, downsizing, cross country, videoconferencing, employment termination, business trip, airport lounge, duringcreditsstinger, airline, motivational speaker, public speaking, laid off, mature romance, traveler, fired from a job, airport ending, travel packing, travel gift, air travel, frequent flyer","George Clooney, Sam Elliott, Amy Morton, Anna Kendrick, Vera Farmiga",Jason Reitman,"Max, Max Amazon Channel, Showtime Apple TV Channel ","Apple TV, Amazon Video, Google Play Movies, YouTube, Vudu, Microsoft Store, AMC on Demand ","Apple TV, Amazon Video, Google Play Movies, YouTube, Vudu, Microsoft Store, FlixFling, Spectrum On Demand ","Paramount, DreamWorks Pictures, Cold Spring Pictures, The Montecito Picture Company, Rickshaw Productions, Right of Way Films",Unknown
Drag Me to Hell,99,English,"After denying a woman the extension she needs to keep her home, loan officer Christine Brown sees her once-promising life take a startling turn for the worse. Christine is convinced she's been cursed by a Gypsy, but her boyfriend is skeptical. Her only hope seems to lie in a psychic who claims he can help her lift the curse and keep her soul from being dragged straight to hell.",2009,"Horror, Thriller","work, gypsy, gore, curse, psychologist, psychic, evil, loan officer, obituary, engagement ring","Dileep Rao, Alison Lohman, Justin Long, Lorna Raver, David Paymer",Sam Raimi,,"Apple TV, Amazon Video, Google Play Movies, YouTube, Vudu, Microsoft Store, AMC on Demand ","Apple TV, Amazon Video, Google Play Movies, YouTube, Vudu, Microsoft Store, Spectrum On Demand ","Universal Pictures, Ghost House Pictures, Buckaroo Entertainment, Curse Productions, Mandate Pictures",Unknown
Up,96,English,"Carl Fredricksen spent his entire life dreaming of exploring the globe and experiencing life to its fullest. But at age 78, life seems to have passed him by, until a twist of fate (and a persistent 8-year old Wilderness Explorer named Russell) gives him a new lease on life.",2009,"Animation, Comedy, Family, Adventure","central and south america, age difference, balloon, travel, dog, duringcreditsstinger, pets, exploring, senior","Christopher Plummer, Ed Asner, Delroy Lindo, Bob Peterson, Jordan Nagai",Pete Docter,Disney Plus ,"Apple TV, Amazon Video, Google Play Movies, YouTube, Vudu, Microsoft Store, AMC on Demand ","Apple TV, Amazon Video, Google Play Movies, YouTube, Vudu, Microsoft Store, Spectrum On Demand ",Pixar,http://disney.go.com/disneypictures/up/
Wrong Turn 3: Left for Dead,91,English,"A group of people find themselves trapped in the backwoods of West Virginia, fighting for their lives against a group of vicious and horribly disfigured inbred cannibals.",2009,"Horror, Thriller","sheriff, river, penitentiary, forest, west virginia, woods, slasher, hillbilly, cannibal, survival horror, voyeur, molotov cocktail, criminal trio, criminals","Tom Frederic, Louise Cliffe, Emma Clifford, Janet Montgomery, Jack Gordon",Declan O'Brien,,"Apple TV, Amazon Video, Google Play Movies, YouTube, Vudu, Microsoft Store ","Apple TV, Amazon Video, Google Play Movies, YouTube, Vudu, Microsoft Store ","Constantin Film, Summit Entertainment",Unknown
17 Again,102,English,"On the brink of a midlife crisis, 30-something Mike O'Donnell wishes he could have a ""do-over."" And that's exactly what he gets when he wakes up one morning to find he's 17 years old again. With his adult mind stuck inside the body of a teenager, Mike actually has the chance to reverse some decisions he wishes he'd never made. But maybe they weren't so bad after all.",2009,"Comedy, Fantasy, Drama, Romance","high school, fake identity, bullying, high school sports, adult as a child, do over, age change","Leslie Mann, Sterling Knight, Michelle Trachtenberg, Thomas Lennon, Zac Efron",Burr Steers,,"Apple TV, Amazon Video, Google Play Movies, YouTube, Vudu, Microsoft Store, AMC on Demand ","Apple TV, Amazon Video, Google Play Movies, YouTube, Vudu, Microsoft Store, Spectrum On Demand ","New Line Cinema, Offspring Entertainment",http://www.17againmovie.com/
After.Life,104,English,"Following a terrible car crash, a woman awakes to find an enigmatic mortician preparing her for burial.",2009,"Drama, Horror, Mystery, Thriller","nightmare, funeral, wheelchair, injection, crying, casket, shovel, lily, argument, crucifix, woman director","Josh Charles, Chandler Canterbury, Christina Ricci, Liam Neeson, Justin Long",Agnieszka Wojtowicz-Vosloo,IndieFlix ,"Apple TV, Amazon Video, Google Play Movies, YouTube, Vudu, Microsoft Store ","Apple TV, Amazon Video, Google Play Movies, YouTube, Vudu, Microsoft Store ","Lleju Productions, Harbor Light Entertainment, Plum Pictures",Unknown
Carriers,84,English,"A deadly virus has spread across the globe. Contagion is everywhere, no one is safe, and no one can be trusted. Four friends race through the back roads of the American West on their way to a secluded utopian beach in the Gulf of Mexico where they could peacefully wait out the pandemic. Their plans take a grim turn when their car breaks down on an isolated road starting a chain of events that will seal their fates.",2009,"Action, Drama, Horror, Science Fiction, Thriller","beach, infection, survival, biohazard, disease, trust, virus, pandemic","Chris Pine, Piper Perabo, Emily VanCamp, Christopher Meloni, Lou Taylor Pucci","Àlex Pastor, David Pastor",fuboTV ,"Apple TV, Amazon Video, Google Play Movies, YouTube, Vudu, Microsoft Store, AMC on Demand ","Apple TV, Amazon Video, Google Play Movies, YouTube, Vudu, Microsoft Store ","Paramount Vantage, Likely Story, This Is That, Ivy Boy Productions",Unknown
The Proposal,108,English,"When she learns she's in danger of losing her visa status and being deported, overbearing book editor Margaret Tate forces her put-upon assistant, Andrew Paxton, to marry her.",2009,"Comedy, Romance, Drama","fictitious marriage, deportation, immigration law, romantic comedy, alaska, co-workers relationship, humiliation, book editor, fake boyfriend, valentine's day, duringcreditsstinger, woman director, pretend relationship","Malin Åkerman, Craig T. Nelson, Ryan Reynolds, Mary Steenburgen, Sandra Bullock",Anne Fletcher,"Apple TV Plus, Hulu ","Apple TV, Amazon Video, Google Play Movies, YouTube, Vudu, Microsoft Store, AMC on Demand ","Apple TV, Amazon Video, Google Play Movies, YouTube, Vudu, Microsoft Store, Spectrum On Demand ","Kurtzman/Orci, Touchstone Pictures, Mandeville Films",Unknown
Ice Age: Dawn of the Dinosaurs,94,English,"Times are changing for Manny the moody mammoth, Sid the motor mouthed sloth and Diego the crafty saber-toothed tiger. Life heats up for our heroes when they meet some new and none-too-friendly neighbors – the mighty dinosaurs.",2009,"Animation, Comedy, Family, Adventure","insanity, ice age, bridge, sequel, jungle, prehistory, dinosaur, creature, birth, duringcreditsstinger","Denis Leary, Simon Pegg, Queen Latifah, John Leguizamo, Ray Romano",Carlos Saldanha,"Disney Plus, Starz Apple TV Channel ","Apple TV, Amazon Video, Google Play Movies, YouTube, Vudu, Microsoft Store, AMC on Demand ","Apple TV, Amazon Video, Google Play Movies, YouTube, Vudu, Microsoft Store ","Blue Sky Studios, 20th Century Fox Animation",http://www.iceagemovies.com/films/ice-age-dawn-of-the-dinosaurs
Astro Boy,94,English,"Set in the futuristic Metro City, Astro Boy (Atom) is a young robot with incredible powers created by a brilliant scientist in the image of the son he had lost. Unable to fulfill his creator's expectations, Astro embarks on a journey in search of acceptance, experiencing betrayal and a netherworld of robot gladiators, before returning to save Metro City and reconcile with the father who rejected him.",2009,"Animation, Action, Family, Science Fiction","future, hero, superhero, based on manga, robot, family, osamu tezuka, astro boy","Madeline Carroll, Freddie Highmore, Donald Sutherland, Nicolas Cage, Kristen Bell",David Bowers,"Amazon Prime Video, Hulu ","Apple TV, Amazon Video, Google Play Movies, YouTube, Vudu, Microsoft Store, AMC on Demand ","Apple TV, Amazon Video, Google Play Movies, YouTube, Vudu, Microsoft Store ","Summit Entertainment, Imagi Animation Studios, Tezuka Productions",http://www.astroboy-themovie.com/
Personal Effects,110,English,Walter is a rising star in the NCAA wrestling world until his life is ripped apart by the brutal murder of his sister. Returning home to console his mother Gloria he seeks vengeance on the man who is accused of the crime. A chance meeting with a beautiful mature woman gives him solace to the situation. Will this unlikely pairing bloom into a romance and heal a wound the world cannot see or will the loss of his sister push him over the edge?,2009,Drama,"dying and death, cemetery, autopsy","Kathy Bates, Ashton Kutcher, John Mann, Spencer Hudson, Michelle Pfeiffer",David Hollander,,"Apple TV, Amazon Video, Google Play Movies, YouTube, Vudu, Redbox ","Apple TV, Amazon Video, Google Play Movies, YouTube, Vudu ","Picture Park, Cinéfilm AG, Insight Film Studios, TADORA Filmproduktions, Three Rivers Entertainment, Netter Productions, Voltage Pictures",http://www.insightfilm.com/personal_effects.html
My Sister's Keeper,109,English,"Sara and Brian live an idyllic life with their young son and daughter. But their family is rocked by sudden, heartbreaking news that forces them to make a difficult and unorthodox choice in order to save their baby girl's life. The parents' desperate decision raises both ethical and moral questions and rips away at the foundation of their relationship. Their actions ultimately set off a court case that threatens to tear the family apart, while revealing surprising truths that challenge everyone's perceptions of love and loyalty and give new meaning to the definition of healing.",2009,Drama,"sibling relationship, court case, parent child relationship, in vitro fertilisation, medical examiner, kidney transplant ","Sofia Vassilieva, Alec Baldwin, Cameron Diaz, Abigail Breslin, Jason Patric",Nick Cassavetes,"Max, Max Amazon Channel ","Apple TV, Amazon Video, Google Play Movies, YouTube, Vudu, Microsoft Store, AMC on Demand ","Apple TV, Amazon Video, Google Play Movies, YouTube, Vudu, Microsoft Store ","Mark Johnson Productions, Gran Via Productions, Curmudgeon Films, New Line Cinema",http://www.mysisterskeepermovie.com/
Watchmen,163,English,"In a gritty and alternate 1985, the glory days of costumed vigilantes have been brought to a close by a government crackdown. But after one of the masked veterans is brutally murdered, an investigation into the killer is initiated. The reunited heroes set out to prevent their own destruction, but in doing so they uncover a sinister plot that puts all of humanity in grave danger.",2009,"Action, Mystery, Science Fiction","usa president, nuclear war, mass murder, secret identity, narration, soviet union, retirement, based on comic, conspiracy, animated scene, doomsday, masked vigilante, doomsday clock, red square, 1980s","Patrick Wilson, Malin Åkerman, Jackie Earle Haley, Matthew Goode, Billy Crudup",Zack Snyder,"Max, Max Amazon Channel ","Apple TV, Amazon Video, Google Play Movies, YouTube, Vudu, Microsoft Store, AMC on Demand ","Apple TV, Amazon Video, Google Play Movies, YouTube, Vudu, Microsoft Store, Spectrum On Demand ","Warner Bros. Pictures, Paramount, Legendary Pictures, DC Comics, Lawrence Gordon Productions, Lloyd Levin Productions",https://www.warnerbros.com/movies/watchmen/
3 Idiots,170,Hindi,"Rascal. Joker. Dreamer. Genius... You've never met a college student quite like ""Rancho."" From the moment he arrives at India's most prestigious university, Rancho's outlandish schemes turn the campus upside down—along with the lives of his two newfound best friends. Together, they make life miserable for ""Virus,"" the school’s uptight and heartless dean. But when Rancho catches the eye of the dean's daughter, Virus sets his sights on flunking out the ""3 idiots"" once and for all.",2009,"Drama, Comedy","suicide, suicide attempt, college, slapstick comedy, coming of age, friends, engineering, subjective camera","Aamir Khan, Sharman Joshi, R. Madhavan, Boman Irani, Kareena Kapoor Khan",Rajkumar Hirani,,"Apple TV, Amazon Video, Google Play Movies, YouTube, AMC on Demand ","Apple TV, Amazon Video, Google Play Movies, YouTube ","Vidhu Vinod Chopra Productions, Vinod Chopra Films",Unknown
The Final Destination,82,English,"After a young man's premonition of a deadly race-car crash helps saves the lives of his peers, Death sets out to collect those who evaded their end.",2009,"Horror, Mystery","dying and death, plan, car race, gore, stock car racing, car crash, premonition, vision","Nick Zano, Mykelti Williamson, Bobby Campo, Haley Webb, Shantel VanSanten",David R. Ellis,,"Apple TV, Amazon Video, Google Play Movies, YouTube, Vudu, Microsoft Store ","Apple TV, Amazon Video, Google Play Movies, YouTube, Vudu, Microsoft Store, Spectrum On Demand ","Parallel Zide, New Line Cinema, Practical Pictures, FlipZide",http://www.TheFinalDestinationMovie.com/
