Title,Runtime (minutes),Language,Overview,Release Year,Genre,Keywords,Actors,Directors,Stream,Buy,Rent,Production Companies,Website
Harry Potter and the Half-Blood Prince,153,English,"As Lord Voldemort tightens his grip on both the Muggle and wizarding worlds, Hogwarts is no longer a safe haven. Harry suspects perils may even lie within the castle, but Dumbledore is more intent upon preparing him for the final battle fast approaching. Together they work to find the key to unlock Voldemorts defenses and to this end, Dumbledore recruits his old friend and colleague Horace Slughorn, whom he believes holds crucial information. Even as the decisive showdown looms, romance blossoms for Harry, Ron, Hermione and their classmates. Love is in the air, but danger lies ahead and Hogwarts may never be the same again.",2009,"Adventure, Fantasy","witch, dying and death, london, england, magic, school of witchcraft, apparition, curse, teenage crush, school, werewolf, teenage love, luck, wizard, secret past, christmas, based on young adult novel, wizarding world","Rupert Grint, Michael Gambon, Emma Watson, Jim Broadbent, Daniel Radcliffe",David Yates,"fuboTV, Peacock Premium, USA Network ","Apple TV, Amazon Video, Google Play Movies, YouTube, Vudu, Microsoft Store, AMC on Demand ","Apple TV, Amazon Video, Google Play Movies, YouTube, Vudu, Microsoft Store, Spectrum On Demand ","Warner Bros. Pictures, Heyday Films",https://www.warnerbros.com/movies/harry-potter-and-half-blood-prince/
Coraline,100,English,"A young girl discovers an idealized parallel universe behind a secret door in her new home, unaware that it contains a sinister secret.",2009,"Animation, Family, Fantasy","friendship, dream, based on novel or book, eye, stuffed animal, stop motion, parallel world, button, new home, secret door, aftercreditsstinger, duringcreditsstinger, horror for children, talking cat, parallel universe, neil gaiman","Keith David, Dakota Fanning, Jennifer Saunders, Dawn French, Teri Hatcher",Henry Selick,"Max, Max Amazon Channel ","Apple TV, Amazon Video, Google Play Movies, YouTube, Vudu, Microsoft Store, Redbox ","Apple TV, Amazon Video, Google Play Movies, YouTube, Vudu, Microsoft Store, Redbox, Spectrum On Demand ","Laika, Pandemonium",http://coraline.com/
Star Trek,127,English,"The fate of the galaxy rests in the hands of bitter rivals. One, James Kirk, is a delinquent, thrill-seeking Iowa farm boy. The other, Spock, a Vulcan, was raised in a logic-based society that rejects all emotion. As fiery instinct clashes with calm reason, their unlikely but powerful partnership is the only thing capable of leading their crew through unimaginable danger, boldly going where no one has gone before. The human adventure has begun again.",2009,"Science Fiction, Action, Adventure","spacecraft, teleportation, san francisco, california, time travel, space mission, parachute, black hole, supernova, prequel, futuristic, warp speed, warp engine, space, romulans, alternate reality, space opera, reboot, unlikely friendship, child driving car, 23rd century, based on tv series, 24th century","Chris Pine, Zachary Quinto, Eric Bana, Leonard Nimoy, Bruce Greenwood",J.J. Abrams,"Apple TV Plus, Paramount Plus, Paramount Plus Apple TV Channel , Paramount+ Amazon Channel ","Apple TV, Amazon Video, Google Play Movies, YouTube, Vudu, Microsoft Store, AMC on Demand ","Apple TV, Amazon Video, Google Play Movies, YouTube, Vudu, Microsoft Store, Spectrum On Demand ","Paramount, Spyglass Entertainment, Bad Robot",https://www.paramountmovies.com/movies/star-trek-2009
Monsters vs Aliens,94,English,"When Susan Murphy is unwittingly clobbered by a meteor full of outer space gunk on her wedding day, she mysteriously grows to 49-feet-11-inches. The military jumps into action and captures Susan, secreting her away to a covert government compound. She is renamed Ginormica and placed in confinement with a ragtag group of Monsters...",2009,"Animation, Family, Adventure, Science Fiction","alien, giant robot, duringcreditsstinger, 3d","Reese Witherspoon, Will Arnett, Hugh Laurie, Rainn Wilson, Seth Rogen","Rob Letterman, Conrad Vernon","Max, Max Amazon Channel ","Apple TV, Amazon Video, Google Play Movies, YouTube, Vudu, Microsoft Store, AMC on Demand ","Apple TV, Amazon Video, Google Play Movies, YouTube, Vudu, Microsoft Store ","DreamWorks Animation, Paramount",http://www.monstersvsaliens.com/
District 9,112,English,"Thirty years ago, aliens arrive on Earth. Not to conquer or give aid, but to find refuge from their dying planet. Separated from humans in a South African area called District 9, the aliens are managed by Multi-National United, which is unconcerned with the aliens' welfare but will do anything to master their advanced technology. When a company field agent contracts a mysterious virus that begins to alter his DNA, there is only one place he can hide: District 9.",2009,Science Fiction,"street gang, government, genetics, slum, mutation, dystopia, transformation, south africa, johannesburg south africa, satire, mockumentary, alien, prawn, alternate history, racism, metamorphosis, xenophobia, internment camp, alien technology, segregation, private military company, based on short film","Nathalie Boltt, Sylvaine Strike, Jason Cope, Sharlto Copley, Elizabeth Mkandawie",Neill Blomkamp,"AMC Plus Apple TV Channel , AMC+ Amazon Channel, AMC+ Roku Premium Channel, AMC+, AMC ","Apple TV, Amazon Video, Google Play Movies, YouTube, Vudu, Microsoft Store, AMC on Demand ","Apple TV, Amazon Video, Google Play Movies, YouTube, Vudu, Microsoft Store ","TriStar Pictures, Block / Hanson, WingNut Films, District 9",http://www.d-9.com/
Bride Wars,89,English,Two best friends become rivals when their respective weddings are accidentally booked for the same day.,2009,"Comedy, Romance","friendship, bride, engagement, rivalry, wedding, family feud","Bryan Greenberg, Chris Pratt, Anne Hathaway, Steve Howey, Kate Hudson",Gary Winick,,"Apple TV, Amazon Video, Google Play Movies, YouTube, Vudu, Microsoft Store, AMC on Demand ","Apple TV, Amazon Video, Google Play Movies, YouTube, Vudu, Microsoft Store ","Fox 2000 Pictures, Regency Enterprises, New Regency Pictures, Birdie Productions, Dune Entertainment, Dune Entertainment III",https://newregency.com/movies/bride-wars
Angels & Demons,138,English,"Harvard symbologist Robert Langdon is recruited by the Vatican to investigate the apparent return of the Illuminati - a secret, underground organization - after four cardinals are kidnapped on the night of the papal conclave.",2009,"Thriller, Mystery","based on novel or book, rome, italy, vatican, symbolism, illuminati, quantum mechanics, prequel, anti matter, conspiracy, investigator, catholicism, cern","Pierfrancesco Favino, Tom Hanks, Stellan Skarsgård, Ewan McGregor, Ayelet Zurer",Ron Howard,,"Apple TV, Amazon Video, Google Play Movies, YouTube, Vudu, Microsoft Store, AMC on Demand ","Apple TV, Amazon Video, Google Play Movies, YouTube, Vudu, Microsoft Store, Spectrum On Demand ","Columbia Pictures, Imagine Entertainment, Skylark Productions, Panorama Films",http://www.angelsanddemons.com/
The Girl with the Dragon Tattoo,152,Swedish,"Swedish thriller based on Stieg Larsson's novel about a male journalist and a young female hacker. In the opening of the movie, Mikael Blomkvist, a middle-aged publisher for the magazine Millennium, loses a libel case brought by corrupt Swedish industrialist Hans-Erik Wennerström. Nevertheless, he is hired by Henrik Vanger in order to solve a cold case, the disappearance of Vanger's niece",2009,"Drama, Thriller, Crime, Mystery","journalist, island, bondage, rape, strong woman, hacker, based on novel or book, blow job, antisocial personality disorder, female protagonist, whodunit, newspaper man, millennium, female empowerment, locked room mystery","Noomi Rapace, Peter Haber, Lena Endre, Michael Nyqvist, Sven-Bertil Taube",Niels Arden Oplev,"fuboTV, Fandor, Topic, Viaplay, Topic Apple TV Channel ",Amazon Video ,Amazon Video ,"Det Danske Filminstitut, Nordisk Film Denmark, ZDF, Yellow Bird, Film Capital Stockholm, Spiltan Underhållning, Nordisk Film & TV Fond, Svenska Filminstitutet, SVT, Film i Väst",http://dragontattoofilm.com/
The Temptation of Kimono,85,Japanese,"Mikage will get married to Youiti next year, she agrees to live with Youiti's parents. One day, Youiti's father disrobed Mikage's Kimono and raped her. To her astonishment, her fiancé Youiti whom Mikage considers true love has an affair with his young stepmother. Shocked and devastated, what will Mikage do?",2009,"Drama, Romance","japan, orgasm, incest, cunnilingus, erotic movie","Mika Muroi, Elly Akira, Taro Kai, Risa Sakamoto, Yoshihiro Tanbara",Tadashi Kyouya,,,,Only Hearts Company,Unknown
Confessions of a Shopaholic,104,English,"In the glamorous world of New York City, Rebecca Bloomwood is a fun-loving girl who is really good at shopping - a little too good, perhaps. She dreams of working for her favorite fashion magazine, but can't quite get her foot in the door - until ironically, she snags a job as an advice columnist for a financial magazine published by the same company.",2009,"Comedy, Romance","new york city, based on novel or book, department store, shop, shopping mall, romantic comedy, addiction, liar, credit card, financial journalist, debt collector, debt, advice columnist, fashion magazine, duringcreditsstinger","Hugh Dancy, Krysten Ritter, Joan Cusack, Isla Fisher, John Goodman",P.J. Hogan,Disney Plus ,"Apple TV, Amazon Video, Google Play Movies, YouTube, Vudu, Microsoft Store, AMC on Demand ","Apple TV, Amazon Video, Google Play Movies, YouTube, Vudu, Microsoft Store ","Touchstone Pictures, Jerry Bruckheimer Films",Unknown
Funny People,146,English,"Famous and wealthy funnyman George Simmons doesn't give much thought to how he treats people until a doctor delivers stunning health news, forcing George to reevaluate his priorities with a little help from aspiring stand-up comic Ira.",2009,"Comedy, Drama","male friendship, comedian, cancer","Jonah Hill, Eric Bana, Leslie Mann, Adam Sandler, Seth Rogen",Judd Apatow,"Starz Apple TV Channel, Starz Roku Premium Channel, Starz, Starz Amazon Channel ","Apple TV, Amazon Video, Google Play Movies, YouTube, Vudu, Microsoft Store ","Apple TV, Amazon Video, Google Play Movies, YouTube, Vudu, Microsoft Store, Spectrum On Demand ","Universal Pictures, Columbia Pictures, Relativity Media, Apatow Productions, Madison 23",http://www.funnypeoplemovie.com
American Pie Presents: The Book of Love,93,English,"Ten years after the first American Pie movie, three new hapless virgins discover the Bible hidden in the school library at East Great Falls High. Unfortunately for them, the book is ruined, and with incomplete advice, the Bible leads them on a hilarious journey to lose their virginity.",2009,Comedy,"high school, teen comedy, teenage sexuality, virginity","Brandon Hardesty, Beth Behrs, Kevin M. Horton, Bug Hall, Melanie Papalia",John Putch,,"Apple TV, Amazon Video, Google Play Movies, YouTube, Vudu, Microsoft Store ","Apple TV, Amazon Video, Google Play Movies, YouTube, Vudu, Microsoft Store ","Capital Arts Entertainment, Universal Pictures Home Entertainment",Unknown
Alvin and the Chipmunks: The Squeakquel,88,English,"Pop sensations Alvin, Simon and Theodore end up in the care of Dave Seville's twenty-something nephew Toby. The boys must put aside music super stardom to return to school, and are tasked with saving the school's music program by winning the $25,000 prize in a battle of the bands. But the Chipmunks unexpectedly meet their match in three singing chipmunks known as The Chipettes - Brittany, Eleanor and Jeanette. Romantic and musical sparks are ignited when the Chipmunks and Chipettes square off.",2009,"Comedy, Family, Animation, Fantasy, Music","chipmunk, aftercreditsstinger, duringcreditsstinger, woman director, live action and animation","Matthew Gray Gubler, Jason Lee, Zachary Levi, Justin Long, David Cross",Betty Thomas,"Max, Max Amazon Channel ","Apple TV, Amazon Video, Google Play Movies, YouTube, Vudu, Microsoft Store, AMC on Demand ","Apple TV, Amazon Video, Google Play Movies, YouTube, Vudu, Microsoft Store ","Fox 2000 Pictures, Bagdasarian Productions, Regency Enterprises, 20th Century Fox, Dune Entertainment",http://www.munkyourself.com/
Knowing,121,English,A teacher opens a time capsule that has been dug up at his son's elementary school; in it are some chilling predictions -- some that have already occurred and others that are about to -- that lead him to believe his family plays a role in the events that are about to unfold.,2009,"Action, Mystery, Science Fiction, Thriller","cataclysm, code, time capsule, end of the world, astrophysicist, grieving widower, lexington massachusetts, westford massachusetts, prediction, researcher, numbers, news","Nadia Townsend, Chandler Canterbury, Nicolas Cage, Ben Mendelsohn, Rose Byrne",Alex Proyas,,"Apple TV, Amazon Video, Google Play Movies, YouTube, Vudu, Microsoft Store, AMC on Demand ","Apple TV, Amazon Video, Google Play Movies, YouTube, Vudu, Microsoft Store, Spectrum On Demand ","Summit Entertainment, Escape Artists, Mystery Clock Cinema, Kaplan/Perrone Entertainment, Wintergreen Productions, Goldcrest",http://knowing-themovie.com/
Terminator Salvation,115,English,"All grown up in post-apocalyptic 2018, John Connor must lead the resistance of humans against the increasingly dominating militaristic robots. But when Marcus Wright appears, his existence confuses the mission as Connor tries to determine whether Wright has come from the future or the past -- and whether he's friend or foe.",2009,"Action, Science Fiction, Thriller","army, artificial intelligence (a.i.), saving the world, prophecy, san francisco, california, gas station, cyborg, killer robot, dystopia, firearm, post-apocalyptic future, wartime, los angeles, california, terminator","Anton Yelchin, Helena Bonham Carter, Sam Worthington, Christian Bale, Moon Bloodgood",McG,,"Apple TV, Amazon Video, Google Play Movies, YouTube, Vudu, Microsoft Store, AMC on Demand ","Apple TV, Amazon Video, Google Play Movies, YouTube, Vudu, Microsoft Store, Spectrum On Demand ","The Halcyon Company, Moritz Borman Productions, Wonderland Sound and Vision, Lin Pictures, Mandate International, T Asset Acquisition Company",https://www.warnerbros.com/terminator-salvation
A Christmas Carol,94,English,"Miser Ebenezer Scrooge is awakened on Christmas Eve by spirits who reveal to him his own miserable existence, what opportunities he wasted in his youth, his current cruelties, and the dire fate that awaits him if he does not change his ways. Scrooge is faced with his own story of growing bitterness and meanness, and must decide what his own future will hold: death or redemption.",2009,"Animation, Family, Fantasy","london, england, based on novel or book, holiday, greed, victorian england, money, ghost, lesson, christmas music, moneylender, christmas, 19th century, scrooge, christmas eve","Colin Firth, Jim Carrey, Robin Wright, Gary Oldman, Cary Elwes",Robert Zemeckis,"Disney Plus, IndieFlix ","Apple TV, Amazon Video, Google Play Movies, YouTube, Vudu, Microsoft Store ","Apple TV, Amazon Video, Google Play Movies, YouTube, Vudu, Microsoft Store, Spectrum On Demand ","Walt Disney Pictures, ImageMovers Digital",http://movies.disney.com/a-christmas-carol
Ninja Assassin,99,English,"Ninja Assassin follows Raizo, one of the deadliest assassins in the world. Taken from the streets as a child, he was transformed into a trained killer by the Ozunu Clan, a secret society whose very existence is considered a myth. But haunted by the merciless execution of his friend by the Clan, Raizo breaks free from them and vanishes. Now he waits, preparing to exact his revenge.",2009,"Action, Adventure, Thriller","martial arts, assassin, assassination, ninja fighter, gore, stick fighting, sensei, revenge, ninja, bloody fight, chop socky, ninjutsu, kusarigama","Randall Duk Kim, Naomie Harris, Rain, Sung Kang, Rick Yune",James McTeigue,,"Apple TV, Amazon Video, Google Play Movies, YouTube, Vudu, Microsoft Store, AMC on Demand ","Apple TV, Amazon Video, Google Play Movies, YouTube, Vudu, Microsoft Store ","Legendary Pictures, Dark Castle Entertainment, Silver Pictures, Anarchos Productions, Rocklock Films, Studio Babelsberg, Warner Bros. Pictures, Deutscher Filmförderfonds, Medienboard Berlin-Brandenburg, Hermanas Wachowski, StudioCanal",http://ninja-assassin-movie.warnerbros.com
Inglourious Basterds,153,English,"In Nazi-occupied France during World War II, a group of Jewish-American soldiers known as ""The Basterds"" are chosen specifically to spread fear throughout the Third Reich by scalping and brutally killing Nazis. The Basterds, lead by Lt. Aldo Raine soon cross paths with a French-Jewish teenage girl who runs a movie theater in Paris which is targeted by the soldiers.",2009,"Drama, Thriller, War","guerrilla warfare, swastika, paris, france, nazi, self sacrifice, sadism, dynamite, mexican standoff, world war ii, jew persecution, masochism, anti-semitism, german occupation of france, british politics, revisionist history, adolf hitler","Michael Fassbender, Christoph Waltz, Brad Pitt, Mélanie Laurent, Eli Roth",Quentin Tarantino,,"Apple TV, Amazon Video, Google Play Movies, YouTube, Vudu, Microsoft Store ","Apple TV, Amazon Video, Google Play Movies, YouTube, Vudu, Microsoft Store ","The Weinstein Company, Universal Pictures, A Band Apart, Zehnte Babelsberg Film, Visiona Romantica, Peninsula Films",Unknown
Cloudy with a Chance of Meatballs,90,English,"Inventor Flint Lockwood creates a machine that makes clouds rain food, enabling the down-and-out citizens of Chewandswallow to feed themselves. But when the falling food reaches gargantuan proportions, Flint must scramble to avert disaster. Can he regain control of the machine and put an end to the wild weather before the town is destroyed?",2009,"Animation, Comedy, Family","inventor, weather, food, based on children's book","Andy Samberg, Anna Faris, Neil Patrick Harris, James Caan, Bill Hader","Phil Lord, Christopher Miller","Paramount Plus, Paramount Plus Apple TV Channel , Paramount+ Amazon Channel ","Apple TV, Amazon Video, Google Play Movies, YouTube, Vudu, Microsoft Store, AMC on Demand ","Apple TV, Amazon Video, Google Play Movies, YouTube, Vudu, Microsoft Store, Spectrum On Demand ","Sony Pictures Animation, Columbia Pictures",http://www.cloudywithachanceofmeatballs.com/
He's Just Not That Into You,129,English,"Remember that really cute girl/guy who said they'd call – and didn't? Maybe they lost your number. Maybe they're in the hospital. Maybe they're awed by your looks, brains or success. Or maybe... They're just not that into you.",2009,"Comedy, Romance, Drama","based on novel or book, baltimore, usa, dating, relationship, break-up, duringcreditsstinger, online dating, dating woes, single woman","Scarlett Johansson, Jennifer Connelly, Ginnifer Goodwin, Bradley Cooper, Justin Long",Ken Kwapis,,"Apple TV, Amazon Video, Google Play Movies, YouTube, Vudu, Microsoft Store, AMC on Demand ","Apple TV, Amazon Video, Google Play Movies, YouTube, Vudu, Microsoft Store, Spectrum On Demand ","Flower Films, Warner Bros. Pictures, New Line Cinema",http://www.hesjustnotthatintoyoumovie.com/
Gifted Hands: The Ben Carson Story,86,English,Gifted Hands: The Ben Carson Story is a movie based on the life story of world-renowned neurosurgeon Ben Carson from 1961 to 1987.,2009,Drama,"husband wife relationship, 1970s, surgeon, biography, based on true story, doctor, detroit, michigan, neurosurgeon, surgery, conjoined twins, 1980s, pediatrician, 1960s, mother son relationship, african american, medical","Cuba Gooding Jr., Aunjanue Ellis-Taylor, Kimberly Elise, Harron Atkins, Ele Bardha",Thomas Carter,Netflix ,"Apple TV, Amazon Video, Google Play Movies, YouTube, Vudu, Microsoft Store ","Apple TV, Amazon Video, Google Play Movies, YouTube, Vudu, Microsoft Store ","Johnson & Johnson Spotlight Presentations, Magna Global Entertainment, Sony Pictures Television Studios, The Hatchery, Thomas Carter Company",http://www.tnt.tv/movies/giftedhands/
The Hangover,100,English,"When three friends finally come to after a raucous night of bachelor-party revelry, they find a baby in the closet and a tiger in the bathroom. But they can't seem to locate their best friend, Doug – who's supposed to be tying the knot. Launching a frantic search for Doug, the trio perseveres through a nasty hangover to try to make it to the church on time.",2009,Comedy,"blackjack, stag night, lost weekend, chapel, hit with tire iron, memory loss, las vegas, drugs","Ed Helms, Heather Graham, Bradley Cooper, Zach Galifianakis, Justin Bartha",Todd Phillips,,"Apple TV, Amazon Video, Google Play Movies, YouTube, Vudu, Microsoft Store, AMC on Demand ","Apple TV, Amazon Video, Google Play Movies, YouTube, Vudu, Microsoft Store, Spectrum On Demand ","Legendary Pictures, Green Hat Films, Warner Bros. Pictures",https://www.warnerbros.com/movies/hangover
Universal Soldier: Regeneration,97,English,"When terrorists threaten nuclear catastrophe at Chernobyl, the world's only hope is to reactivate decommissioned Universal Soldier Luc Deveraux. Rearmed and reprogrammed, Deveraux must take on his nemesis from the original Universal Soldier and a next-generation ""UniSol"" that seems almost unstoppable.",2009,"Adventure, Action, Science Fiction, Thriller","hostage, dynamite, superhuman, super soldier, terrorism, massacre, super strength","Mike Pyle, Dolph Lundgren, Jean-Claude Van Damme, Corey Johnson, Andrei Arlovski",John Hyams,fuboTV ,"Apple TV, Amazon Video, Google Play Movies, YouTube, Vudu ","Apple TV, Amazon Video, Google Play Movies, YouTube, Vudu ","Foresight Unlimited, Signature Entertainment, Baumgarten Management and Productions (BMP), Unisol 3 Distribution",Unknown
Thick as Thieves,104,English,A master thief recruits a notorious thief to help him steal two famous Faberge eggs from an impenetrable vault in an effort to pull off one final job and repay his debt to the Russian mob.,2009,"Action, Thriller, Crime","boardwalk, police investigation, woman director","Antonio Banderas, Radha Mitchell, Robert Forster, Morgan Freeman, Rade Šerbedžija",Mimi Leder,"Amazon Prime Video, Hulu ",Amazon Video ,Amazon Video ,"Equity Pictures Medienfonds GmbH & Co. KG IV, Revelations Entertainment, EFO Films, Millennium Media, Nu Image, Grosvenor Park Media",Unknown
Saw VI,90,English,"Special Agent Strahm is dead, and Detective Hoffman has emerged as the unchallenged successor to Jigsaw's legacy. However, when the FBI draws closer to Hoffman, he is forced to set a game into motion, and Jigsaw's grand scheme is finally understood.",2009,"Horror, Thriller","sacrifice, sadism, fbi, apprentice, murder, torture, killer, agent, death, survival horror, death match, aftercreditsstinger, mind game, healthcare, death game, foreboding","Tobin Bell, Mark Rolston, Costas Mandylor, Shawnee Smith, Betsy Russell",Kevin Greutert,Starz Apple TV Channel ,"Apple TV, Amazon Video, Google Play Movies, YouTube, Vudu, Microsoft Store, AMC on Demand ","Apple TV, Amazon Video, Google Play Movies, YouTube, Vudu, Microsoft Store ","Lionsgate, Twisted Pictures, Mandate Pictures",http://www.saw6film.com/
Blood and Bone,93,English,"In Los Angeles, an ex-con takes the underground fighting world by storm in his quest to fulfill a promise to a dead friend.",2009,"Action, Drama, Thriller","fight, tournament, kick, prison fight","Julian Sands, Dante Basco, Eamonn Walker, Nona Gaye, Michael Jai White",Ben Ramsey,Netflix ,"Apple TV, Amazon Video, Google Play Movies, YouTube, Vudu, Microsoft Store ","Apple TV, Amazon Video, Google Play Movies, YouTube, Vudu, Microsoft Store ","Remarkable Films, Michael Mailer Films",http://www.bloodandbonemovie.com
The Princess and the Frog,98,English,"A waitress, desperate to fulfill her dreams as a restaurant owner, is set on a journey to turn a frog prince back into a human being, but she has to face the same problem after she kisses him.",2009,"Animation, Romance, Fantasy","princess, voodoo, new orleans, louisiana, restaurant, kiss, cajun, firefly, based on fairy tale, duringcreditsstinger, big dreams, frog prince, charlatan, 1920s, magic spell","Keith David, Anika Noni Rose, Michael-Leon Wooley, Jim Cummings, Bruno Campos","John Musker, Ron Clements",Disney Plus ,"Apple TV, Amazon Video, Google Play Movies, YouTube, Vudu, Microsoft Store, AMC on Demand ","Apple TV, Amazon Video, Google Play Movies, YouTube, Vudu, Microsoft Store ","Walt Disney Pictures, Walt Disney Animation Studios",https://movies.disney.com/the-princess-and-the-frog
Orphan,122,English,"After losing their baby, a married couple adopt 9-year old Esther, who may not be as innocent as she seems.",2009,"Horror, Thriller, Mystery","nun, deaf-mute, orphan, troubled marriage, aftercreditsstinger, duringcreditsstinger","Peter Sarsgaard, Aryana Engineer, Isabelle Fuhrman, Vera Farmiga, CCH Pounder",Jaume Collet-Serra,"Max, Max Amazon Channel ","Apple TV, Amazon Video, Google Play Movies, YouTube, Vudu, Microsoft Store, AMC on Demand ","Apple TV, Amazon Video, Google Play Movies, YouTube, Vudu, Microsoft Store, Spectrum On Demand ","Warner Bros. Pictures, Dark Castle Entertainment, StudioCanal, Don Carmody Productions, Studio Babelsberg, Appian Way, Silver Pictures, Ontario Media Development Corporation",Unknown
