Title,Runtime (minutes),Language,Overview,Release Year,Genre,Keywords,Actors,Directors,Stream,Buy,Rent,Production Companies,Website
Mary and Max,92,English,"A tale of friendship between two unlikely pen pals: Mary, a lonely, eight-year-old girl living in the suburbs of Melbourne, and Max, a forty-four-year old, severely obese man living in New York.",2009,"Animation, Comedy, Drama","australia, chocolate, approach, letter, birthmark, only child, bullying, friendship bracelet, pen pals, atheist, loneliness, stop motion, neighbor, phone book, adult animation, unlikely friendship, correspondence, eating disorder, asperger's syndrome","Philip Seymour Hoffman, Bethany Whitmore, Eric Bana, Toni Collette, Barry Humphries",Adam Elliot,"AMC+ Amazon Channel, AMC+, IFC Films Unlimited Apple TV Channel ","Apple TV, Amazon Video, Google Play Movies, YouTube ","Apple TV, Amazon Video, Google Play Movies, YouTube ",Melodrama Pictures,http://www.maryandmax.com/
Triangle,98,English,"When Jess sets sail on a yacht with a group of friends, she cannot shake the feeling that there is something wrong.",2009,Horror,"florida, ship, ocean, key, yacht, autism, ghost ship, murder, purgatory, time loop, female protagonist, storm, single mother, axe murder, caribbean sea, sisyphus, abusive mother, ax","Emma Lung, Michael Dorman, Liam Hemsworth, Rachael Carpani, Melissa George",Christopher Smith,"Amazon Prime Video, fuboTV, AMC Plus Apple TV Channel , AMC+ Amazon Channel, AMC+, Hoopla, Shudder Amazon Channel, Shudder Apple TV Channel ","Apple TV, Amazon Video, Google Play Movies, YouTube, Microsoft Store ","Apple TV, Amazon Video, Google Play Movies, YouTube, Microsoft Store ","Framestore, Icon Entertainment International, UK Film Council, Pacific Film and Television Commission, Dan Films, Pictures in Paradise",Unknown
The Men Who Stare at Goats,94,English,"A reporter in Iraq might just have the story of a lifetime when he meets Lyn Cassady, a guy who claims to be a former member of the U.S. Army's New Earth Army, a unit that employs paranormal powers in their missions.",2009,"Comedy, War","vietnam veteran, kuwait, new age, paranoid fantasy, hippie lifestyle, drug use","George Clooney, Robert Patrick, Kevin Spacey, Ewan McGregor, Jeff Bridges",Grant Heslov,,"Apple TV, Amazon Video, Google Play Movies, YouTube, Vudu, Microsoft Store, AMC on Demand ","Apple TV, Amazon Video, Google Play Movies, YouTube, Vudu, Microsoft Store ","Ruby Films, BBC Film, Smoke House Pictures, Overture Films, UK Film Council, Mandate International",http://www.themenwhostareatgoatsmovie.com/
The Human Centipede (First Sequence),92,English,"During a stopover in Germany in the middle of a carefree road trip through Europe, two American girls find themselves alone at night when their car breaks down in the woods. Searching for help at a nearby villa, they are wooed into the clutches of a deranged retired surgeon who explains his mad scientific vision to his captives' utter horror. They are to be the subjects of his sick lifetime fantasy: to be the first to connect people, one to the next, and in doing so bring to life ""the human centipede.""",2009,Horror,"sadism, kidnapping, exploitation, surgeon, body mutilation, police officer, psychosis, coprophilia, scalpel, equestrian, torture porn, coprophagia, anesthesia, intravenous, misanthrope, shock value","Ashley C. Williams, Akihiro Kitamura, Andreas Leupold, Dieter Laser, Ashlynn Yennie",Tom Six,"AMC+ Amazon Channel, AMC+, IFC Films Unlimited Apple TV Channel ","Apple TV, Amazon Video, Google Play Movies, YouTube, Vudu ","Apple TV, Amazon Video, Google Play Movies, YouTube, Vudu, Microsoft Store ",Six Entertainment,Unknown
Barbie and the Three Musketeers,81,English,"Corinne (Barbie) is a young country girl who heads to Paris to pursue her big dream – to become a female musketeer! Never could she imagine she would meet three other girls who secretly share the same dream! Using their special talents, the girls work together as a team to foil a plot and save the prince. It's all for one and one for all!",2009,"Animation, Family","based on toy, musketeer","Kira Tozer, Kelly Sheridan, Tim Curry, Dorla Bell, Willow Johnson",William Lau,,"Apple TV, Amazon Video, Google Play Movies, YouTube, Vudu, Microsoft Store ","Apple TV, Amazon Video, Google Play Movies, YouTube, Vudu, Microsoft Store ","Rainmaker Entertainment, Mattel",http://barbie.everythinggirl.com/activities/fantasy/princess/musketeers/
Pandorum,108,English,"Two crew members wake up on an abandoned spacecraft with no idea who they are, how long they've been asleep, or what their mission is. The two soon discover they're actually not alone – and the reality of their situation is more horrifying than they could have imagined.",2009,"Action, Horror, Mystery, Science Fiction, Thriller","spacecraft, mission, mutation, dystopia, survival, creature, pandorum","Cam Gigandet, Antje Traue, Dennis Quaid, Cung Le, Ben Foster",Christian Alvart,"fuboTV, USA Network ","Apple TV, Amazon Video, Google Play Movies, YouTube, Vudu, Microsoft Store ","Apple TV, Amazon Video, Google Play Movies, YouTube, Vudu, Microsoft Store ","Impact Pictures, Studio Babelsberg, Summit Entertainment, Constantin Film, Overture Films, FFA, FFF Bayern, Deutscher Filmförderfonds",http://www.pandorummovie.com/
The Twilight Saga: New Moon,131,English,"Forks, Washington resident Bella Swan is reeling from the departure of her vampire love, Edward Cullen, and finds comfort in her friendship with Jacob Black, a werewolf. But before she knows it, she's thrust into a centuries-old conflict, and her desire to be with Edward at any cost leads her to take greater and greater risks.",2009,"Adventure, Fantasy, Drama, Romance","moon, based on novel or book, vampire, teen movie, werewolf, interspecies romance, based on young adult novel, supernatural power, good versus evil, vampire human love","Taylor Lautner, Robert Pattinson, Dakota Fanning, Michael Sheen, Kristen Stewart",Chris Weitz,"Hulu, Starz Apple TV Channel ","Apple TV, Amazon Video, Google Play Movies, YouTube, Vudu, Microsoft Store, AMC on Demand ","Apple TV, Amazon Video, Google Play Movies, YouTube, Vudu, Microsoft Store, Spectrum On Demand ","Summit Entertainment, Temple Hill Entertainment, Maverick Films, Imprint Entertainment, Sunswept Entertainment",Unknown
The Blind Side,129,English,"The story of Michael Oher, a homeless and traumatized boy who became an All American football player and first round NFL draft pick with the help of a caring woman and her family.",2009,Drama,"sports, american football, adoption, private school, education, based on true story, memphis, tennessee, duringcreditsstinger, christian, high school football","Tim McGraw, Lily Collins, Quinton Aaron, Jae Head, Sandra Bullock",John Lee Hancock,,"Apple TV, Amazon Video, Google Play Movies, YouTube, Vudu, Microsoft Store, AMC on Demand ","Apple TV, Amazon Video, Google Play Movies, YouTube, Vudu, Microsoft Store, Spectrum On Demand ","Alcon Entertainment, Netter Productions",http://www.theblindsidemovie.com/
Invictus,134,English,"Newly elected President Nelson Mandela knows his nation remains racially and economically divided in the wake of apartheid. Believing he can bring his people together through the universal language of sport, Mandela rallies South Africa's rugby team as they make their historic run to the 1995 Rugby World Cup Championship match.",2009,"Drama, History","sports, stadium, south africa, apartheid, idealism, nelson mandela, based on true story, idealist, rugby, president, racism, poverty, celebration, duringcreditsstinger, 1990s, fighting the system","Patrick Mofokeng, Tony Kgoroge, Morgan Freeman, Matt Stern, Matt Damon",Clint Eastwood,,"Apple TV, Amazon Video, Google Play Movies, YouTube, Vudu, Microsoft Store, AMC on Demand ","Apple TV, Amazon Video, Google Play Movies, YouTube, Vudu, Microsoft Store ","Warner Bros. Pictures, Spyglass Entertainment, Revelations Entertainment, Malpaso Productions, Liberty Pictures",http://invictusmovie.warnerbros.com
Sherlock Holmes,129,English,Eccentric consulting detective Sherlock Holmes and Doctor John Watson battle to bring down a new nemesis and unravel a deadly plot that could destroy England.,2009,"Action, Adventure, Crime, Mystery","london, england, based on novel or book, detective, scotland yard, coffin, pentagram, black magic, arrest, partner, murder, serial killer, steampunk, whodunit, buddy, clue, observation, 19th century, sherlock, victorian era, sherlock holmes, sherlock films, mystery","Rachel McAdams, Jude Law, Mark Strong, Eddie Marsan, Robert Downey Jr.",Guy Ritchie,,"Apple TV, Amazon Video, Google Play Movies, YouTube, Vudu, Microsoft Store, AMC on Demand ","Apple TV, Amazon Video, Google Play Movies, YouTube, Vudu, Microsoft Store ","Warner Bros. Pictures, Village Roadshow Pictures, Silver Pictures, Wigram Productions, Internationale Filmproduktion Blackbird Dritte",https://www.warnerbros.com/movies/sherlock-holmes/
Anacondas: Trail of Blood,89,English,"A genetically created Anaconda, cut in half, regenerates itself into two new aggressive giant snakes, due to the Blood Orchid.",2009,"Horror, Fantasy, Action, Adventure, TV Movie","experiment, human vs nature, snake, predator, woods, creature, scientist, anaconda, killer snake, dangerous mission, regeneration, invasive species, animal horror, species, hunters vs hunter","Ana Ularu, Calin Stanciu, Danny Midwinter, Crystal Allen, Linden Ashby",Don E. FauntLeRoy,,"Apple TV, Amazon Video, Google Play Movies, YouTube, Vudu, Microsoft Store ","Apple TV, Amazon Video, Google Play Movies, YouTube, Vudu, Microsoft Store ","Stage 6 Films, Hollywood Media Bridge, Castel Film, Syfy, Castel Film (US)",Unknown
Land of the Lost,102,English,"On his latest expedition, Dr. Rick Marshall is sucked into a space-time vortex alongside his research assistant and a redneck survivalist. In this alternate universe, the trio make friends with a primate named Chaka, their only ally in a world full of dinosaurs and other fantastic creatures.",2009,"Adventure, Comedy, Science Fiction","assistant, paleontologist, alien life-form, dinosaur, primate, duringcreditsstinger","John Boylan, Anna Friel, Danny McBride, Will Ferrell, Jorma Taccone",Brad Silberling,Amazon Prime Video ,"Apple TV, Amazon Video, Google Play Movies, YouTube, Vudu, Microsoft Store, AMC on Demand ","Apple TV, Amazon Video, Google Play Movies, YouTube, Vudu, Microsoft Store, Spectrum On Demand ","Universal Pictures, Relativity Media, Sid & Marty Krofft Pictures, Mosaic Media Group",Unknown
The Boondock Saints II: All Saints Day,118,English,"Skillfully framed by an unknown enemy for the murder of a priest, wanted vigilante MacManus brothers Murphy and Connor must come out of hiding on a sheep farm in Ireland to fight for justice in Boston.",2009,"Action, Thriller, Crime","friendship, sheep, boston, massachusetts, sequel, revenge, ireland","Clifton Collins Jr., Norman Reedus, Billy Connolly, Sean Patrick Flanery, Julie Benz",Troy Duffy,,"Apple TV, Amazon Video, Google Play Movies, YouTube, Vudu, Microsoft Store, AMC on Demand ","Apple TV, Amazon Video, Google Play Movies, YouTube, Microsoft Store ","Stage 6 Films, Chris Brinker Productions",http://www.sonypictures.com/movies/boondocksaints2/
Zombieland,88,English,"Columbus has made a habit of running from what scares him. Tallahassee doesn't have fears. If he did, he'd kick their ever-living ass. In a world overrun by zombies, these two are perfectly evolved survivors. But now, they're about to stare down the most terrifying prospect of all: each other.",2009,"Comedy, Horror","washington dc, usa, sibling relationship, circus, post-apocalyptic future, blood splatter, gore, parody, road trip, zombie, survival horror, amusement park, twinkie, body count, zombification, disposing of a dead body, loner, aftercreditsstinger, zombie apocalypse, fear of clowns, actor playing themself","Woody Harrelson, Emma Stone, Abigail Breslin, Jesse Eisenberg, Amber Heard",Ruben Fleischer,Apple TV Plus ,"Apple TV, Amazon Video, Google Play Movies, YouTube, Vudu, Microsoft Store, AMC on Demand ","Apple TV, Amazon Video, Google Play Movies, YouTube, Vudu, Microsoft Store, Spectrum On Demand ","Pariah, Columbia Pictures, Relativity Media",https://www.sonypictures.com/movies/zombieland
Underworld: Rise of the Lycans,92,English,"A prequel to the first two Underworld films, this fantasy explains the origins of the feud between the Vampires and the Lycans. Aided by his secret love, Sonja, courageous Lucian leads the Lycans in battle against brutal Vampire king Viktor. Determined to break the king's enslavement of his people, Lucian faces off against the Death Dealer army in a bid for Lycan independence.",2009,"Fantasy, Action, Thriller","prison, vampire, slavery, castle, forbidden love, werewolf, battle, slave, fictional war, gothic, dungeon, dark fantasy, aristocracy, urban gothic","Steven Mackintosh, Shane Brolly, Bill Nighy, Michael Sheen, Rhona Mitra",Patrick Tatopoulos,AMC+ ,"Apple TV, Amazon Video, Google Play Movies, YouTube, Vudu, Microsoft Store, AMC on Demand ","Apple TV, Amazon Video, Google Play Movies, YouTube, Vudu, Microsoft Store ","Screen Gems, Lakeshore Entertainment, Sketch Films, UW3 Film Productions",https://www.sonypictures.com/movies/underworldriseofthelycans
Tidal Wave,120,Korean,"On Haeundae Beach, a guilt-ridden fisherman takes care of a woman whose father accidentally got killed. A scientist reunites with his ex-wife and a daughter who doesn't even remember his face. And a poor rescue worker falls in love with a rich city girl. When they all find out a gigantic tsunami will hit the beach, they realize they only have 10 minutes to escape.",2009,"Action, Drama, Thriller","helicopter, beach, loss of loved one, cigarette, giant wave, tsunami, family relationships, disaster, tears, single father, tearjerker, trapped in an elevator, tidal wave, disaster movie, busan, south korea, south korea","Ha Ji-won, Park Joong-hoon, Sol Kyung-gu, Lee Min-ki, Uhm Jung-hwa",JK Youn,Hoopla ,"Apple TV, Amazon Video, Google Play Movies, YouTube, Vudu ","Apple TV, Amazon Video, Google Play Movies, YouTube, Vudu ","Polygon Entertainment, CJ Entertainment, JK Film",Unknown
2012,158,English,"Dr. Adrian Helmsley, part of a worldwide geophysical team investigating the effect on the earth of radiation from unprecedented solar storms, learns that the earth's core is heating up. He warns U.S. President Thomas Wilson that the crust of the earth is becoming unstable and that without proper preparations for saving a fraction of the world's population, the entire race is doomed. Meanwhile, writer Jackson Curtis stumbles on the same information. While the world's leaders race to build ""arks"" to escape the impending cataclysm, Curtis struggles to find a way to save his family. Meanwhile, volcanic eruptions and earthquakes of unprecedented strength wreak havoc around the world.",2009,"Action, Adventure, Science Fiction","race against time, maya civilization, civilization, natural disaster, earthquake, end of the world, disaster, apocalypse, destruction, volcanic eruption, flood, disaster movie, ark, solar, 2010s","Thandiwe Newton, Amanda Peet, John Cusack, Chiwetel Ejiofor, Oliver Platt",Roland Emmerich,"Netflix, Netflix basic with Ads ","Apple TV, Amazon Video, Google Play Movies, YouTube, Vudu, Microsoft Store, AMC on Demand ","Apple TV, Amazon Video, Google Play Movies, YouTube, Vudu, Microsoft Store, Spectrum On Demand ","Columbia Pictures, Centropolis Entertainment, Farewell Productions, The Mark Gordon Company",http://www.sonypictures.com/movies/2012
Fantastic Mr. Fox,87,English,"The Fantastic Mr. Fox, bored with his current life, plans a heist against the three local farmers. The farmers, tired of sharing their chickens with the sly fox, seek revenge against him and his family.",2009,"Adventure, Animation, Comedy, Family","based on novel or book, tree, peasant, fox, cider, tale, farm life, anthropomorphism, revenge, stop motion","Eric Chase Anderson, George Clooney, Jason Schwartzman, Wallace Wolodarsky, Meryl Streep",Wes Anderson,"Max, Max Amazon Channel ","Apple TV, Amazon Video, Google Play Movies, YouTube, Vudu, Microsoft Store, AMC on Demand ","Apple TV, Amazon Video, Google Play Movies, YouTube, Vudu, Microsoft Store ","Regency Enterprises, Indian Paintbrush, American Empirical Pictures",http://www.foxsearchlight.com/fantasticmrfox
Couples Retreat,113,English,"Four couples, all friends, descend on a tropical island resort. Though one husband and wife are there to work on their marriage, the others just want to enjoy some fun in the sun. They soon find, however, that paradise comes at a price: Participation in couples therapy sessions is mandatory. What started out as a cut-rate vacation turns into an examination of the common problems many face.",2009,"Comedy, Romance","island, married couple, tahiti, couples therapy, love, beautiful woman, divorce, divorcee, tropical, aftercreditsstinger, duringcreditsstinger, french polynesia","Faizon Love, Vince Vaughn, Jon Favreau, Jason Bateman, Kristin Davis",Peter Billingsley,Amazon Prime Video ,"Apple TV, Amazon Video, Google Play Movies, YouTube, Vudu, Microsoft Store, AMC on Demand ","Apple TV, Amazon Video, Google Play Movies, YouTube, Vudu, Microsoft Store ","Stuber Pictures, Universal Pictures, Relativity Media, Wild West Picture Show Productions",Unknown
Barbie Presents: Thumbelina,75,English,"Meet a tiny girl named Thumbelina who lives in harmony with nature in the magical world of the Twillerbees that's hidden among the wildflowers. At the whim of a spoiled young girl named Makena, Thumbelina and her two friends have their patch of wildflowers uprooted and are transported to a lavish apartment in the city.",2009,"Animation, Family",based on toy,"Cathy Weseluck, Kelly Sheridan, Tabitha St. Germain, Anna Cummer, Kelly Metzger",Conrad Helten,,"Apple TV, Amazon Video, Google Play Movies, YouTube, Vudu, Microsoft Store ","Apple TV, Amazon Video, Google Play Movies, YouTube, Vudu, Microsoft Store ","Mattel, Rainmaker Entertainment",http://barbie.everythinggirl.com/thumbelina/
9,79,English,"When 9 first comes to life, he finds himself in a post-apocalyptic world. All humans are gone, and it is only by chance that he discovers a small community of others like him taking refuge from fearsome machines that roam the earth intent on their extinction. Despite being the neophyte of the group, 9 convinces the others that hiding will do them no good.",2009,"Action, Adventure, Animation, Science Fiction, Thriller","friendship, man vs machine, hope, dystopia, post-apocalyptic future, steampunk, coward, end of world, rag doll","Christopher Plummer, Jennifer Connelly, Elijah Wood, Crispin Glover, Martin Landau",Shane Acker,Max ,"Apple TV, Amazon Video, Google Play Movies, YouTube, Vudu, Microsoft Store ","Apple TV, Amazon Video, Google Play Movies, YouTube, Vudu, Microsoft Store ","Tim Burton Productions, Relativity Media, Arc Productions, Starz Animation, Focus Features",http://www.9themovie.com/
Antichrist,108,English,"A grieving couple retreats to their cabin 'Eden' in the woods, hoping to repair their broken hearts and troubled marriage. But nature takes its course and things go from bad to worse.",2009,"Drama, Horror, Thriller","depression, suffering, therapist, symbolism, marriage, masochism, controversy, woods, god, cabin, psychological thriller, torture, fear, cruelty, nature, masturbation, guilt, occult, grieving, motherhood","Willem Dafoe, Charlotte Gainsbourg, Storm Acheche Sahlstrøm",Lars von Trier,Criterion Channel ,"Google Play Movies, YouTube ","Google Play Movies, YouTube ","Zentropa Entertainments, DR, Trollhättan Film, Memfis Film, Lucky Red, ZDF, Slot Machine, Zentropa International Köln, Zentropa International Poland, ZDF/Arte, Liberator Productions, PISF, Svenska Filminstitutet, Canal+, ARTE France Cinéma, SVT, ARTE, Film i Väst, Deutscher Filmförderfonds, CNC, TrustNordisk",https://antichrstmovie.carrd.co/
District 13: Ultimatum,101,French,"Damien and Leito return to District 13 on a mission to bring peace to the troubled sector that is controlled by five different gang bosses, before the city’s secret services take drastic measures to solve the problem.",2009,"Action, Thriller, Crime","prison, martial arts, street gang, corruption, chase, ghetto, delinquency, parkour, sequel, prison escape, shootout, drug dealing, fighting, duringcreditsstinger, hand to hand combat","Cyril Raffaelli, Philippe Torreton, David Belle, Elodie Yung, Daniel Duval",Patrick Alessandrin,fuboTV ,"Apple TV, Amazon Video, Google Play Movies, YouTube, Vudu, Microsoft Store, FlixFling ","Apple TV, Amazon Video, Google Play Movies, YouTube, Vudu, Microsoft Store, FlixFling ","CinéCinéma, TF1 International, Sofica EuropaCorp, EuropaCorp, Canal+, CiBy 2000",http://www.b13ultimatum-lefilm.com/
"Sex, Party and Lies",107,Spanish,"A youth group is preparing for what will be the summer of their life, including secrets, lies, sex, confusion, evenings and holidays.",2009,"Comedy, Drama","spain, alcohol, sexuality, college, flashback, summer, drugs, lgbt","Ana Polvorosa, Hugo Silva, Ana de Armas, Yon González, Mario Casas","Alfonso Albacete, David Menkes",,"Apple TV, Google Play Movies, YouTube ","Apple TV, Google Play Movies, YouTube ","Tornasol Films, Agrupación de Cine 001 AIE, Castafiore Films",Unknown
Hachi: A Dog's Tale,93,English,A drama based on the true story of a college professor's bond with the abandoned dog he takes into his home.,2009,"Drama, Family","friendship, loyalty, pet, human animal relationship, family relationships, friends, dog, newspaper reporter, family dog, waiting, pets","Joan Allen, Sarah Roemer, Erick Avari, Cary-Hiroyuki Tagawa, Richard Gere",Lasse Hallström,fuboTV ,"Apple TV, Amazon Video, Google Play Movies, YouTube, Vudu, Microsoft Store ","Apple TV, Amazon Video, Google Play Movies, YouTube, Vudu, Microsoft Store, Spectrum On Demand ","Scion Films, Stage 6 Films, Inferno Distribution, Hachiko, Grand Army Entertainment, Opperman Viner Chrystyn Entertainment",Unknown
Where the Wild Things Are,101,English,"Max imagines running away from his mom and sailing to a far-off land where large talking beasts—Ira, Carol, Douglas, the Bull, Judith and Alexander—crown him as their king, play rumpus, build forts and discover secret hideaways.",2009,"Family, Fantasy, Drama, Adventure","creature, based on children's book, children's book, lying, overflowing with imagination, children's perspectives, maurice sendak","Max Records, Lauren Ambrose, Catherine Keener, James Gandolfini, Catherine O'Hara",Spike Jonze,,"Apple TV, Amazon Video, Google Play Movies, YouTube, Vudu, Microsoft Store, AMC on Demand ","Apple TV, Amazon Video, Google Play Movies, YouTube, Vudu, Microsoft Store, Spectrum On Demand ","Warner Bros. Pictures, Legendary Pictures, Village Roadshow Pictures, Playtone, Wild Things Productions, KLG Film Invest",http://wherethewildthingsare.warnerbros.com
Brothers,105,English,"When his helicopter goes down during his fourth tour of duty in Afghanistan, Marine Sam Cahill is presumed dead. Back home, brother Tommy steps in to look over Sam’s wife, Grace, and two children. Sam’s surprise homecoming triggers domestic mayhem.",2009,"Drama, Thriller, War","sibling relationship, loss of loved one, brother-in-law, afghanistan war (2001- ), remake, sister-in-law, wistful","Natalie Portman, Sam Shepard, Tobey Maguire, Jake Gyllenhaal, Mare Winningham",Jim Sheridan,"fuboTV, Starz Apple TV Channel ","Apple TV, Amazon Video, Google Play Movies, YouTube, Vudu, Microsoft Store ","Apple TV, Amazon Video, Google Play Movies, YouTube, Vudu, Microsoft Store ","Lionsgate, Relativity Media, Sighvatsson Films, Michael De Luca Productions, Palomar Pictures, Mandate International",Unknown
Law Abiding Citizen,109,English,A frustrated man decides to take justice into his own hands after a plea bargain sets one of his family's killers free. He targets not only the killer but also the district attorney and others involved in the deal.,2009,"Drama, Crime, Thriller","prison, assassin, philadelphia, pennsylvania, bomb, secret passage, deal, investigation, explosion, justice, criminal mastermind, district attorney, courtroom, rape and revenge, vigilantism, vigilante justice","Jamie Foxx, Gerard Butler, Colm Meaney, Bruce McGill, Leslie Bibb",F. Gary Gray,Peacock Premium ,"Apple TV, Amazon Video, Google Play Movies, YouTube, Vudu, Microsoft Store, AMC on Demand ","Apple TV, Amazon Video, Google Play Movies, YouTube, Vudu, Microsoft Store ","The Film Department, Evil Twins, Warp Films, G-BASE, Overture Films, Mandate International",Unknown
The Descent: Part 2,94,English,"Distraught, confused, and half-wild with fear, Sarah Carter emerges alone from the Appalachian cave system where she encountered unspeakable terrors. Unable to plausibly explain to the authorities what happened - or why she's covered in her friends' blood - Sarah is forced back to the subterranean depths to help locate her five missing companions.",2009,"Adventure, Horror, Thriller","cave, claustrophobia, cowardliness, rescue team, sole survivor","Shauna Macdonald, Anna Skellern, Gavan O'Herlihy, Natalie Mendoza, Josh Dallas",Jon Harris,,"Apple TV, Amazon Video, Google Play Movies, YouTube, Vudu, Microsoft Store ","Apple TV, Amazon Video, Google Play Movies, YouTube, Vudu, Microsoft Store ",Celador Films,Unknown
