Title,Runtime (minutes),Language,Overview,Release Year,Genre,Keywords,Actors,Directors,Stream,Buy,Rent,Production Companies,Website
The Lighthouse,109,English,Two lighthouse keepers try to maintain their sanity while living on a remote and mysterious New England island in the 1890s.,2019,"Drama, Fantasy, Thriller","island, nightmare, isolation, mermaid, hallucination, lighthouse, lighthouse keeper   , gay interest, storm, male masturbation, new england, madness, drunkenness, 19th century, isolated island, one location, two-hander","Robert Pattinson, Logan Hawkes, Willem Dafoe, Kyla Nicolle, Valeriia Karaman",Robert Eggers,Showtime Apple TV Channel ,"Apple TV, Amazon Video, Google Play Movies, YouTube, Vudu, Microsoft Store ","Apple TV, Amazon Video, Google Play Movies, YouTube, Vudu, Microsoft Store ","RT Features, New Regency Pictures, Parts & Labor, Maiden Voyage Pictures",https://a24films.com/films/the-lighthouse
Jexi,84,English,"Phil's new phone comes with an unexpected feature, Jexi...an A.I. determined to keep him all to herself in a comedy about what can happen when you love your phone more than all else.",2019,Comedy,"artificial intelligence (a.i.), san francisco, california, technology, romance, cell phone","Adam Devine, Ron Funches, Alexandra Shipp, Charlyne Yi, Rose Byrne","Scott Moore, Jon Lucas",,"Apple TV, Amazon Video, Google Play Movies, YouTube, Vudu, Microsoft Store, AMC on Demand ","Apple TV, Amazon Video, Google Play Movies, YouTube, Vudu, Microsoft Store ","CBS Films, Team Todd, Sierra/Affinity, Lionsgate, Jexi Studios, Entertainment One",https://www.lionsgate.com/movies/jexi
The Wandering Earth,126,Chinese,"When the Sun begins to expand in such a way that it will inevitably engulf and destroy the Earth in a hundred years, united mankind finds a way to avoid extinction by propelling the planet out of the Solar System using gigantic engines, moving it to a new home located four light years away, an epic journey that will last thousands of years.",2019,"Science Fiction, Action, Drama","jupiter, based on novel or book, space station, mankind forced underground, underground city, father son relationship, brother sister relationship, grandfather grandson relationship, frozen earth, dying sun, giant engine, global government","Zhao Jinmai, Li Guangjie, Wu Jing, Qu Chuxiao, Ng Man-tat",Frant Gwo,"Netflix, Netflix basic with Ads ",,,"China Film Group Corporation, Beijing Jingxi Culture, DF Pictures, G!Film Studio, Free Whale Pictures",Unknown
Zombieland: Double Tap,99,English,"Columbus, Tallahassee, Wichita, and Little Rock move to the American heartland as they face off against evolved zombies, fellow survivors, and the growing pains of the snarky makeshift family.",2019,"Comedy, Horror","marriage proposal, the white house, gore, road trip, sequel, survival, spoof, zombie, recreational vehicle, aftercreditsstinger, graceland, minivan, christmas present","Woody Harrelson, Emma Stone, Abigail Breslin, Zoey Deutch, Jesse Eisenberg",Ruben Fleischer,"Hulu, fuboTV, Starz Apple TV Channel, FXNow ","Apple TV, Amazon Video, Google Play Movies, YouTube, Vudu, Microsoft Store, AMC on Demand ","Apple TV, Amazon Video, Google Play Movies, YouTube, Vudu, Microsoft Store, Spectrum On Demand ","Pariah, Columbia Pictures, 2.0 Entertainment",https://www.zombieland.com/
Polaroid,88,English,"High school loner Bird Fitcher has no idea what dark secrets are tied to the mysterious Polaroid vintage camera she stumbles upon, but it doesn't take long to discover that those who have their picture taken meet a tragic end. Bird and her friends must survive one more night as they race to solve the mystery of the haunted Polaroid before it kills them all.",2019,"Horror, Thriller, Mystery","high school, 1970s, camera, undead, antique, polaroid, polaroid camera, haunted","Tyler Young, Kathryn Prescott, Keenan Tracey, Priscilla Quintana, Samantha Logan",Lars Klevberg,"Amazon Prime Video, Hulu ","Apple TV, Amazon Video, Google Play Movies, YouTube, Vudu, Microsoft Store ","Apple TV, Amazon Video, Google Play Movies, YouTube, Vudu, Microsoft Store ","Dimension Films, The Weinstein Company, Eldorado Films, Vertigo Entertainment, Good Fear",Unknown
Maleficent: Mistress of Evil,119,English,"Maleficent and her goddaughter Aurora begin to question the complex family ties that bind them as they are pulled in different directions by impending nuptials, unexpected allies, and dark new forces at play.",2019,"Family, Fantasy, Adventure, Action","magic, fairy tale, fairy, villain, sequel, live action remake","Elle Fanning, Angelina Jolie, Sam Riley, Harris Dickinson, Michelle Pfeiffer",Joachim Rønning,Disney Plus ,"Apple TV, Amazon Video, Google Play Movies, YouTube, Vudu, Microsoft Store, AMC on Demand ","Apple TV, Amazon Video, Google Play Movies, YouTube, Microsoft Store, Spectrum On Demand ","Walt Disney Pictures, Roth Films",https://movies.disney.com/maleficent-mistress-of-evil
Descendants 3,106,English,The teenagers of Disney's most infamous villains return to the Isle of the Lost to recruit a new batch of villainous offspring to join them at Auradon Prep.,2019,"Family, TV Movie, Adventure, Fantasy","magic, musical, family","Cameron Boyce, Sofia Carson, Dove Cameron, Booboo Stewart, Mitchell Hope",Kenny Ortega,"Disney Plus, fuboTV, Hoopla ","Amazon Video, Google Play Movies, YouTube, Vudu ",,Walt Disney Television,Unknown
"The Gangster, the Cop, the Devil",110,Korean,"After barely surviving a violent attack by an elusive serial killer, crime boss Jang Dong-su finds himself forming an unlikely partnership with local detective Jung Tae-seok to catch the sadistic killer simply known as K.",2019,"Crime, Action, Thriller","police, gangster, based on true story, serial killer, gang","Ma Dong-seok, Kim Moo-yul, Yoo Jae-myung, Kim Sung-kyu, Heo Dong-won",Lee Won-tae,"fuboTV, Kocowa, Rakuten Viki, Hi-YAH ","Apple TV, Amazon Video, Google Play Movies, YouTube, Vudu, Microsoft Store, AMC on Demand ","Apple TV, Amazon Video, Google Play Movies, YouTube, Vudu, Microsoft Store ","Acemaker Movieworks, BA Entertainment, Kiwi Media Group, B&C CONTENT",Unknown
Demon Slayer: Kimetsu no Yaiba Sibling's Bond,105,Japanese,"Tanjiro finds his family slaughtered and the lone survivor, his sister Nezuko Kamado, turned into a Demon. To his surprise, however, Nezuko still shows signs of human emotion and thought. Thus begins Tanjiro's journey to seek out the Demon who killed their family and turn his sister human again. A recap film of Kimetsu no Yaiba, covering episodes 1-5 with extra footage.",2019,"Action, Animation, Fantasy","edited from tv series, anime","Takahiro Sakurai, Yuki Kaji, Hochu Otsuka, Natsuki Hanae, Akari Kito",Haruo Sotozaki,,,,ufotable,Unknown
Dark Phoenix,114,English,"The X-Men face their most formidable and powerful foe when one of their own, Jean Grey, starts to spiral out of control. During a rescue mission in outer space, Jean is nearly killed when she's hit by a mysterious cosmic force. Once she returns home, this force not only makes her infinitely more powerful, but far more unstable. The X-Men must now band together to save her soul and battle aliens that want to use Grey's new abilities to rule the galaxy.",2019,"Science Fiction, Action, Adventure","superhero, mutant, telekinesis, based on comic, superhero team, 1990s, cosmic","Tye Sheridan, Michael Fassbender, Nicholas Hoult, James McAvoy, Sophie Turner",Simon Kinberg,"Disney Plus, fuboTV ","Apple TV, Amazon Video, Google Play Movies, YouTube, Vudu, Microsoft Store, AMC on Demand ","Apple TV, Amazon Video, Google Play Movies, YouTube, Vudu, Microsoft Store ","Genre Films, Hutch Parker Entertainment, 20th Century Fox, TSG Entertainment, Marvel Entertainment",https://www.20thcenturystudios.com/movies/dark-phoenix
The Addams Family,86,English,"The Addams family's lives begin to unravel when they face-off against a treacherous, greedy crafty reality-TV host while also preparing for their extended family to arrive for a major celebration.",2019,"Family, Animation, Comedy, Fantasy","cartoon, black humor, family, addams family","Charlize Theron, Nick Kroll, Finn Wolfhard, Oscar Isaac, Chloë Grace Moretz","Greg Tiernan, Conrad Vernon","Paramount Plus, Paramount Plus Apple TV Channel , Paramount+ Amazon Channel, Paramount+ Roku Premium Channel ","Apple TV, Amazon Video, Google Play Movies, YouTube, Vudu, Microsoft Store, AMC on Demand ","Apple TV, Amazon Video, Google Play Movies, YouTube, Vudu, Microsoft Store ","Cinesite Animation, Nitrogen Studios Canada, Bron Studios, Metro-Goldwyn-Mayer",https://www.addamsfamily.movie/
Aquaman: Heroines of Atlantis,6,English,Amber Heard and Nicole Kidman discuss their characters Mera and Atlanna.,2019,Documentary,behind the scenes,"Amber Heard, James Wan, Temuera Morrison, Nicole Kidman",Angela King,,,,,Unknown
Joker,122,English,"During the 1980s, a failed stand-up comedian is driven insane and turns to a life of crime and chaos in Gotham City while becoming an infamous psychopathic crime figure.",2019,"Crime, Thriller, Drama","dream, street gang, society, psychopath, clown, villain, based on comic, murder, psychological thriller, criminal mastermind, mental illness, anarchy, character study, clown makeup, subway train, social realism, supervillain, tv host, 1980s, mother son relationship, origin story, falling into madness","Joaquin Phoenix, Zazie Beetz, Frances Conroy, Brett Cullen, Robert De Niro",Todd Phillips,"Netflix, Max, Max Amazon Channel, Netflix basic with Ads ","Apple TV, Amazon Video, Google Play Movies, YouTube, Vudu, Microsoft Store, AMC on Demand ","Apple TV, Amazon Video, Google Play Movies, YouTube, Vudu, Microsoft Store, Spectrum On Demand ","Warner Bros. Pictures, Joint Effort, Village Roadshow Pictures, Bron Studios, DC Films",http://www.jokermovie.net/
The Pilgrim's Progress,108,English,"An epic journey, faithfully adapted to modern-day. Christian faces distractions, challenges, and perils at every turn of the way. But ends victorious, with helpful guides, as he stays on the narrow path to the distant Celestial City.",2019,"Animation, Adventure",None,"David Thorpe, John Rhys-Davies, Tristan Beint, Justin Butcher, Kristyn Getty",Robert Fernandez,"Amazon Prime Video, Hoopla, Pure Flix ","Apple TV, Amazon Video ",Amazon Video ,"Cat In The Mill Studio, Herald Entertainment",https://www.pilgrims.movie/
4x4,87,Spanish,"Buenos Aires, Argentina. A luxurious van is parked on the sidewalk. A man enters with the purpose of stealing whatever he can find, but when he wants to leave, he cannot. The doors do not open, the control panel does not respond: the van has become an armored box and he is trapped like a mouse.",2019,Thriller,None,"Noelia Castaño, Valeria Mitidieri, Dady Brieva, Luis Brandoni, Peter Lanzani",Mariano Cohn,"Amazon Prime Video, Screambox Amazon Channel ","Apple TV, Amazon Video, Google Play Movies, YouTube, Vudu, Redbox ","Apple TV, Amazon Video, Google Play Movies, YouTube, Vudu, Redbox, Spectrum On Demand ","Mediapro, Televisión Abierta",https://www.latidofilms.com/film/4x4
Jojo Rabbit,108,English,"A World War II satire that follows a lonely German boy whose world view is turned upside down when he discovers his single mother is hiding a young Jewish girl in their attic. Aided only by his idiotic imaginary friend, Adolf Hitler, Jojo must confront his blind nationalism.",2019,"Comedy, War, Drama","based on novel or book, world war ii, jew persecution, satire, imaginary friend, hitler youth, gay interest, single mother, nazism, 1940s, child protagonist, adolf hitler, children in wartime","Scarlett Johansson, Taika Waititi, Sam Rockwell, Thomasin McKenzie, Roman Griffin Davis",Taika Waititi,fuboTV ,"Apple TV, Amazon Video, Google Play Movies, YouTube, Vudu, Microsoft Store, AMC on Demand ","Apple TV, Amazon Video, Google Play Movies, YouTube, Vudu, Microsoft Store ","Fox Searchlight Pictures, Defender Films, Piki Films, TSG Entertainment, Czech Anglo Productions",http://www.foxsearchlight.com/jojorabbit
Shazam!,132,English,A boy is given the ability to become an adult superhero in times of need with a single magic word.,2019,"Action, Comedy, Fantasy","philadelphia, pennsylvania, magic, secret identity, superhero, based on comic, wizard, superhuman strength, aftercreditsstinger, duringcreditsstinger, christmas, dc extended universe (dceu), flossing","Jack Dylan Grazer, Mark Strong, Zachary Levi, Asher Angel, Adam Brody",David F. Sandberg,"Netflix, Max, Max Amazon Channel, Netflix basic with Ads ","Apple TV, Amazon Video, Google Play Movies, YouTube, Vudu, Microsoft Store, AMC on Demand ","Apple TV, Amazon Video, Google Play Movies, YouTube, Vudu, Microsoft Store ","New Line Cinema, The Safran Company, Seven Bucks Productions, DC Films",http://www.shazammovie.com
Knives Out,131,English,"When renowned crime novelist Harlan Thrombey is found dead at his estate just after his 85th birthday, the inquisitive and debonair Detective Benoit Blanc is mysteriously enlisted to investigate. From Harlan's dysfunctional family to his devoted staff, Blanc sifts through a web of red herrings and self-serving lies to uncover the truth behind Harlan's untimely death.",2019,"Comedy, Crime, Mystery","immigrant, detective, massachusetts, investigation, big family, mansion, whodunit, family home, murder mystery, neo-noir, privilege","Michael Shannon, Jamie Lee Curtis, Chris Evans, Ana de Armas, Daniel Craig",Rian Johnson,AMC+ ,"Apple TV, Amazon Video, Google Play Movies, YouTube, Vudu, Microsoft Store, AMC on Demand ","Apple TV, Amazon Video, Google Play Movies, YouTube, Vudu, Microsoft Store ","Lionsgate, MRC, T-Street",https://www.lionsgate.com/movies/knives-out
The Secret Life of Pets 2,86,English,"Max the terrier must cope with some major life changes when his owner gets married and has a baby. When the family takes a trip to the countryside, nervous Max has numerous run-ins with canine-intolerant cows, hostile foxes and a scary turkey. Luckily for Max, he soon catches a break when he meets Rooster, a gruff farm dog who tries to cure the lovable pooch of his neuroses.",2019,"Adventure, Animation, Comedy, Family","new york city, friendship, sequel","Jenny Slate, Tiffany Haddish, Patton Oswalt, Eric Stonestreet, Kevin Hart",Chris Renaud,,"Apple TV, Amazon Video, Google Play Movies, YouTube, Vudu, Microsoft Store, AMC on Demand ","Apple TV, Amazon Video, Google Play Movies, YouTube, Vudu, Microsoft Store, Spectrum On Demand ","Universal Pictures, Illumination",http://www.thesecretlifeofpets.com
The Hustle,94,English,"Two female scam artists, one low rent and the other high class, compete to swindle a naïve tech prodigy out of his fortune. A remake of the 1988 comedy ""Dirty Rotten Scoundrels.""",2019,"Comedy, Crime","bet, competition, con artist, remake, aftercreditsstinger, con woman","Ingrid Oliver, Hannah Waddingham, Rebel Wilson, Alex Sharp, Anne Hathaway",Chris Addison,Amazon Prime Video ,"Apple TV, Amazon Video, Google Play Movies, YouTube, Vudu, Microsoft Store, AMC on Demand ","Apple TV, Amazon Video, Google Play Movies, YouTube, Vudu, Microsoft Store ","Pin High, Metro-Goldwyn-Mayer, Cave 76 Productions, Camp Sugar",https://www.thehustle.movie/
John Wick: Chapter 3 - Parabellum,131,English,"Super-assassin John Wick returns with a $14 million price tag on his head and an army of bounty-hunting killers on his trail. After killing a member of the shadowy international assassin’s guild, the High Table, John Wick is excommunicado, but the world’s most ruthless hit men and women await his every turn.",2019,"Action, Thriller, Crime","new york city, martial arts, bratva (russian mafia), casablanca, morocco, secret society, morocco, secret organization, black humor, sahara desert, sequel, organized crime, one man army, consequences, professional assassin, baba yaga, dog man friendship, intense","Mark Dacascos, Laurence Fishburne, Ian McShane, Halle Berry, Keanu Reeves",Chad Stahelski,"Netflix, Netflix basic with Ads ","Apple TV, Amazon Video, Google Play Movies, YouTube, Vudu, Microsoft Store, AMC on Demand ","Apple TV, Amazon Video, Google Play Movies, YouTube, Vudu, Microsoft Store, Spectrum On Demand ","Thunder Road, Lionsgate, 87Eleven",https://www.lionsgate.com/movies/john-wick-chapter-3-parabellum
Fractured,101,English,"Driving cross-country, Ray and his wife and daughter stop at a highway rest area where his daughter falls and breaks her arm. After a frantic rush to the hospital and a clash with the check-in nurse, Ray is finally able to get her to a doctor. While the wife and daughter go downstairs for an MRI, Ray, exhausted, passes out in a chair in the lobby. Upon waking up, they have no record or knowledge of Ray's family ever being checked in.",2019,Thriller,"gas station, hospital, doctor, police officer, alcoholic, accident","Lily Rabe, Stephen Tobolowsky, Sam Worthington, Adjoa Andoh, Lauren Cochrane",Brad Anderson,"Netflix, Netflix basic with Ads ",,,"Koji Productions, Crow Island Films, Macari/Edelstein, Paul Schiff Productions",https://www.netflix.com/title/80223997
The Platform,95,Spanish,"A mysterious place, an indescribable prison, a deep hole. An unknown number of levels. Two inmates living on each level. A descending platform containing food for all of them. An inhuman fight for survival, but also an opportunity for solidarity.",2019,"Drama, Science Fiction, Thriller","dystopia, survival, struggle for survival, secret prison, food shortage, social experiment","Antonia San Juan, Zorion Eguileor, Emilio Buale, Ivan Massagué, Alexandra Masangkay",Galder Gaztelu-Urrutia,"Netflix, Netflix basic with Ads ",,,"Basque Films, Mr. Miyagi, EiTB, TVE",http://www.elhoyolapelicula.com/index.php/en
Lady and the Tramp,111,English,"The love story between a pampered Cocker Spaniel named Lady and a streetwise mongrel named Tramp. Lady finds herself out on the street after her owners have a baby and is saved from a pack by Tramp, who tries to show her to live her life footloose and collar-free.",2019,"Family, Romance, Comedy","freedom, family, streetwise, live action and animation, live action remake","Ashley Jensen, Kiersey Clemons, Tessa Thompson, Justin Theroux, Thomas Mann",Charlie Bean,Disney Plus ,,,"Walt Disney Pictures, Taylor Made Entertainment",https://disneyplusoriginals.disney.com/movie/lady-and-the-tramp
Avengers: Endgame,181,English,"After the devastating events of Avengers: Infinity War, the universe is in ruins due to the efforts of the Mad Titan, Thanos. With the help of remaining allies, the Avengers must assemble once more in order to undo Thanos' actions and restore order to the universe once and for all, no matter what consequences may be in store.",2019,"Adventure, Science Fiction, Action","superhero, time travel, space travel, time machine, based on comic, sequel, alien invasion, superhero team, marvel cinematic universe (mcu), alternate timeline, father daughter relationship, sister sister relationship","Chris Hemsworth, Scarlett Johansson, Mark Ruffalo, Chris Evans, Robert Downey Jr.","Anthony Russo, Joe Russo",Disney Plus ,"Apple TV, Amazon Video, Google Play Movies, YouTube, Vudu, Microsoft Store, AMC on Demand ","Apple TV, Amazon Video, Google Play Movies, YouTube, Microsoft Store ",Marvel Studios,https://www.marvel.com/movies/avengers-endgame
Triple Frontier,125,English,"Struggling to make ends meet, former special ops soldiers reunite for a high-stakes heist: stealing $75 million from a South American drug lord.",2019,"Action, Thriller, Crime, Adventure","peru, cocaine, amazon rainforest, survival, drug cartel, drug lord, andes mountains, ex special forces, treasure heist","Garrett Hedlund, Pedro Pascal, Ben Affleck, Charlie Hunnam, Oscar Isaac",J.C. Chandor,"Netflix, Netflix basic with Ads ",,,Atlas Entertainment,http://www.netflix.com/triplefrontier
