Title,Runtime (minutes),Language,Overview,Release Year,Genre,Keywords,Actors,Directors,Stream,Buy,Rent,Production Companies,Website
Annabelle Comes Home,106,English,"Determined to keep Annabelle from wreaking more havoc, demonologists Ed and Lorraine Warren bring the possessed doll to the locked artifacts room in their home, placing her “safely” behind sacred glass and enlisting a priest’s holy blessing. But an unholy night of horror awaits as Annabelle awakens the evil spirits in the room, who all set their sights on a new target—the Warrens' ten-year-old daughter, Judy, and her friends.",2019,Horror,"supernatural, babysitter, priest, doll, creepy doll, jump scare, possessed doll, supernatural power, the conjuring universe","Patrick Wilson, Katie Sarife, Mckenna Grace, Madison Iseman, Vera Farmiga",Gary Dauberman,,"Apple TV, Google Play Movies, YouTube, Vudu, Microsoft Store, AMC on Demand ","Apple TV, Google Play Movies, YouTube, Vudu, Microsoft Store ","Atomic Monster, The Safran Company, New Line Cinema",https://www.warnerbros.com/movies/annabelle-comes-home
I Believe,89,English,A 9 year old boy experiences God's power in a supernatural way.,2019,"Family, Drama",None,"Rowan Smyth, Wilford Brimley, Matt Lindquist, Tom Sizemore, Jeremy London","Stacey Peretzki, Juergen Peretzki","Amazon Prime Video, Hoopla, UP Faith & Family Apple TV Channel ","Apple TV, Amazon Video, Google Play Movies, YouTube, Vudu ","Apple TV, Amazon Video, Google Play Movies, YouTube, Vudu ",Screen Savers Entertainment,http://www.ibelievethemovie.com/
Rambo: Last Blood,89,English,"After fighting his demons for decades, John Rambo now lives in peace on his family ranch in Arizona, but his rest is interrupted when Gabriela, the granddaughter of his housekeeper María, disappears after crossing the border into Mexico to meet her biological father. Rambo, who has become a true father figure for Gabriela over the years, undertakes a desperate and dangerous journey to find her.",2019,"Action, Thriller, Drama","post-traumatic stress disorder (ptsd), arizona, human trafficking, sequel, father figure, last stand, horse ranch, mexican american border, revenge plot, mexican cartel","Sylvester Stallone, Paz Vega, Sergio Peris-Mencheta, Adriana Barraza, Yvette Monreal",Adrian Grünberg,"fuboTV, Max, Max Amazon Channel ","Apple TV, Amazon Video, Google Play Movies, YouTube, Vudu, Microsoft Store, AMC on Demand ","Apple TV, Amazon Video, Google Play Movies, YouTube, Vudu, Microsoft Store ","Millennium Media, Templeton Media, Campbell Grobman Films, Dadi Film Group, Balboa Productions",https://rambo.movie
Aladdin,127,English,A kindhearted street urchin named Aladdin embarks on a magical adventure after finding a lamp that releases a wisecracking genie while a power-hungry Grand Vizier vies for the same lamp that has the power to make their deepest wishes come true.,2019,"Adventure, Fantasy, Romance, Family","hero, hustler, palace, sultan, flying carpet, musical, rags to riches, romance, monkey, family, first love, based on myths, legends or folklore, genie, arabian nights, live action and animation, live action remake","Marwan Kenzari, Will Smith, Navid Negahban, Mena Massoud, Naomi Scott",Guy Ritchie,Disney Plus ,"Apple TV, Amazon Video, Google Play Movies, YouTube, Vudu, Microsoft Store, AMC on Demand ","Apple TV, Amazon Video, Google Play Movies, YouTube, Microsoft Store, Spectrum On Demand ","Walt Disney Pictures, Rideback",https://movies.disney.com/aladdin-2019
Loop,10,English,"A non-verbal, autistic girl and a chatty boy are partnered on a canoeing trip. To complete their journey across an urban lake, they must both learn how the other experiences the world.",2019,"Animation, Family","autism, journey, canoeing","Madison Bandy, Louis Gonzales, Christiano ""Chachi"" Delgado, Asher Brodkey",Erica Milsom,Disney Plus ,,,Pixar,Unknown
Brightburn,91,English,"What if a child from another world crash-landed on Earth, but instead of becoming a hero to mankind, he proved to be something far more sinister?",2019,"Horror, Science Fiction, Thriller, Mystery","husband wife relationship, child murder, country life, super power, super villain, kansas state, father son relationship, mother son relationship, american countryside","Meredith Hagner, Matt Jones, Elizabeth Banks, David Denman, Jackson A. Dunn",David Yarovesky,"fuboTV, FXNow ","Apple TV, Amazon Video, Google Play Movies, YouTube, Vudu, Microsoft Store, AMC on Demand ","Apple TV, Amazon Video, Google Play Movies, YouTube, Vudu, Microsoft Store ","Troll Court Entertainment, Screen Gems, Stage 6 Films, The H Collective",https://www.brightburn.movie/
Toy Story 4,100,English,"Woody has always been confident about his place in the world and that his priority is taking care of his kid, whether that's Andy or Bonnie. But when Bonnie adds a reluctant new toy called ""Forky"" to her room, a road trip adventure alongside old and new friends will show Woody how big the world can be for a toy.",2019,"Family, Adventure, Animation, Comedy, Fantasy","friendship, cartoon, rescue mission, sequel, buddy, cowboy, duringcreditsstinger, toy comes to life","Annie Potts, Tom Hanks, Tony Hale, Tim Allen, Keegan-Michael Key",Josh Cooley,Disney Plus ,"Apple TV, Amazon Video, Google Play Movies, YouTube, Vudu, Microsoft Store, AMC on Demand ","Apple TV, Amazon Video, Google Play Movies, YouTube, Microsoft Store ","Walt Disney Pictures, Pixar",https://www.pixar.com/feature-films-toy-story-4
Hellboy,121,English,"Hellboy comes to England, where he must defeat Nimue, Merlin's consort and the Blood Queen. But their battle will bring about the end of the world, a fate he desperately tries to turn away.",2019,"Fantasy, Horror, Action, Adventure","london, england, secret society, based on comic, english countryside, reboot, tijuana mexico, nazi occultism, father son relationship, lucha libre, baba yaga, ailuranthropy, arthurian mythology","Milla Jovovich, Sasha Lane, Daniel Dae Kim, Ian McShane, David Harbour",Neil Marshall,"Peacock Premium, Starz Apple TV Channel ","Apple TV, Amazon Video, Google Play Movies, YouTube, Vudu, Microsoft Store, AMC on Demand ","Apple TV, Amazon Video, Google Play Movies, YouTube, Vudu, Microsoft Store, Spectrum On Demand ","Campbell Grobman Films, Dark Horse Entertainment, Millennium Media, Summit Entertainment, Boyana Film Studios, Lawrence Gordon Productions, Davis Films, Lionsgate",https://hellboy.movie
Spider-Man: Far From Home,129,English,"Peter Parker and his friends go on a summer trip to Europe. However, they will hardly be able to rest - Peter will have to agree to help Nick Fury uncover the mystery of creatures that cause natural disasters and destruction throughout the continent.",2019,"Action, Adventure, Science Fiction","venice, italy, superhero, school trip, europe, based on comic, sequel, destruction, aftercreditsstinger, duringcreditsstinger, marvel cinematic universe (mcu), tower of london","Samuel L. Jackson, Marisa Tomei, Jon Favreau, Tom Holland, Jake Gyllenhaal",Jon Watts,"Disney Plus, fuboTV, Starz Apple TV Channel ","Apple TV, Amazon Video, Google Play Movies, YouTube, Vudu, Microsoft Store, AMC on Demand ","Apple TV, Amazon Video, Google Play Movies, YouTube, Vudu, Microsoft Store ","Marvel Studios, Pascal Pictures, Columbia Pictures",https://www.marvel.com/movies/spider-man-far-from-home
Ford v Ferrari,153,English,"American car designer Carroll Shelby and the British-born driver Ken Miles work together to battle corporate interference, the laws of physics, and their own personal demons to build a revolutionary race car for Ford Motor Company and take on the dominating race cars of Enzo Ferrari at the 24 Hours of Le Mans in France in 1966.",2019,"Drama, Action, History","based on novel or book, car race, sports, car mechanic, biography, based on true story, le mans, racing, race car driver, 1960s","Caitríona Balfe, Josh Lucas, Jon Bernthal, Christian Bale, Matt Damon",James Mangold,fuboTV ,"Apple TV, Amazon Video, Google Play Movies, YouTube, Vudu, Microsoft Store, AMC on Demand ","Apple TV, Amazon Video, Google Play Movies, YouTube, Microsoft Store ","20th Century Fox, TSG Entertainment, Chernin Entertainment, Turnpike Films",https://www.foxmovies.com/movies/ford-v-ferrari
Dads,87,English,"A joyful exploration of modern fatherhood, this doc gathers the testimonies of dads around the world, from famous comedians to everyday parents. Their unfiltered stories speak to the beauty, struggles, and ridiculous hilarity of being a dad today.",2019,Documentary,fatherhood,"Ron Howard, Judd Apatow, Neil Patrick Harris, Jimmy Fallon, Bryce Dallas Howard",Bryce Dallas Howard,Apple TV Plus ,,,"Imagine Documentaries, Nine Muses Entertainment, Dove Men+Care, Unilever Entertainment",https://tv.apple.com/movie/umc.cmc.5voyewgcndqj0a3i9mp7hbloq
My Grandpa is an Alien,79,Croatian,"Una and an alien robot have 24 hours to find her Grandpa who was kidnapped by aliens. The extraordinary adventure leads to friendship, the rational robotic logic is replaced by emotions and Una's selfless love saves her partly alien family.",2019,"Adventure, Family, Science Fiction",woman director,"Ozren Grabarić, Lana Hranjec, Frano Mašković, Petra Polnišová, Nils Ole Oftebro","Dražen Žarković, Marina Andree Škop","Amazon Prime Video, Hoopla ","Amazon Video, Vudu ","Amazon Video, Vudu ","Hrvatska Radiotelevizija, Studio Dim, Filmbin AS, Wady Films, MasterFilm, Artileria, Senca Studio, Fabrika",Unknown
Godzilla: King of the Monsters,132,English,"Follows the heroic efforts of the crypto-zoological agency Monarch as its members face off against a battery of god-sized monsters, including the mighty Godzilla, who collides with Mothra, Rodan, and his ultimate nemesis, the three-headed King Ghidorah. When these ancient super-species, thought to be mere myths, rise again, they all vie for supremacy, leaving humanity's very existence hanging in the balance.",2019,"Science Fiction, Action","mexico, boston, massachusetts, giant monster, cryptozoology, eco terrorism, creature feature, rodan, kaiju, aftercreditsstinger, global threat, animal horror, king ghidorah, sunken city, mothra, godzilla, monsterverse","Zhang Ziyi, Millie Bobby Brown, Ken Watanabe, Vera Farmiga, Kyle Chandler",Michael Dougherty,"Max, TNT, TBS, tru TV ","Apple TV, Amazon Video, Google Play Movies, YouTube, Vudu, Microsoft Store, AMC on Demand ","Apple TV, Amazon Video, Google Play Movies, YouTube, Vudu, Microsoft Store ","Legendary Pictures, Huahua Media, TOHO",http://www.godzillamovie.com
El Camino: A Breaking Bad Movie,123,English,"In the wake of his dramatic escape from captivity, Jesse Pinkman must come to terms with his past in order to forge some kind of future.",2019,"Crime, Drama, Thriller","new mexico, drugs, meth lab, albuquerque, new mexico, crystal meth, based on tv series, methamphetamine","Matt Jones, Aaron Paul, Scott MacArthur, Charles Baker, Jesse Plemons",Vince Gilligan,"Netflix, Netflix basic with Ads ",,,"Sony Pictures Television Studios, Gran Via Productions, High Bridge Productions",https://www.netflix.com/title/81078819
6 Underground,128,English,"After faking his death, a tech billionaire recruits a team of international operatives for a bold and bloody mission to take down a brutal dictator.",2019,"Action, Comedy, Thriller","dictator, florence, italy, shootout, fictitious country, evil dictator, action packed, street shootout","Ben Hardy, Mélanie Laurent, Ryan Reynolds, Manuel Garcia-Rulfo, Adria Arjona",Michael Bay,"Netflix, Netflix basic with Ads ",,,"Skydance Media, Bay Films",https://www.netflix.com/title/81001887
Weathering with You,112,Japanese,"The summer of his high school freshman year, Hodaka runs away from his remote island home to Tokyo, and quickly finds himself pushed to his financial and personal limits. The weather is unusually gloomy and rainy every day, as if taking its cue from his life. After many days of solitude, he finally finds work as a freelance writer for a mysterious occult magazine. Then, one day, Hodaka meets Hina on a busy street corner. This bright and strong-willed girl possesses a strange and wonderful ability: the power to stop the rain and clear the sky.",2019,"Animation, Drama, Fantasy, Romance","japan, magic, climate change, rain, surrealism, weather, weather manipulation, romance, slice of life, tokyo, japan, orphan, summer, flood, japanese mythology, anime, time skip, supernatural power","Sei Hiraizumi, Nana Mori, Sakura Kiryu, Tsubasa Honda, Kotaro Daigo",Makoto Shinkai,"Max, Max Amazon Channel, Hoopla ","Apple TV, Amazon Video, Google Play Movies, YouTube, Vudu, Microsoft Store ","Apple TV, Amazon Video, Google Play Movies, YouTube, Vudu, Microsoft Store ","CoMix Wave Films, Story, TOHO, KADOKAWA, voque ting, East Japan Marketing & Communications, Lawson Entertainment, ""Weathering With You"" Film Partners",https://gkidstickets.com/us/weathering-with-you/
Pokémon Detective Pikachu,105,English,"In a world where people collect pocket-size monsters (Pokémon) to do battle, a boy comes across an intelligent monster who seeks to be a detective.",2019,"Action, Adventure, Fantasy","amnesia, detective, car crash, pocket monsters, whodunit, based on video game, missing person, missing parent, buddy comedy, neo-noir, live action and animation, pikachu character","Kathryn Newton, Justice Smith, Suki Waterhouse, Omar Chaparro, Ryan Reynolds",Rob Letterman,"Hulu, TNT, TBS, tru TV ","Apple TV, Amazon Video, Google Play Movies, YouTube, Vudu, Microsoft Store, AMC on Demand ","Apple TV, Amazon Video, Google Play Movies, YouTube, Vudu, Microsoft Store ","Legendary Pictures, The Pokémon Company, TOHO",http://www.detectivepikachumovie.net/
Vivarium,97,English,"A young woman and her fiancé are in search of the perfect starter home. After following a mysterious real estate agent to a new housing development, the couple finds themselves trapped in a maze of identical houses and forced to raise an otherworldly child.",2019,"Science Fiction, Thriller, Mystery, Horror","baby, suburbia, suburb, trapped, body bag, real estate agent","Jesse Eisenberg, Imogen Poots, Jonathan Aris, Senan Jennings, Éanna Hardwicke",Lorcan Finnegan,"Netflix, Netflix basic with Ads ","Apple TV, Amazon Video, Google Play Movies, YouTube, Vudu, Microsoft Store ","Apple TV, Amazon Video, Google Play Movies, YouTube, Vudu, Microsoft Store ","Fantastic Films, Frakas Productions, Lovely Productions, XYZ Films, PingPongFilm, Saban Films",https://www.vertigoreleasing.com/portfolio/vivarium/
How to Train Your Dragon: Homecoming,22,English,"It's been ten years since the dragons moved to the Hidden World, and even though Toothless doesn't live in New Berk anymore, Hiccup continues the holiday traditions he once shared with his best friend. But the Vikings of New Berk were beginning to forget about their friendship with dragons. Hiccup, Astrid, and Gobber know just what to do to keep the dragons in the villagers' hearts. And across the sea, the dragons have a plan of their own...",2019,"Animation, Fantasy, Adventure, Action, Family","dragon, short film","Christopher Mintz-Plasse, Craig Ferguson, Jay Baruchel, Gerard Butler, America Ferrera",Tim Johnson,Hulu ,Vudu ,,DreamWorks Animation,Unknown
The Intern - A Summer of Lust,108,English,"The story of Maddie who leaves her hometown in the United States for the sensual streets of Barcelona to seize the opportunity to do an internship for erotic filmmaker Erika Lust. At first, she is overwhelmed by her new life and her new job, the new experiences and people she's being confronted with. But soon, sparked by her dreamy roommate Michael and her new friends, the shy All-American girl experiences a sexual awakening she could have never imagined in her wildest dreams. Meanwhile, her sister Paisely is worried about her disappearance and makes it her mission to find her. Will Paisley succeed or will she be lured into the heat of a European summer? This is a tale of sexual awakenings, erotic desire, curiosity and pleasure; this is a summer of Lust.",2019,Drama,erotic movie,"Bishop Black, Michael Vegas, Kali Sudhra, Casey Calvert, Lena Anderson",Erika Lust,,,,Erika Lust Films,Unknown
Star Wars: The Rise of Skywalker,142,English,"The surviving Resistance faces the First Order once again as the journey of Rey, Finn and Poe Dameron continues. With the power and knowledge of generations behind them, the final battle begins.",2019,"Adventure, Action, Science Fiction",space opera,"Mark Hamill, Adam Driver, Daisy Ridley, John Boyega, Carrie Fisher",J.J. Abrams,Disney Plus ,"Apple TV, Amazon Video, Google Play Movies, YouTube, Vudu, Microsoft Store, AMC on Demand ","Apple TV, Amazon Video, Google Play Movies, YouTube, Microsoft Store ","Lucasfilm Ltd., Bad Robot",https://www.starwars.com/films/star-wars-episode-ix-the-rise-of-skywalker
Fantastic Return To Oz,80,Russian,"A year to the day after Dorothy and the people of the Emerald City defeated Urfin Jus, the villain is trying to exact his revenge. To command the army of Carraci, however, Urfin needs not only the magic book, but also Dorothy’s silver slippers. The slippers are safely hidden away in Dorothy’s house. Unfortunately, Dorothy’s guest, Tim, is overcome by curiosity and picks up the shoes, accidentally transporting himself, Dorothy and the slippers to the Land of Oz. The Emerald City and its citizens are in danger once again.",2019,Animation,None,"Yekaterina Gorokhovskaya, Konstantin Khabenskiy, Dmitriy Dyuzhev, Dimitri Vysotsky, Aleksandr Bykovsky",Fedor Dmitriev,,,,"Melnitsa Animation Studio, CTB Film Company, Cinema Foundation of Russia",Unknown
Terminator: Dark Fate,128,English,"Decades after Sarah Connor prevented Judgment Day, a lethal new Terminator is sent to eliminate the future leader of the resistance. In a fight to save mankind, battle-hardened Sarah Connor teams up with an unexpected ally and an enhanced super soldier to stop the deadliest Terminator yet.",2019,"Science Fiction, Adventure, Action","helicopter, mexico city, mexico, artificial intelligence (a.i.), cyborg, dystopia, time travel, sequel, plane crash, terminator","Natalia Reyes, Gabriel Luna, Mackenzie Davis, Linda Hamilton, Arnold Schwarzenegger",Tim Miller,"TNT, TBS, tru TV ","Apple TV, Amazon Video, Google Play Movies, YouTube, Vudu, Microsoft Store, AMC on Demand ","Apple TV, Amazon Video, Google Play Movies, YouTube, Vudu, Microsoft Store ","20th Century Fox, Skydance Media, Paramount, Tencent Pictures, TSG Entertainment, Lightstorm Entertainment",https://www.paramountmovies.com/movies/terminator-dark-fate
Dumbo,112,English,"A young elephant, whose oversized ears enable him to fly, helps save a struggling circus, but when the circus plans a new venture, Dumbo and his friends discover dark secrets beneath its shiny veneer.",2019,"Family, Fantasy, Adventure","elephant, circus, missouri, remake, live action and animation, 1910s, live action remake, dumbo","Danny DeVito, Colin Farrell, Eva Green, Alan Arkin, Michael Keaton",Tim Burton,Disney Plus ,"Apple TV, Amazon Video, Google Play Movies, YouTube, Vudu, Microsoft Store, AMC on Demand ","Apple TV, Amazon Video, Google Play Movies, YouTube, Microsoft Store, Spectrum On Demand ","Tim Burton Productions, Walt Disney Pictures, Infinite Detective, Secret Machine Entertainment, British Film Commission, South Australian Film Corporation",https://movies.disney.com/dumbo-2019
Jumanji: The Next Level,123,English,"As the gang return to Jumanji to rescue one of their own, they discover that nothing is as they expect. The players will have to brave parts unknown and unexplored in order to escape the world’s most dangerous game.",2019,"Adventure, Comedy, Fantasy","magic, animal attack, body-swap, adventurer, superhuman strength, duringcreditsstinger, action hero, trapped in a game","Dwayne Johnson, Awkwafina, Jack Black, Karen Gillan, Kevin Hart",Jake Kasdan,"Starz Apple TV Channel, Starz Roku Premium Channel, Starz, Starz Amazon Channel ","Apple TV, Amazon Video, Google Play Movies, YouTube, Vudu, Microsoft Store, AMC on Demand ","Apple TV, Amazon Video, Google Play Movies, YouTube, Vudu, Microsoft Store, Spectrum On Demand ","Columbia Pictures, Seven Bucks Productions, Matt Tolmach Productions, The Detective Agency",https://www.sonypictures.com/movies/jumanjithenextlevel
Kitbull,9,English,"An unlikely connection sparks between two creatures: a fiercely independent stray kitten and a pit bull. Together, they experience friendship for the first time.",2019,"Animation, Family, Drama","friendship, cat, dog, animal, short film",,Rosana Sullivan,Disney Plus ,,,Pixar,https://www.pixar.com/sparkshorts#kitbull1
Brian Banks,99,English,An All-American football player's dreams to play in the NFL are halted when he is falsely accused of rape and sent to prison.,2019,Drama,"sports, biography","Tiffany Dupont, Sherri Shepherd, Greg Kinnear, Melanie Liburd, Aldis Hodge",Tom Shadyac,"Hulu, Hoopla ","Apple TV, Amazon Video, Google Play Movies, YouTube, Vudu, Microsoft Store, AMC on Demand ","Apple TV, Amazon Video, Google Play Movies, YouTube, Vudu, Microsoft Store ","ShivHans Pictures, Gidden Media",Unknown
Breakthrough,116,English,"Tragedy strikes when a woman named Joyce's son falls through the ice on a frozen lake and is trapped underwater for over 15 minutes. After being rushed to the hospital, the 14-year-old boy continues to fight for his life as Joyce, her husband and their pastor stay by his bedside and pray for a miracle.",2019,Drama,"coma, based on novel or book, miracle, family drama, based on memoir or autobiography, teenage boy, broken ice, christian faith, independent film","Topher Grace, Marcel Ruiz, Josh Lucas, Chrissy Metz, Mike Colter",Roxann Dawson,fuboTV ,"Apple TV, Amazon Video, Google Play Movies, YouTube, Vudu, Microsoft Store, AMC on Demand ","Apple TV, Amazon Video, Google Play Movies, YouTube, Microsoft Store, Spectrum On Demand ","Fox 2000 Pictures, 20th Century Fox",https://breakthroughmovie.com/
47 Meters Down: Uncaged,90,English,"Four teenage girls go on a diving adventure to explore a submerged Mayan city. Once inside, their rush of excitement turns into a jolt of terror as they discover the sunken ruins are a hunting ground for deadly great white sharks. With their air supply steadily dwindling, the friends must navigate the underwater labyrinth of claustrophobic caves and eerie tunnels in search of a way out of their watery hell.",2019,"Horror, Drama, Adventure","mexico, diving, maya civilization, shark attack, animal attack, altar, water monster, sequel, teenage girl, scuba diving, creature, underwater, shark, great white shark, ruins, eaten by animal, cave diving","Brec Bassinger, Corinne Foxx, Sophie Nélisse, Sistine Rose Stallone, Brianne Tju",Johannes Roberts,"Netflix, Netflix basic with Ads ","Apple TV, Amazon Video, Google Play Movies, YouTube, Vudu, Microsoft Store, AMC on Demand ","Apple TV, Amazon Video, Google Play Movies, YouTube, Vudu, Microsoft Store ","The Fyzz, Lionsgate",https://www.47metersdownuncagedmovie.com
Cold Pursuit,119,English,"The quiet family life of Nels Coxman, a snowplow driver, is upended after his son's murder. Nels begins a vengeful hunt for Viking, the drug lord he holds responsible for the killing, eliminating Viking's associates one by one. As Nels draws closer to Viking, his actions bring even more unexpected and violent consequences, as he proves that revenge is all in the execution.",2019,"Action, Crime, Thriller, Comedy","drug dealer, dark comedy, colorado, revenge, gun battle, snow","Nicholas Holmes, Liam Neeson, Tom Bateman, Laura Dern, Tom Jackson",Hans Petter Moland,"Netflix, Netflix basic with Ads ","Apple TV, Amazon Video, Google Play Movies, YouTube, Vudu, Microsoft Store, AMC on Demand ","Apple TV, Amazon Video, Google Play Movies, YouTube, Vudu, Microsoft Store, Spectrum On Demand ","StudioCanal, Paradox Produksjon, MAS Productions, Summit Entertainment, Canal+, Ciné+",https://coldpursuit.movie
The Art of Racing in the Rain,109,English,"A family dog – with a near-human soul and a philosopher's mind – evaluates his life through the lessons learned by his human owner, a race-car driver.",2019,"Drama, Romance","friendship, washington dc, usa, based on novel or book, car race, sports, reincarnation, racing, race car driver, dog, animal, pets, father daughter relationship, animal narrator","Kevin Costner, Milo Ventimiglia, Ian Lake, Martin Donovan, Amanda Seyfried",Simon Curtis,"Disney Plus, fuboTV ","Apple TV, Amazon Video, Google Play Movies, YouTube, Vudu, Microsoft Store, AMC on Demand ","Apple TV, Amazon Video, Google Play Movies, YouTube, Microsoft Store, Spectrum On Demand ","Original Film, Shifting Gears Productions, Fox 2000 Pictures, Starbucks Entertainment",https://foxmovies.com/movies/the-art-of-racing-in-the-rain
Gemini Man,117,English,"Henry Brogan is an elite 51-year-old assassin who's ready to call it quits after completing his 72nd job. His plans get turned upside down when he becomes the target of a mysterious operative who can seemingly predict his every move. To his horror, Brogan soon learns that the man who's trying to kill him is a younger, faster, cloned version of himself.",2019,"Science Fiction, Action, Thriller","hitman, clone","Mary Elizabeth Winstead, Will Smith, Clive Owen, Douglas Hodge, Benedict Wong",Ang Lee,"TNT, TBS, tru TV ","Apple TV, Amazon Video, Google Play Movies, YouTube, Vudu, Microsoft Store, AMC on Demand ","Apple TV, Amazon Video, Google Play Movies, YouTube, Vudu, Microsoft Store ","Skydance Media, Jerry Bruckheimer Films, Alibaba Pictures Group, Fosun Pictures, Paramount, Gobierno de Colombia, Hungarian National Film Fund",http://skydance.com/film/gemini-man/
